Stock,Comment,Commented By,Timestamp
Deepak Nitrite,deepak  ntr  is  70  rupees  above  yesterday  close  for  now  reason   rejected  increase  in  anti  dumping  duties  for  chemicals  but  still  operator  is  creating  fomo  it  should  be  down  100  rupees  today  instead  of  rising,ThefabulousPenguin,2024-09-04 13:01:00
Deepak Nitrite,no  retailers  left  on  this  forum  means  its  been  abandoned  by  retailers,ThefabulousPenguin,2024-09-04 12:26:00
Deepak Nitrite,its  moving  up  in  falling  market  it  can  move  4-5  percent  easily,ChachaChaudhary,2024-09-04 11:48:00
Deepak Nitrite,"Deepak  Nitrite  all  salling  products  average  25%  UP,  65  DAYS",vijay1967,2024-09-04 11:19:00
Deepak Nitrite,buy  deepaknntr  moved  above  20  dma  and  is  looking  very  strong,ChachaChaudhary,2024-09-04 09:39:00
Deepak Nitrite,"ACHIEVED  3000  target  hold  it  investors  stock  for  long  term  ,  enjoy  investing  not  for  traders  and  operator.  others  pl  exit  the  forum  as  they  will  be  sad  once  it  is  3000  missing  feelings  NEXT  YEAR  4000  LONG  TERTHIS  YEAR  3500  M  10000  FOR  STBLE  MINDED  INVESTOTRS  ONLY",CBI stocks,2024-09-03 16:36:00
Deepak Nitrite,I  think  you  are  associated  with  Deepak  Nitrite  hence  speaking  the  words  on  its  behalf.  Search  your  own  how  many  companies  were  shut  down  due  to  lack  of  investors  confidence  in  India  and  also  in  abroad.  Healthy  financial  ratios  would  not  help  investors/shareholders  to  improve  their  wealth.  Kindly  note  and  stop  favoring  the  company.,maddrik007,2024-09-02 12:21:00
Deepak Nitrite,RK0079..  Yes  it  is  in  consolidation  mode  since  2021  and  so  is  the  index..  2024  onwards  things  would  change  and  breakout  in  this  counter  would  surely  happen  with  the  launch  of  their  new  products,meghma,2024-09-01 06:08:00
Deepak Nitrite,"Meghma  you  must  have  made  250  percent  profits  as  price  was  under  600  back  then  .  That  is  so  interesting  .  My  case  ,  have  been  holding  this  since  April  2021  ,  the  stock  keep  hovering  in  the  same  range  since  2  years  .",RK0079,2024-09-01 05:17:00
Deepak Nitrite,Lena  bank..  Delivery  rate  tend  to  reduce  when  a  stock  is  at  higher  levels  and  it  springs  no  surprise  to  me  when  I  see  declining  momentum  in  delivery  orders..  Next  spurt  it  would  happen  only  when  positive  things  emerge  in  this  counter  and  then  we  would  see  increase  in  delivery  order,meghma,2024-08-31 16:17:00
Deepak Nitrite,"My  message  to  skp,  suba,,  and  fabulous  penguin  is  that  I  am  holding  this  counter  since  July  of  2020  with  a  return  of  seventy  nine  percent  as  on  today..  Wealth  can  be  created  only  by  staying  long  in  good  companies  and  shorters  in  general  get  vanished  into  thin  air  over  a  period  of  time.",meghma,2024-08-31 15:02:00
Deepak Nitrite,"What  Prabhudas  Liladhar  mentioned  has  not  come  true,  look  at  the  price  thesedays.",LENABANK,2024-08-31 15:01:00
Deepak Nitrite,Quarterly  Net  Profit  at  Rs.  crore  in  June  2023  down  36.11%  from  Rs.  crore  in  June  2022.,skp9988,2024-08-31 11:22:00
Deepak Nitrite,"deepak  nitrite  consolidated  june  2023  net  sales  at  rs  1,768.34  crore,  down  14.07%  y-o-y",skp9988,2024-08-31 10:55:00
Deepak Nitrite,"Prabhudas  Lilladher  recommended  reduce  rating  on  Deepak  Nitrite  with  a  target  price  of  Rs  1803  in  its  research  report  dated  August  09,  2023.",skp9988,2024-08-31 10:52:00
Deepak Nitrite,how  do  you  know  its  operator  moves  and  only  how  long  is  profitable?,skp9988,2024-08-31 10:42:00
Deepak Nitrite,it  looks  like  dn  is  today  trending  in  confusing  side,skp9988,2024-08-31 10:24:00
Deepak Nitrite,dont  short  its  operator  move  u  cant  get  any  profitable  exit  in  shorts   go  long  if  want  to  trade,ThefabulousPenguin,2024-08-31 08:17:00
Deepak Nitrite,If  DN  breaks  2350  then  journey  towards  ATH  begins  .,RK0079,2024-08-31 02:46:00
Deepak Nitrite,immediately  book  profit  and  immediately  exit  for  lower  tgt  is  below  2150rs,sach1969,2024-08-30 13:35:00
Deepak Nitrite,I  am  repeating  again  to  book  profit  as  it  may  fall  any  time,BSuba,2024-08-30 12:49:00
Deepak Nitrite,i  have  not  sorted  any  shares  .  i  am  just  sharing  my  views  as  per  technical  charts  and  brokerage  opinions.,BSuba,2024-08-30 11:59:00
Deepak Nitrite,just  wait  and  watch  it  will  be  2100  by  eod,BSuba,2024-08-30 10:50:00
Deepak Nitrite,deepakntr  to  2200  se  2100  ko  jagah  2232  aa  gaya.,GN80,2024-08-30 09:58:00
Deepak Nitrite,is  it  sustainable  ?,ashuOC,2024-08-30 09:53:00
Deepak Nitrite,"thankyou  deepak  nitrate,  srf  and  aarti  industries  for  making  our  morning,  guys  hope  you  all  have  booked  good  gains  in  btst  and  trailed  the  sl.  god  bless.",neha_0103,2024-08-30 09:47:00
Deepak Nitrite,heavy  fall  is  expected  just  book  full  profit  at  2200  and  sell  fast  at  2200  for  target  of  2100,BSuba,2024-08-30 09:26:00
Deepak Nitrite,"book  profits  &  sell  for  the  target  of  2100,  can  re-enter  at  2100  levels...  very  risky  to  buy  at  cmp.",SubhashTurimella,2024-08-30 08:53:00
Deepak Nitrite,just  sell  in  the  opening  as  its  going  to  fall  towards  2100  again,BSuba,2024-08-30 00:08:00
Deepak Nitrite,what  is  the  reason  for  sudden  spike  in  share  price,skapadia1,2024-08-29 21:40:00
Deepak Nitrite,buy  given  at  1960  for  Deepak  nitrite  for  target  of  2100  and  heavy  gain  today  2170  book  it  and  enjoy  one  may  not  buy  at  this  level  wait  for  2100  now.,BSuba,2024-08-29 20:49:00
Deepak Nitrite,"Guys  hope  you  all  have  booked  good  gains  in  Deepak  Nitrate,  can  be  carried  as  BTST  as  well.  Thanks.",neha_0103,2024-08-29 15:24:00
Deepak Nitrite,"Thank  you  SRF  and  deepak  nitrate  for  making  our  afternoon,  hope  you  guys  have  booked  and  trailed  the  sl  at  cost  guys.",neha_0103,2024-08-29 15:20:00
Deepak Nitrite,sell  deepak  nitrate  at  CMP  target  2100  by  today,raambharath,2024-08-29 14:41:00
Deepak Nitrite,"B&K  Sales  on  Deepak  Nitrite  1)  Phenol  acetone  prices  we  believe  have  bottomed  out  and  are  up  6%  MoM  -  key  trigger  for  the  Co.  2)  Just  like  PLI  in  IT  products,  PLI  in  base  chemicals  is  expected  soon  though  timelines  are  unknown.  3)  China  is  trying  desperately  hard  to  stimulate  its  economy  -  whether  they  will  be  successful  or  not  is  up  for  debate  but  for  now  one  is  starting  to  see  traction  in  base  chemical  prices  as  well  like  Phenol  acetone,  caustic  soda  and  soda  ash.  Commodity  Chemicals  as  a  segment  has  consolidated  for  long  -  although  the  specialty  chemicals  space  will  take  longer  to  recover,  commodity  chemicals  can  exhibit  a  quicker  turnaround.  Deepak  Nitrite  is  a  good  proxy  to  this  theme  -  Recommend  BUY!",VF1981,2024-08-29 13:06:00
Deepak Nitrite,hold  kro  chaina  going  to  stop  production  world  demand  depends  upon  India,chatgpt,2024-08-29 12:48:00
Deepak Nitrite,whats  the  reason  for  such  a  spike..  should  we  book  some  profits  or  wait  .  pls  suggest  ..  retail  buyer,girishmak,2024-08-29 12:29:00
Deepak Nitrite,Just  In:  Deepak  Nitrite  hikes  prices  of  majority  of  its  products  by  10%  as  of  today  itself  as  per  chemical  dealers,VF1981,2024-08-29 11:43:00
Deepak Nitrite,"there  are  other  good  stocks,  these  are  growing  girms,  market  leader  and  can  be  hold  for  very  long  term  pgel  xpro  india  rajratan  global  wire  trident  sfl  holding  time  can  be  5  years,  10  years  or  more  there  are  other  good  stocks,  these  are  growing  girms,  market  leader  and  can  be  hold  for  very  long  term  pgel  xpro  india  rajratan  global  wire  trident  sfl  holding  time  can  be  5  years,  10  years  or  more",jet25,2024-08-29 11:11:00
Deepak Nitrite,first  tgt  2121  if  holds  then  2168  and  then2272,sanjogn,2024-08-29 10:26:00
Deepak Nitrite,lets  see  only  thing  which  I  see  yesterday  was  short  rollovers.....  if  anti  dunpingnduty  increase  I  might  have  to  go  long,ChachaChaudhary,2024-08-28 08:11:00
Deepak Nitrite,r  u  dreaming  chacha  Chaudhary,Aryan172003,2024-08-27 22:01:00
Deepak Nitrite,"Look  at  last  2  years  quartely  shareholding.  DII  holding  has  increased  considerably.  stock    moving  from  weak  hand  to  strong  hands.  Huge  accumulation  happening  for  3  years  now.
Dont  sell.  Hold  on  and  accumulate.",sumandasonly4u,2024-08-27 16:57:00
Deepak Nitrite,traders  who  bought  chemicals  stocks  on  listening  anuj  singhal  can  direct  transfer.  money  to  operator  bank  account  .....  ask  anuj  singhal  for  operators  bank  details,ThefabulousPenguin,2024-08-27 13:09:00
Deepak Nitrite,bhai  anti  dunpingnduty  ki  positive  news  par  10  percent    gira  tha   value  buying  ki  news  par  bhi  10  percent  na  goray  look  for  2500  in  next  series,ThefabulousPenguin,2024-08-27 12:35:00
Deepak Nitrite,please  buy  as  much  as  u  can  so  that  shorts  get  stoplossed   i  will  go  short  .....,ThefabulousPenguin,2024-08-27 12:17:00
Deepak Nitrite,all  news  channels  analyst  forums  are  giving  buy  call  on  chemicals  today  so  it  means  too  many  retailers  shorted  it   shorts  have  been  covered  it  seems  should  go  in  red  .....,ThefabulousPenguin,2024-08-27 12:05:00
Deepak Nitrite,keep  eye  on  himatsigka  textile  stock  double,mksmlr,2024-08-27 11:36:00
Deepak Nitrite,buy  Deepak  nitrite  tgt  3300  very  soon,anibillon,2024-08-27 09:51:00
Deepak Nitrite,buy  deepak  nitrite  around  2840  for  a  target  of  3150  in  september,ValueBuys17,2024-08-25 10:21:00
Deepak Nitrite,anti  dumping  duty  hai  tabhi  to  profit  upar  gaye  but  they  want  anti  dumping  duty  to  increase  .....  which  is  very  greedy  of  them  ......  and  this  tells  the  story  of  chemicals  sector   phenol  has  not  recovered  from  multiyear  lows  its  very  expensive,ThefabulousPenguin,2024-08-24 19:26:00
Deepak Nitrite,some  random  sell-off.  the  anti  dumping  duty  is  still  on.  that  should  help  dn.,metashare,2024-08-23 15:49:00
Deepak Nitrite,bc  kya  hora  hai    ..dubadiya  sala,AmoghDigsangikar,2024-08-23 15:42:00
Deepak Nitrite,blast  to  ho  hi  raha   direction  me...,newinvestorengg,2024-08-23 15:38:00
Deepak Nitrite,blasting  in  wrong  direction  ????,Highguy1,2024-08-23 15:26:00
Deepak Nitrite,deepak  baba  to  govt    ye  kya  hogaya  kuch  to  karo  bhai   dumping  duty  badao   bachao,ThefabulousPenguin,2024-08-23 11:04:00
Deepak Nitrite,yesterday  fall  in  DN  was  trap  in  future.  it  may  fall  further  to  make  panic  but  later  it  should  test  new  high.  so  keep  patience,rajveer2217,2024-08-23 08:37:00
Deepak Nitrite,all  those  who  are  saying  chemical  stoc    k  fall  should  check  their  words.  in  chemical  sector  mutual  fund  and  fii  are  increasing  their  stake.  and  Deepak  nitrate  is  capex  is  coming  next  year.  so  it  should  test  new  high.,rajveer2217,2024-08-23 08:35:00
Deepak Nitrite,all  chemicals  stocks  should  make  52  week  lows  but  they  are  not  .....  there  is  chemical  prices  are  at  multi  year  lows  in  global  markets  ....,ThefabulousPenguin,2024-08-22 22:47:00
Deepak Nitrite,down  by  140   closed  in   stock  in  particular  cant  sustain   chemical  stocks  are  in  green,newinvestorengg,2024-08-22 20:23:00
Deepak Nitrite,with  positive  news  stocks  was  down  by  Rs  140    from  todays  high  what  the  hell  ????,AmoghDigsangikar,2024-08-22 16:27:00
Deepak Nitrite,kahan  gaya  investor  bhai  .....  chemical  prices  itna  neechay  kyun  ja  rha  kya  problem  hai  batao  to,ChachaChaudhary,2024-08-22 11:37:00
Deepak Nitrite,it  should  get  de  rate  if  situation  of  chemicals  in  global  markets  is  so  bad  that  it  needs  govt  to  increase  anti  dumping  duty  2000-2500  will  be  the  correct  level  s,ChachaChaudhary,2024-08-22 11:21:00
Deepak Nitrite,chemicals  companies  profits  doubling  and  more  market  cap  increasing  now  they  want  anti  dumping  duty  to  increase   greedy,ThefabulousPenguin,2024-08-22 10:02:00
Deepak Nitrite,industries  consuming  isopropyl  alcohol  will  not  allow  anti  dumping  duty,ThefabulousPenguin,2024-08-22 09:27:00
Deepak Nitrite,buy  Himatsingka  textile  stock  shortly  double,mksmlr,2024-08-22 09:21:00
Deepak Nitrite,anti  dumping  duty  can  save  margins  of  indian  business   operator  positioned  yesterday  only,ChachaChaudhary,2024-08-22 08:54:00
Deepak Nitrite,Today  again  moved  towards  Rs  3000,jayantijain78,2024-08-20 07:34:00
Deepak Nitrite,as  i  have  said  there  is  no  recovery  in  chemicals  prices  globally  since  last  2  years  .....  all  seems  like  a  fluke  to  me,ThefabulousPenguin,2024-08-13 12:23:00
Deepak Nitrite,"if  iran  israel  conflict  starts  again,  crude  oil  prices  can  increase  impacting  deepak  bottomline...  short  term  guys  can  put  sl  of  2840",Anupam777,2024-08-13 11:47:00
Deepak Nitrite,why  sudden  fall.  any  specific  reason.,darisa,2024-08-13 10:55:00
Deepak Nitrite,why  sudden  fall.  Any  specific  reason.,darisa,2024-08-13 10:52:00
Deepak Nitrite,sebi  chief  should  resign  it  cant  even  stop  insider  trading  and  front  running  by  promoters,ChachaChaudhary,2024-08-12 22:21:00
Deepak Nitrite,try  m.stocks  .  It  is  zero  brokerage  platform  subject  to  payment  one  time  payment  of  Rs.  999.,Abulkahar,2024-08-07 10:39:00
Deepak Nitrite,Go  to  Mirea  s  m.stocks.,Abulkahar,2024-08-07 10:36:00
Deepak Nitrite,Tomorrow  the  concall  is  there  at  3  pm  will  be  interesting  to  hear  what  commentary  the  mgt  gives.  Dont  forget  chemical  stocks  are  rebounding  and  next  quarter  should  be  even  stronger  so  declines  can  be  used  to  add.  Even  the  promoter  has  bought  in  June  end  above  2500  so  that  gives  a  good  amount  of  confidence.  Lot  of  shorts  were  built  up  today  as  futures  have  gone  into  a  discount  for  sept  and  Oct.  Any  short  squeeze  and  we  could  see  a  upward  rally.,ahuja.12,2024-08-05 21:45:00
Deepak Nitrite,"Results  are  good,  revenue  beats  Bloomberg  estimates  by  38cr  while  PAT  misses  estimates  by  7-8  cr",rishi30790,2024-08-05 20:48:00
Deepak Nitrite,Results  are  not  bad  but  global  factors  coupled  with  geo  political  tensions  will  bring  the  price  down  by  at  least  10  percent  from  current  level,chitgo,2024-08-05 20:35:00
Deepak Nitrite,"yoy  increase  in  np  and  topline.  qoq  topline  up  but  np  not  comparable  since  there  was  a  exceptional  item  of  a  insurance  claim  recd  last  qtr.  Company  on  track  to  do  well  as  phenol  prices  have  hit  record  high,  mkt  is  turbulent  can  show  strength  once  dust  settles  around  us  markets.",ahuja.12,2024-08-05 20:22:00
Deepak Nitrite,Result  unload  bse  web  site.,sk1963,2024-08-05 19:38:00
Deepak Nitrite,"please  share  the  latest  updates  about  the  q1  results,  revenue  np  and  EPS  etc",katariya4me,2024-08-05 18:37:00
Deepak Nitrite,"ACHIEVED    3000  target  hold  it  investors  stock  for  long  term  ,  enjoy  investing  not  for  traders  and  operator.  others  pl  exit  the  forum  as  they  will  be  sad  once  it  is  3000  missing  feelings
NEXT  YEAR  4000
LONG  TERTHIS  YEAR  3500
M  10000  FOR  STBLE  MINDED  INVESTOTRS  ONLY",CBI stocks,2024-08-04 22:38:00
Deepak Nitrite,"Mo  multiplier  you  are  genius...
within  few  days  it  will  come  to  Rs  117...
I  will  sell  when  it  touches  Rs  100",Jagrut_Nagrik,2024-08-02 17:18:00
Deepak Nitrite,Deepak  Nitrate  cloud  has  reached  to    a  level  to  burst  anytime….  Not  the  GOd  but  can  tell  you  it  will  burst  soon.,MoMultiplier,2024-08-02 07:16:00
Deepak Nitrite,then  when  it  falls  please  tell,aksiitg,2024-07-31 22:23:00
Deepak Nitrite,Then  it  is  good  sign.  You  dont  want  to  take  profits.  We  are  strucked  here  since  2021.  What  is  the  pain  to  you  if  the  stock  raise.,darisa,2024-07-31 16:41:00
Deepak Nitrite,kitna  insider  trading  ho  rha  hai  idhar  result  nhi  aa  rha  hai  par  upmove  daily  aa  rha  hai  promoter  bhi  khareed  rha  hai,ThefabulousPenguin,2024-07-31 15:35:00
Deepak Nitrite,It  will  definitely  fall  and  retest  2900  level  before  result,aksiitg,2024-07-31 11:35:00
Deepak Nitrite,moreover  chemicals  are  back  in  action.  hopefully  it  will  also  give  good  returns.,Mandeep3,2024-07-31 11:14:00
Deepak Nitrite,moreover  chemicals  are  back  in  action.  hopefully  it  will  also  give  good  returns.,Mandeep3,2024-07-31 11:08:00
Deepak Nitrite,moreover  chemicals  are  back  in  action.  hopefully  it  will  also  give  good  returns.,Mandeep3,2024-07-31 11:05:00
Deepak Nitrite,results  agaya  kya  deepak  ntr  ka   koi  manipulate  kar  rha  hai  price  to  mein  kaun  hota  hoon  roknay  waala   bhi  200  ka  chal  rha  hai  to  market  hi  aisa  hai,ThefabulousPenguin,2024-07-30 18:46:00
Deepak Nitrite,3600  coming  soon  then  4200,RK0079,2024-07-30 16:59:00
Deepak Nitrite,"price  of  phenol  is  at  an  all  time  high,  benzene  price  at  an  all  time  low.  results  are  going  to  be  fantastic.  Rerating  in  this  counter  after  results.  stay  tuned.",rock5620,2024-07-30 15:42:00
Deepak Nitrite,Penguin  uncle  has  disappeared  -  seems  gone  back  to  Antartica,lordly,2024-07-30 08:16:00
Deepak Nitrite,deepak  nitrate  target  4520,ajapatel,2024-07-25 15:01:00
Deepak Nitrite,INVESTORS  AND  STOCK  MARKET  INVESTORS  WTSUP  GROUP  BY  CLIK  ON   to  this  new  research  India  is  going  to  witness  its  biggest  potential  growth  run  in  midcap  stocks  this  decade  clik  on,bsbhx,2024-07-25 11:10:00
Deepak Nitrite,tmrw  deepakntr  will  test  2650........,raju20089116,2024-07-23 22:05:00
Deepak Nitrite,"Don’t  sell  this  stock  …  it  is  portfolio  stock  long  term  investors  will  b  rewarded,  but  when  company  will  give  bonus  issue  so  huge  reserves  …  In  AGM  investors  should  raise  this  question.",ssm58,2024-07-18 17:12:00
Deepak Nitrite,"abhi  quarterly  result  aayega..  150-200  neeche  jane  m  time  nhi  lagega...
history  can  be  check..",mayamk,2024-07-16 13:54:00
Deepak Nitrite,A  long  consolidation  in  this  stock.  It  is  ready  for  multi-  month  break  out.,bulpartha,2024-07-15 13:40:00
Deepak Nitrite,3000  within  week  deepakntr,invincible8298,2024-07-14 19:02:00
Deepak Nitrite,"Stake  increased  by  Promoters,  FIIs,  DIIs  and  public  holding  reduced  for  this  April-June  2024  quarter...",Adg1975,2024-07-14 16:35:00
Deepak Nitrite,"after  lupin,  dabur,  tvs  motors  now  its  time  for  deepak  nitrite  to  become  rocket",Multibaggerfree,2024-07-09 16:13:00
Deepak Nitrite,whatever  it  cross  profits  will  go  southwards  only  should  test  1500  ......  wait  for  china  to  shut  down  for  any  growth  in  deepak  ntr,ThefabulousPenguin,2024-07-09 13:03:00
Deepak Nitrite,Buy  DEEPAKNTR  above  2733  with  SL  2695  Target  2790,RaviKumar11,2024-07-09 10:11:00
Deepak Nitrite,"deepak  nitrite  has  been  showing  some  strength  recently,  consolidating  near  the  neckline  and  important  resistance  level  of  rs  2,650.  if  the  strength  continues  and  surpasses  the  rs  2,650  level,  a  rally  towards  the  rs  2,800  level  would  be  possible  in  the  near  term.  above  rs  2,800,  the  stock  can  surge  towards  its  all-time  high  level  of  rs  3,000.",rizulagg5,2024-07-06 15:17:00
Deepak Nitrite,very  soon  2990  touch  deepak  nitrate  tightly  hold  this....,hp31,2024-07-06 01:31:00
Deepak Nitrite,arey  bhaai  saab  waah  aaj  kr  din  upar  chala  gaya  2200  ke  neeche  jana  tha,ThefabulousPenguin,2024-07-05 09:44:00
Deepak Nitrite,tomorrow  it  will  definitely  cross  2720,aksiitg,2024-07-03 16:20:00
Deepak Nitrite,look  for  2200  again  dont  worry  it  will  rally  upto  2200,ThefabulousPenguin,2024-07-02 19:25:00
Deepak Nitrite,china  fir  se  band  ho  gaya  kya  jo  deepak  nitrite  upar  ja  rha  hai.....  achi  comedy  ho  rhi  hai  india  mein,ThefabulousPenguin,2024-07-02 19:24:00
Deepak Nitrite,Promoter  bought  36  cr  value  of  shares...,May257,2024-06-29 15:00:00
Deepak Nitrite,Promoter  bought  1.46  lakhs  shares  from  open  market,RK0079,2024-06-28 23:26:00
Deepak Nitrite,buy  more  or  just  hold  on  will  go  up  to  2700  within  2  months,Visionbright,2024-06-28 12:45:00
Deepak Nitrite,jayshre  chemical  is  at  9  rs  shall  we  go  for  a  buy,pnbalways,2024-06-24 09:27:00
Deepak Nitrite,how  about  jayshree  chemicals  any  call  on  that,pnbalways,2024-06-21 09:19:00
Deepak Nitrite,"214  pe  liya  tha  2019  me,abhi  kitna  bhage  ga  adhe  bech  diye  1800  pe  uske  badd  3000  hoke  aaya",anilpharma11,2024-06-20 18:21:00
Deepak Nitrite,27cr  equity  capital  FV  2  this  agrochemicals  Co  after  months  of  consolidation  and  underperformance  has  given  a  price  volume  BO  today  and  hit  a  new  52W  high  today  on  expectations  of  strong  performance  in  coming  qtrs  due  to  excellent  monsoon  forecast  in  the  country  and  improved  price  realization  for  its  products.  This  stock  has  already  given  multibagger  returns  to  patient  long  term  investors  and  further  rerating  in  the  agrochemicals  sector  can  push  the  price  to  2990  3190  in  a  few  months,venky2102,2024-06-20 14:51:00
Deepak Nitrite,Will  see  more  sellers  from  here  you  can  try  on  every  high  STAY  TUNE  WITH  THIS  OR  MORE  INFORMATIONPINGG  ON  WHTSZAP  EiGHT  44549  TW0  056..,mahi_cash79,2024-06-19 22:57:00
Deepak Nitrite,good  stock  for  investment.  itmay  go  soon  its  all  time  high,harshadmehtaa1992,2024-06-11 14:15:00
Deepak Nitrite,"cautious  for  this  stock,  monsoon  will  come  ????",Eklavyaaaaa,2024-06-05 22:40:00
Deepak Nitrite,buy  at  current  rate  with  a  target  of  2449.,faga1234,2024-06-03 09:35:00
Deepak Nitrite,"deepak  nitrite  to  acquire  narmada  thermal  power  in  rs  61.65  cr  cash  deal  deepak  nitrite  said  the  acquisition  is  expected  to  be  completed  by  june  30.  ntppl  is  not  carrying  any  business  at  present.  it  has  industrial  land  of  around  125  acres  in  bharuch,  gujarat.",kamal20,2024-06-01 10:21:00
Deepak Nitrite,waiting  for  1700  level  to  invest,Eklavyaaaaa,2024-05-31 10:10:00
Deepak Nitrite,bus  ye  ab  support  p  hi  h  i  think  ye  ab  ekdum  se  hi  spike  krega  upr  ki  terf,sairav,2024-05-30 13:51:00
Deepak Nitrite,"pahle  2210  herdel  tha,  ab  22  bhi  ambuja  ki  deewar  ban  gayi  h..",kk05,2024-05-30 11:29:00
Deepak Nitrite,extremely  poor  performing  stock  .  no  body  knows  what  is  happening  with  this  stock  only  falls,arajkishore,2024-05-30 09:35:00
Deepak Nitrite,what  is  happening.  is  it  applied  for  ibc?  why  continuously  falling.,darisa,2024-05-30 09:29:00
Deepak Nitrite,big  short  build  up  in  this  one.  this  month  has  been  terrible  tomorrow  is  monthly  closing  and  we  can  see  a  juicy  short  squeeze.,ahuja.12,2024-05-29 09:34:00
Deepak Nitrite,60-70  rs  fall  expected  from  here..  this  will  the  last  fall  before  deepak  nitrite  takes  on  a  big  move  upward,sanki1978,2024-05-27 12:15:00
Deepak Nitrite,Such  falls  are  to  remove  weak  players  .  this  eventually  has  to  reach  3000,RK0079,2024-05-25 01:23:00
Deepak Nitrite,as  mentioned  yesterday  dead  cat  bounce  expected.  bullish  only  if  crosses  2400  today,naveendembla1968,2024-05-24 11:48:00
Deepak Nitrite,"deepak  nitrite  will  recover  next  week,  expect  minimum  2500  rs  by  end  of  next  week.  fall  was  just  temporary",sanki1978,2024-05-24 10:04:00
Deepak Nitrite,"Shares  slipped  over  5  percent,  extending  losses  from  the  previous  session  as  brokerages  retain  their  bearish  perspective  on  the  company.  The  firm  reported  an  8.5  percent  on-year  rise  in  net  profit  at  Rs  crore  for  the  March  quarter,  accounting  for  a  Rs  51.6  crore  gain  from  extraordinary  item.s  However,  discounting  the  exceptional  item  which  was  towards  claims  from  an  insurance  company,  the  net  profit  fell  14  percent  on-year  for  the  quarter.",kamal20,2024-05-23 17:52:00
Deepak Nitrite,"Deepak  Nitrite  shares  slipped  5  percent,  extended  losses  from  previous  session  as  brokerages  retain  their  bearish  perspective  on  the  company.",kamal20,2024-05-23 17:37:00
Deepak Nitrite,"Deepak  Nitrite  faced  challenging  business  environment  mainly  due  to  dumping  from  China,  Red  Sea  crisis  and  general  weakness  in  the  chemical  market.",kamal20,2024-05-23 17:37:00
Deepak Nitrite,This  is  no  more  an  investors  stock.  It  has  become  an  Operators  Game  Plan  !!  Investors  are  totally  neglected  by  the  present  management.  Some  old  time  veteran  investors  have  seen  the  company  share  price  growing  and  rewarding  investors  handsomely  in  the  time  of  Late  CK  Mehta  as  CMD  of  the  company.  Right  now  the  management  agenda  seems  very  much  doubtful.  Operators  make  the  move  to  sqeez  retail  investors.  Be  cautious  of  this  company  now.,Munjeet,2024-05-23 16:28:00
Deepak Nitrite,Dead  cat  bounce  expected  tomorrow  as  RSI  IS  LOW,naveendembla1968,2024-05-23 16:24:00
