Stock,Comment,Commented By,Timestamp
Gujarat Fluorochemicals,"the  bond  market  is  more  stable  than  the  stock  market,  with  bonds  being  less  affected  by  market  fluctuations  keeping  your  capital  protected  and  less  impacted  by  the  market  fluctuations.  explore  bonds  for  some  stability-https://bit.ly/4codpxd",The Fixed Income,2025-04-07 20:13:00
Gujarat Fluorochemicals,3700  level  is  expected  in  short  term...  accumulating,Satvikgupta260389,2025-04-04 14:08:00
Gujarat Fluorochemicals,"INOXGFL  Group  plans  to  list  INOX  Clean  Energy  in  FY26  aims  to  garner  ₹5,000  crore  from  IPO",shaina1,2025-03-17 01:12:00
Gujarat Fluorochemicals,"there  are  various  things  the  company  is  doing  in  the  chemicals  space,  which  can  lead  to  more  unlocking  opportunities,  executive  director  devansh  jain  has  said",kamal20,2025-03-15 13:37:00
Gujarat Fluorochemicals,"inoxgfl  sees  value  unlocking  opportunity  in  chemicals  business,  says  executive  director  jain",kamal20,2025-03-15 13:35:00
Gujarat Fluorochemicals,"The  company  incorporated  its  arm,  IGREL  Mahidad  for  power  generation.",kamal20,2025-03-15 09:03:00
Gujarat Fluorochemicals,Electoral  Bonds  mai  naam  aaya  hai  abhi  share  but  mat  karna  1-2  din  wait  Karo.,AmitCAA9594,2025-03-15 08:40:00
Gujarat Fluorochemicals,"promoters  have  pledged  some  shares  last  week  ,  caution  warranted  ,  may  be  they  are  readying  cash  in  case  mkt  falls  or  world  economy  falls  so  they  can  accumulate  and  support  price?",LN_SREENIVAS,2025-03-11 07:44:00
Gujarat Fluorochemicals,"upmove  has  just  begun  in  Gujarat  Fluoro  and  this  trend  of  fair  to  good  returns  can  surely  be  expected  in  next  few  days  atleast  

This  may  explain  only  tiny  quantity  are  on  offer  today  ost  close  despite  gaining  and  closing  with  gains  of  2.33  percent  that  too  on  a  bad  day  like  today

Shubh  Labh",knk61,2025-03-10 15:49:00
Gujarat Fluorochemicals,"GFCL  EV  Products  Limited,  Wholly-owned  subsidiary  of  the  Company,  has  incorporated  its  wholly-owned  subsidiary  Company  in  Texas,  USA  namely  GFCL  EV  Products  Limited  Americas  LLC",kamal20,2025-03-01 08:58:00
Gujarat Fluorochemicals,GFL  about  to  move  to  4000  plus  .In  next  2  weeks  the  target  will  be  achievable.,sanki1978,2025-02-25 12:43:00
Gujarat Fluorochemicals,"Once  unambiguously  creates  high  above  yesterdays  high  and  hence  above  Three  thousand  eight  hundred,  then  GUJARAT  FLUORO  becomes  immediate  buy.This  should  happen  in  the  Forenoon  itself


Shubh  Labh",knk61,2025-02-25 09:39:00
Gujarat Fluorochemicals,"last  half  hour  steep  rise  in  gujarat  fluoro  therefore  almost  touching  3800  indicates  tomorrow  morning  gap  up  opening  as  continuation  of  todays  last  half  hour.

therefore  for  btst  excellent  candidate,  but  as  people  also  are  smart  you  may  not  get  enough  supplies  now  before  4  pm  at  fixed  price  of    3754.35  which  is  almost  a  percent  less  than  todays  peakfew  minutes  back  made

shubh  labh",knk61,2025-02-24 15:49:00
Gujarat Fluorochemicals,Buy  GFL  at  3635  with  a  target  of  3795,sunitarai,2025-02-24 11:09:00
Gujarat Fluorochemicals,"GFL  is  moving  up,  any  week  it  will  start  moving  up  and  will  reach  target  of  4000  plus...  No  Issues  seen  in  GFL",sanki1978,2025-02-21 07:49:00
Gujarat Fluorochemicals,"real  show  will  begin  after  fresh  days  high  gets  s  made  by  gujarat  fluoro.  the  rise  or  bounce  back  can  be  very  sharp  after  that  recovering  what  is  lost  in  several  sessions  in  a  single  day  

therefore  traders  who  strictly  know  volatility  in  the  market  and  know  how  to  enter  stoploss  can  think  of  conditional  buy  say  couple  rupees  above  days  high.

if  and  once  triggered  within  minutes  share  price  can  rise  very  sharp  initially  due  to  fresh  buying  interest  and  subsequently  due  to  short  covering  


shubh  labh",knk61,2025-02-17 10:44:00
Gujarat Fluorochemicals,"k  R  CHOKSEY  latest  reserch  report  published  on  BLOOMBERG  &  Trend  line  on  14feb  2024  for  Flurochem,  priced  Target  raised  to  3884₹",garganuradha,2025-02-16 09:58:00
Gujarat Fluorochemicals,"GFL  4000  Plus  coming  soon,  buy  now  and  hold  on  for  few  weeks..",sanki1978,2025-02-14 07:51:00
Gujarat Fluorochemicals,"Three  months  high  of  4535  can  come  in  within  days  if  buying  triggers  ,  Hence  those  who  can  hold  can  try  this  route  however  stoploss  is  a  must  and  that  need  be  entered  every  single  day  till  Target  us  met  and  share  gets  sold.

Shubh  Labh",knk61,2025-02-12 00:09:00
Gujarat Fluorochemicals,"Three  big  positive  for  Gujarat  Fluoro.

A.  First  and  foremost,  10  percent  additional  duty  by  US  on  Chinese  imports  ,  means  immediate  rush  of  orders  as  India  suddenly  is  very  competitive  in  Chemicals  and  speciality  chemicals.
B.  Second  biggest  positive  news  is  net  profits  of  Dec  24  rises  by  ,57.5  percent  compared  to  80  Crore  net  profits  for  Dec  23  of  800  Cr.
C.  Share  is  at  22  percent  heavy  discount  from  the  52week  high

Therefore  say  one  percent  higher  than  todays  high  conditional  buy  should  give  fair  returns  even  forvday  traders  and  BTST  PLAYERS  

Shubh  Labh",knk61,2025-02-12 00:05:00
Gujarat Fluorochemicals,"GFL  will  fall  down  further.  Expect  it  to  reach  3380  and  below,  before  it  makes  a  U  turn  towards  upside  till  3800  and  above..  Feb  month  towards  the  end  should  show  some  upward  movement.",sanki1978,2025-02-08 10:27:00
Gujarat Fluorochemicals,"The  company%u2019s  Q3  results  were  weak,  it  announced  a  Rs  6000  crore  capex  for  its  EV  products  subsidiary.  Bull  view:  Products  in  EV  battery  chemicals  is  expected  to  benefit  the  company.  Nuvama  says  the  company  will  benefit  from  its  presence  in  40%  of  value  of  LFP  battery  cost  due  to  its  varied  product  portfolio  Bear  view:  Topline  and  bottomline  fell  due  to  weak  demand,  destocking.  China%u2019s  continuous  weakness  might  force  the  companies  to  continue  dumping.",kamal20,2025-02-08 08:31:00
Gujarat Fluorochemicals,GUJARAT  FLUOROCHEMICALS:  Q3  CONS  NET  PROFIT  801M  RUPEES  VS  3.3B  (YOY)  GUJARAT  FLUOROCHEMICALS:  Q3  EBITDA  2.06B  RUPEES  VS  5.23B  (YOY)  ||  Q3  EBITDA  MARGIN  20.79%  VS  36.9%  (YOY)  POOR  EBITDA  AND  MARGINS  POOR  YOY,kamal20,2025-02-07 19:24:00
Gujarat Fluorochemicals,Hey  Prabhu  ...  Hey  Hari  Ram  Krishna  Jaggarnath  Premanand  ....  Ye  kya  hua  ....  Iska  toh  Gamchha  khul  gaya,CalculativeRisk,2025-02-07 19:20:00
Gujarat Fluorochemicals,"Q3  Results:  Net  profit  down  76  percent  at  Rs  80  crore  versus  Rs  329  crore  and  revenue  down  30  percent  at  Rs  992  crore  versus  Rs  1,418  crore,  YoY.",kamal20,2025-02-07 13:53:00
Gujarat Fluorochemicals,"A  fairly  big    Gap  up  opening  can  be  expected  in  Gujarat  Fluoro  today.

On  a  lighter  side  not  all.  action  taken  by  Donald  Trump  hurt  Indian  equity  market.  Many  of  these  measures  will  help  selective  indian  companies.

Chemical  industries  in  india  including  speciality  chemicals  do  face  big  competition  from  Chinese  manufacturer.

Ten  percent  additional  duty  on  imports  decision  by  Trump  therefore  will  be  a  very  big  positive  for  Indian  chemical  manufacturers.

Let  us  buy  Gujarat  Fluoro,  whose  results  were  excellent  but  mainly  due  to  fear  of  what  action  can  be  taken  by  Trump  Gujarat  Fluoro  has  not  appreciated  rather  has  corrected.


Though  today  is  not  Friday  ,  one  can  raise  a  toast  and  say  cheers  

Shubh  Labh",knk61,2025-02-04 07:23:00
Gujarat Fluorochemicals,"Chemical  stocks  fall  after  FM  Sitharaman  skips  measures  for  the  sector  in  Budget  2025.

Budget  2025-  Industry  experts  had  high  hopes  for  a  PLI  scheme  to  support  the  chemical  sectors  recovery  amid  ongoing  challenges  and  signs  of  revival.

Chemicals  stocks  remained  in  the  red  after  the  Budget  disappointed  the  sector.",kamal20,2025-02-01 18:01:00
Gujarat Fluorochemicals,"gfl  is  an  immediate  buy,  simply  because  of  following.
on  29th  was  gfl  results  and  30th  was  navin  fluoro  both  are  speciality  chemicals  manufacturer  and  both  are  into  fluorines.
navinflouro  net  profits  rise  from  78  cr.  in  dec  23  qtr  to  83  crin  dec  24  qtr  or  6.4  percent  where  as  gujarat  fluoro  net  profits  jumped  the  guns  from  80  cr  indec  23  qtr  to  126  cr.  in  dec  24  qtr  or  whopping  57.5  percent  rise

buy    gujarat  fluoro  

shubh  labh",knk61,2025-01-31 14:44:00
Gujarat Fluorochemicals,The  margin  was  also  reduced  compared  to  last  year.  please  look  at  consolidated  results  rather  than  standalone.  Huge  currency  loss  in  this  quarter,drramesh29,2025-01-29 17:28:00
Gujarat Fluorochemicals,before  result  if  buying  will  be  positive  for  future,bhailalrpatel,2025-01-29 13:40:00
Gujarat Fluorochemicals,better  to  purchase  at  3105  to  3150,dshj,2025-01-24 17:17:00
Gujarat Fluorochemicals,"After  checking  financial  this  share  looks  good  with  very  low  equity  base  and  a  low  debt.  Although  there  is  a  slight  dip  in  last  quarter  profit,  this  share  may  not  go  down  substantially  and  good  for  long  term  investment.  Two  unforeseen  concerns  can  be  whether  present  sales  and  profit  justify  present  market  price,  secondly  this  quarter  results.  Another  observation  is  very  low  dividend  payout.",kgmbangalore,2025-01-17 10:02:00
Gujarat Fluorochemicals,"may  be  good  fundamentals  but  expensive,  wait  for  best  price",dshj,2025-01-17 06:56:00
Gujarat Fluorochemicals,good  fundamental  company  and  will  be  high  profitable  result.,bhailalrpatel,2025-01-15 10:01:00
Gujarat Fluorochemicals,very  nice  chance  for  buy   intraday  and  short  time,bhailalrpatel,2025-01-14 09:29:00
Gujarat Fluorochemicals,super  move  has  come  yesterday  expecting  4k  by  31.01.2024  hopefully.,deepaliarunkumar,2025-01-12 08:30:00
Gujarat Fluorochemicals,Superb  move  this  was  bound  to  happen,Satvikgupta260389,2025-01-11 14:26:00
Gujarat Fluorochemicals,"Added  in  bulk  today  ,  stock  will  make  new  highs  soon...  holdnwith  patience.",Satvikgupta260389,2025-01-10 09:47:00
Gujarat Fluorochemicals,"what  a  worst  stock,  has  so  much  strength  for  2  weeks  then  falling  like  nothing",karthik_m,2025-01-10 09:36:00
Gujarat Fluorochemicals,ab  kal  kya  circuit  mare  ga,kalprajsinh,2025-01-09 15:19:00
Gujarat Fluorochemicals,time  for   for  tomorrow,bhailalrpatel,2025-01-09 15:11:00
Gujarat Fluorochemicals,"Huge  shortage  of  Refrigerant  or  Fluoro  would  mean  a  big  price  rise  starting  from  USA  for  this  liquid  for  Sir  conditioning  and  Refrigeration  requirement.

As  there  is  absolutely  input  material  but  selling  prices  are  very  high  profits  hit  roof.

Therefore  companies  like  Gujarat  Fluoro,  Navin  fluorine  and  SRF  will  mint  money  in  coming  months.This  may  not  reflect  much  in  December  24  qtr  but  net  profits  rise  exponentially  for  March  25  qtr  onwards

SHUBH  LABH",knk61,2025-01-09 14:04:00
Gujarat Fluorochemicals,bola  tha  uthalo  ab  rocket  ban  gaya  hath  nahi  lagega,bhailalrpatel,2025-01-09 09:29:00
Gujarat Fluorochemicals,fir  se  aag  lagi  lagta  hai,AmitKHAMAR,2025-01-06 21:12:00
Gujarat Fluorochemicals,"The  stock  tumbled  5.22  percent,  extending  its  losing  streak  to  a  second  session.  Emkay  Global  Financial  has  downgraded  the  stock,  expecting  FY24  to  remain  muted  due  to  volume  and  pricing  pressure.",kamal20,2025-01-05 17:31:00
Gujarat Fluorochemicals,chahte  kya  ho  sirf  upar  hi  Jana  chaiye   of  market  hai   upar  chalega  itne  short  period  me  to  thodi  to  profit  booking  ayegi,warrior_of_light,2025-01-05 12:47:00
Gujarat Fluorochemicals,or  niche  jaye  ga  300  to  gira  diya  upper  se  bakvas  he,kalprajsinh,2025-01-05 12:43:00
Gujarat Fluorochemicals,"In  comparison  to  growth  potential,  stock  is  still  available  at  attractive  valuation,  near  term  target  expecting  4900",Satvikgupta260389,2025-01-05 10:05:00
Gujarat Fluorochemicals,High  growth  potential  in   profit  will  be  in  this  quarter.,bhailalrpatel,2025-01-03 12:32:00
Gujarat Fluorochemicals,accumulate  because  it  is  down  this  time,bhailalrpatel,2025-01-01 15:03:00
Gujarat Fluorochemicals,uptetnd  is   should  see  3850...4000  levels  soon,A1983,2025-01-01 11:35:00
Gujarat Fluorochemicals,please  buy  Hira  hai  after  not  received  on  this  price,bhailalrpatel,2025-01-01 09:23:00
Gujarat Fluorochemicals,I  talk  for  accumulation  before  one   be  accumulate  to   not  forgate.,bhailalrpatel,2024-12-31 15:30:00
Gujarat Fluorochemicals,Gujarat  fluro  must  be  buy  this   for  accumulation.,bhailalrpatel,2024-12-31 14:42:00
Gujarat Fluorochemicals,Abhee  to  GPCB  and  CPCB  Closure  chalega  vat  lag  gayi  revenue  ki  biggest  plant  he  GFL  Ka,Prashant1988123,2024-12-30 14:15:00
Gujarat Fluorochemicals,"Gujarat  Fluorochemicals  says  four  dead,  work  at  Dahej  plant  temporarily  disrupted  after  incident.

The  mishap  took  place  at  the  CMS-1  plant  in  Dahej,  Gujarat,  and  was  immediately  isolated  but  the  operations  have  been  temporarily  disrupted,  said  the  company.",kamal20,2024-12-30 08:36:00
Gujarat Fluorochemicals,"The  board  approved  the  slump  sale  of  a  captive  power  plant  to  subsidiary  IGREL  Mahidad  Ltd.  for  Rs  200  crore.  GFL  will  purchase  power  up  to  107  megawatts  from  IGREL  Mahidad  at  the  rate  of  Rs  4  per  unit,  with  the  transaction  value  based  on  the  number  of  units  generated  and  the  commercial  operation  date.  The  board  also  approved  an  investment  of  up  to  Rs  40  crore  by  subscribing  to  equity  shares  in  the  subsidiary  to  support  its  capital  expenditure  requirements.  GFL  will  also  acquire  a  26prcnt  stake  in  promoter-owned  Flurry  Wind  Energy  Pvt.  for  Rs  200  crore.",kamal20,2024-12-27 11:02:00
Gujarat Fluorochemicals,"The  Board  has  approved  the  slump  sale  of  a  57  MW  captive  power  plant  to  the  companys  subsidiary  IGREL  Mahidad,  for  Rs  200  crore.  Additionally,  the  Board  has  approved  an  investment  of  up  to  Rs  40  crore  in  the  companys  subsidiary  IGREL  Mahidad,  and  Rs  200  crore  in  Flurry  Wind  Energy  in  one  or  more  tranches  for  a  26prcnt  stake.  The  Board  has  also  approved  the  purchase  of  up  to  107  MW  of  power  from  IGREL  Mahidad  and  350  MW  from  Flurry  Wind  Energy  at  Rs  4  per  unit.",kamal20,2024-12-27 09:16:00
Gujarat Fluorochemicals,"Gujarat  Fluorochem  to  sell  captive  power  plant  to  arm  IGREL  Mahidad,  invest  in  two  subsidiaries.

A  power  purchase  agreement  was  also  signed  between  Gujarat  Fluorochem  and  IGREL  Mahidad  as  well  as  Flurry  Wind  Energy  at  the  rate  of  Rs  4  per  unit,  based  on  the  number  of  units  generated.

IGREL  Mahidad  is  into  generation,  purchase,  and  TandD  of  electricity  from  conventional  and  non-conventional  sources.",kamal20,2024-12-26 17:17:00
Gujarat Fluorochemicals,Gujarat  fluoro  is  a  Inox  group  company  of  which  recently  listed  company  is  Inox  India,Hemmu_17,2024-12-22 10:13:00
Gujarat Fluorochemicals,"Gujarat  Fluorochemicals  climbed  4  percent  for  the  week  to  close  at  Rs  3,387,  the  highest  closing  level  since  May  this  year,  and  formed  bullish  candlestick  pattern  with  upper  shadow  on  the  weekly  timeframe.  The  stock  has  seen  a  breakout  of  horizontal  resistance  trendline  adjoining  multiple  touchpoints  and  traded  above  all  key  moving  averages  (20,  50,  100  and  200-week  EMA  -  exponential  moving  average).",kamal20,2024-12-21 10:45:00
Gujarat Fluorochemicals,"any  reason  for  it  to  run  this  much  in  short  term,  any  news,  q2  was  bad  still  this  move  ?",karthik_m,2024-12-20 11:22:00
Gujarat Fluorochemicals,expect  new  highs  in  this  counter  as  all  its  group  companies  inox  etc  are  at  new  highs  where  some  residual  stake  exists.,mind_games_008,2024-12-15 13:30:00
Gujarat Fluorochemicals,expect  new  highs  in  this  counter  as  all  its  group  companies  inox  etc  are  at  new  highs  where  some  residual  stake  exists.,mind_games_008,2024-12-14 18:27:00
Gujarat Fluorochemicals,Economic  times:  Nippon  india  MF  freshly  bought  fluorochem  in  Nov  2023,karthik_m,2024-12-14 09:54:00
Gujarat Fluorochemicals,JAAG  UTHAA  FINALLY  Hope  it  sustains  and  further  grows,HumbleTrade,2024-12-12 10:44:00
Gujarat Fluorochemicals,bro  it  is  quoting  2978  not  as  u  said  today  up  by  135  points.,worsttrade,2024-12-11 18:55:00
Gujarat Fluorochemicals,this  years  nobel  prize  goes  to  you  for  predicting  3000  target  when  it  is  quoting  3978  a  jump  of  22!!.  keep  up  your  good  work.,MAVIS22,2024-12-11 17:55:00
Gujarat Fluorochemicals,"All  high  upmove  will  be  back  in  Gujarat  Fluoro  once  it  now  creates  fresh  days  high.  That  also  can  be  an  indication  of  journey  to  fresh  52  week  high  

Buy  and  hold  positional  though  it  looks  excellent  candidate  for  daytrade  and  BTST  

SHUBH  LABH",knk61,2024-12-10 13:24:00
Gujarat Fluorochemicals,buy  will  lit  3000  NXT  week.  huge  upside  potential  of  3500.  will  be  a  multibagger.  buy  buy  buy,worsttrade,2024-12-08 13:17:00
Gujarat Fluorochemicals,An  intelligent  trader  is  one  who  thinks  of  coming  summer  now  only  during  winter.  This  is  how  he  can  buy  low  and  positonally  within  weeks  rake  in  money.  Ghid  Lyck,knk61,2024-12-06 14:49:00
Gujarat Fluorochemicals,"It  new  facility  will  start  operation  in  this  quarter,  Q3  and  Q4  will  be  going  to  be  a  blasting  performance",kuberatips,2024-11-29 11:33:00
Gujarat Fluorochemicals,any  update  in  this  stock,star1254,2024-11-19 15:02:00
Gujarat Fluorochemicals,As  volume  accumulation   pre  result  closing  of  2780  is   head  to  2900..3000  levels...,A1983,2024-11-10 11:32:00
Gujarat Fluorochemicals,Volumes  are  good  at   retail  supply  getting  absorbed  by  Long  Term  Investors....,A1983,2024-11-08 11:37:00
Gujarat Fluorochemicals,"Another  4  lac  volume  jump,  something  huge  is  cooking",A1983,2024-11-07 15:02:00
Gujarat Fluorochemicals,"Seems  again  another  big  volume  deal,  Volume  suddenly  jumped  by  1  lac  shares...",A1983,2024-11-07 14:29:00
Gujarat Fluorochemicals,"isec  retains  buy  on  gujarat  fluorochemicals,  sets  tp  to  rs  3225  isec  exp  fy24  ebidta  of  1300  cr  and  sees  sharp  rebound  in  fy25  ebidta  to  rs  2200  cr.  co  is  valued  at  fy25e  ev/ebidta  of  14  v/s  industry  averages  of  30",flare1,2024-11-06 11:43:00
Gujarat Fluorochemicals,"good  stocks  are  buy  when  they  r  on  offer  sale  due  to  bad  result,  co.  didnt  post  net  loss,  pat  is  53cr,  those  who  said  it  will  go  to  2200,  1500  and  all  on  what  basis  u  guys  value  a  stock.",karthik_m,2024-11-06 10:18:00
Gujarat Fluorochemicals,"even  after  this  disastrous  results,  pe  is  still  less  than  srf  and  navin",A1983,2024-11-06 09:43:00
Gujarat Fluorochemicals,"*DAM  Capital  on  Gujarat  Fluorochemicals*  -  *Retains  BUY,  TP  increased  to  Rs  3431  from  Rs  3391*  *DAM  estimates  sharp  recovery  in  Ebidta  earnings  for  fy25  and  Fy26  on  the  basis  of  strong  management  commentary  its  post  result  s  Analysts  concall*.  Guj  Fluoro  saw  a  big  drop  in  Q2  earnings  on  co-incidence  of  all  negative  factors  playing  out  simultaneously  in  a  single  quarter  -  e.g  -  China  dumping,  significant  pressure  in  ref  gas,  weak  demand  in  EU  as  well  as  local  Mkts  for  its  fluoroplymers  biz  etc  *However,  management  engagements  with  its  customers  signal  an  all-round  robust  recovery  in  most  segments  it  operates-in*  *Fy  25  EBIDTA  est  to  rise  by  100%  YoY  to  Rs  1960  cr  and  further  by  50%  to  Rs  2540  cr  in  fy26  -  translating  into  Fy25E  EV  /EBIDTA  of  16.2  and  Fy26E  EV  /EBIDTA  of  12.5*",flare1,2024-11-06 07:01:00
Gujarat Fluorochemicals,Tomorrow  it  Will  open  below  2700.  Very  bad  results  more  and  more  price  correction  need  on  present  performance.  2000  is  right  price  to  enter.,kuntal2021,2024-11-05 22:32:00
Gujarat Fluorochemicals,"No  doubts  that  the  results  are  not  at  par  with  the  expectation  and  even  below  what  other  chemical  companies  have  delivered.  But  the  guidance  of  the  Management  is  positive.  The  EV  battery  chemical  segment  is  soon  going  to  be  commissioned  and  the  Management  has  said  that  they  will  have  a  separate  call  on  EV  chemical.  They  have  entered  into  contracts  and  negotiation  with  global  and  local  EV  battery  manufacturers.  H2  2024  will  again  be  better  than  H1  2024.  The  effect  of  revenue  and  profit  from  EV  chemical  will  be  seen  shortly  ,  hopefully  by  Q4  2024.  By  June  2025  the  things  will  look  extremely  different.  Till  that  time  there  may  be  ups  and  downs,  but  any  downfall  will  be  an  opportunity  to  add  the  stock.  THE  STORY  IS  INTACT.",Stockozone,2024-11-05 11:30:00
Gujarat Fluorochemicals,Extremly  bad  result.  It  Will  fall  down  below  2500.  2000  Rs  is  good  buying  range  for  3  years  investment.,kuntal2021,2024-11-04 22:52:00
Gujarat Fluorochemicals,If  it  fall  50  percent  from  52  week  high  then  let  us  invest  for  the  period  of  3  month.  This  is  good  fundamental  company  with  good  market  cap.,KAPILESHWARI,2024-11-04 08:41:00
Gujarat Fluorochemicals,Its  already  fall  to  much  from  52  week  high.So  further  fall  will  not  be  much.,KAPILESHWARI,2024-11-03 22:31:00
Gujarat Fluorochemicals,"when  entire  chemical  sector  is  bleeding  then  why  to  blame  GFL  only...I  beleive  capacities  are  being  built,  long  term  story  is  still  intact!",VF1981,2024-11-03 21:31:00
Gujarat Fluorochemicals,Jab  ache  results  aaye  the  tab  bhi  ye  stock  correct  hua  hai  from  4100  to  2500  ab  to  sab  factorine  hua  hai.  might  be  2500  se  recovery  hogi  again....,azhar_43,2024-11-03 18:59:00
Gujarat Fluorochemicals,je  toh  gayo  bhai  ....????????????,Gauravpathak003,2024-11-03 17:49:00
Gujarat Fluorochemicals,ready  to  make  52  week  low  for  sure.  worst  result  in  chemical  sector.,Shivamarora,2024-11-03 16:58:00
Gujarat Fluorochemicals,worst  result.  epsof  5.64  vs  32.51  yoy  19.54  qoq,swam69,2024-11-03 16:46:00
Gujarat Fluorochemicals,"Weak  results  posted.
Get  ready  for  correction.",kumar23t,2024-11-03 16:46:00
Gujarat Fluorochemicals,"whoever  wants  to  sell,  can,  i  personally  expect  we  will  see  rebound  once  results  are  out  of  the   post  will  come  after",A1983,2024-11-02 11:17:00
Gujarat Fluorochemicals,"yet  again,  fall  due  to  navin  fluorine   nf  in  positive  ..low  volume  fall  proves  weak  retail   the  dips  pre  results",A1983,2024-11-01 09:39:00
Gujarat Fluorochemicals,low  volume   2k,A1983,2024-11-01 09:20:00
Gujarat Fluorochemicals,"one  big  advantage  gfl  has  over  srf  is  that  its  business  is  niche  and  only  fluorochemicals  specific,  srf  business  is  lagging  due  to  its  technical  textiles  and  packaging  business  underperformance...",A1983,2024-10-31 09:53:00
Gujarat Fluorochemicals,"Stick  to  ur  startegy,  lets  c  the  stock  prices  when  rate  cut  comes",A1983,2024-10-30 16:57:00
Gujarat Fluorochemicals,"People  selling  GFL  due  to  SRF  results,  and  in  fact  SRF  is  up  3%  since  results  due  to  H2  update  and",A1983,2024-10-30 13:13:00
Gujarat Fluorochemicals,"Thats  great,  but  be  ready,  if  you  waiting  for  intrest  rates  clarity,  for  good  clarity  u  will  have  to  pay  good  stock  price  too....Good  news  and  Good  Price  dont  come  together",A1983,2024-10-30 13:03:00
Gujarat Fluorochemicals,"very  strange  for  a  person  to  have  bearish  negative  comments  and  view,  and  yet  claims  to  be  a  net   like  a  shorter  in  disguise  trying  to  misguide  others",A1983,2024-10-30 11:46:00
Gujarat Fluorochemicals,yes  so  please  sell  out,A1983,2024-10-30 11:38:00
Gujarat Fluorochemicals,"gfl  bad  results  coming  on  friday,  already  priced  in  todays  fall,  as  per  srf  guidance,  post  this  result  they  are  expecting  a  very  strong  and  positive  h2,  hence  you  are  not  seeing  any  fall  in  srf  share  price...",A1983,2024-10-30 10:10:00
Gujarat Fluorochemicals,"Gujarat  Fluorochemicals  Q3  net  profit  at  Rs  121  crore  Vs  Rs  53  crore,  YoY",kamal20,2024-10-29 16:43:00
Gujarat Fluorochemicals,"I  really  feel  like  to  appreciate  that  atleast  this  board  has  quiet  a  sensible  and  logical  members.  All  chemical  stocks  are  bound  to  take  a  beating  for  quiet  a  while...  Approx  for  6  to  9  months..

One  might  begin  to  buy  them  in  SIP  mode  with  long  term  vision  with  another  20  to  25  percent  from  current  prices.",InvestNReturn,2024-10-26 21:00:00
Gujarat Fluorochemicals,result  date  is  03  rd  november  2023,garganuradha,2024-10-26 14:22:00
Gujarat Fluorochemicals,when  will  be  the  september  2023  results  will  be  announced  any  idea  please,bnssr,2024-10-26 09:33:00
