Stock,Comment,Commented By,Timestamp,Translated_Text,Sentiment_Score,Sentiment_Label
Tata Chemicals,monday  touch  1100₹  if  markets  are  good.,rishi123K,2024-07-28 19:21:00,Monday Touch 1100 ₹ if Markets are good.,0.4404,Positive
Tata Chemicals,tata  chemicals  long  term  buy  stock  hai.,Maanya22,2024-07-28 13:30:00,Tata Chemicals Long Term is Buy Stock.,0.0,Neutral
Tata Chemicals,what  about  on  monday  in  this  stock,015,2024-07-26 19:58:00,What Abouts,0.0,Neutral
Tata Chemicals,MONEYCONTROL  is  not  posting  my   they  keep  posting  messages  of  people  who  are  using  abusive   stock  should  be  kept  for  long  term,advdinesh,2024-07-26 10:00:00,Monicontrol is not posting my care,-0.6369,Negative
Tata Chemicals,Tata  Chemicals  excellent  buy  below  1100  for  long  term.  Keep  doing  SIP  in  this  scrip  alone  for  5000  in  five  years.,Arpaatma,2024-07-25 08:26:00,Tata Chemicals Excellent Billo 1100 for Long Term.  Keep dong sip in this scrip Alone for 5000 in Five Years.,0.4019,Positive
Tata Chemicals,motor  7  yrs  chalaya  nahi  tha  ...70  rs  kar  diya  tha   bhi  aisa  hi  band  baja  sakte   kitna  uppar  aata  hai  ye,a4anjali007,2024-07-22 14:21:00,"The motor was not run 7 Yas ... 70 juice was done, how much it can play the same band.",0.0,Neutral
Tata Chemicals,sl  for  short  should  be  1082  closing  basis.,a4anjali007,2024-07-22 10:46:00,Sal for Short Shud Bay 1082 Closing Basis.,0.0,Neutral
Tata Chemicals,people  are  losing  in  fo  s  y  not  sebi  abandon  fo  catagorywhile  people  loosing  money  remove  fo  catagory  from  stock  market  its  also  like  gambling  worst  sebi  rules,MONEYMARKER,2024-07-22 10:03:00,People are losing in fond Y not sebi abandon Fo catagorywhile people loosing money remove Fo Catagory from Stock Market Its also likes,-0.4203,Negative
Tata Chemicals,almost  target  achieved  today  of   next  will  be  1025  again.  sell  on  rise,a4anjali007,2024-07-22 09:30:00,Almost Target Achides Today of Next Will Bay 1025 Again.  Selll Rise,0.0,Neutral
Tata Chemicals,worst  tata  stox   believe  these  gutter  stox,MONEYMARKER,2024-07-19 10:12:00,West Tata Stokes Belive These Gutter Stokes,-0.6249,Negative
Tata Chemicals,as  said  1030  cming  most  probably  today  or  on  Monday.,a4anjali007,2024-07-19 10:05:00,As Side 1030 Cumming Most Probbles Today and Mande.,0.0,Neutral
Tata Chemicals,most  irritating  and  hopless  share  in  the  market,yz420,2024-07-18 12:21:00,Most Erriting and Hopeless Share in the market,-0.2716,Negative
Tata Chemicals,From  1st  July  soda  prices  going  to  increase,uridk,2024-07-17 17:40:00,From 1 Ste July Soda Presence Going to Increase,0.3182,Positive
Tata Chemicals,"ye  kaisi  asshole  stock  hai  ,....worst  tata  stock",MONEYMARKER,2024-07-16 15:38:00,"What kind of stock is this, .... West Tata Stock",0.0,Neutral
Tata Chemicals,short  nothing  will  happen    nt  able  to  cross  1085  ...  can  come  down  easily....,teshu10,2024-07-16 09:39:00,Short Nothing will Hapan Pant Able to Cross 1085 ... Can Cain's Down Close ....,0.0,Neutral
Tata Chemicals,Expecting  to  break  1100  by  Tuesday  closing.  personal  opinion.,trader_1980,2024-07-14 09:59:00,Expecting then break 1100 b tusade closing.  Personal opinion.,0.0,Neutral
Tata Chemicals,waste  Tata  no  up  move  only  down  move,Nanjay,2024-07-12 09:23:00,"For this, Tata sub -move only down move",-0.6124,Negative
Tata Chemicals,Well  poised  to  single  digit  gain  tomorrow.  personal  opinion.,trader_1980,2024-07-12 00:35:00,Well poise to single digit gains.  Personal opinion.,0.7579,Positive
Tata Chemicals,good  fundamental  company  keep  buying  current  price  tata  chemicals  stock  good  support  coming  week  target  1120  rupees  up  Move  start,0307,2024-07-10 22:16:00,Good Fundamental Company Keep Bing Current Price Tata Chemicals Stock Good Support Coming Week Target 1120 Roopis,0.8176,Positive
Tata Chemicals,trading  in  all  segments   stock  options  index  future  with   our  most  accurate  calls   with  super  accuracy  everydy,bcjf4474,2024-07-10 15:56:00,Trading in All Segments Stock Options Index Future with Hour Most Acure Calls with Super Acuracy Averidge,0.5994,Positive
Tata Chemicals,sell  on  rise.  today  or  tomorrow  1035  1030.,a4anjali007,2024-07-10 10:55:00,Selll Rise.  Today and Tumaro 1035 1030.,0.0,Neutral
Tata Chemicals,We  may  see  a  substantial  spike  tomorrow.,trader_1980,2024-07-09 23:48:00,He cum Substantial Spike Tumaro.,0.2023,Positive
Tata Chemicals,Please  advise  when  was  the  last  time  lot  size  of  Tata  Chemicals  changed.  From  where  I  can  get  the  information.  Please  guide,aappe,2024-07-09 19:26:00,Please Advisse Woen Was The Last Time Lot Size of Tata Chemicals Changed.  From wear e -can gate was information.  Please guide,0.5574,Positive
Tata Chemicals,this  is  really   away   stock,Raju227,2024-07-09 07:55:00,This is really stock,0.0,Neutral
Tata Chemicals,tata  ke  share  pe  ab  belive  nhi  kar.  sakte  worst  share  everytime  i  maked  a  loss  in  tata  shares  worst  company,rajat1063,2024-07-08 14:19:00,No longer do it on Tata's shares.  Can West Share Averaithi Makadya Loos in Tata Share Verst Company,-0.7096,Negative
Tata Chemicals,"all  chemical  stocks  are  rocking  today,  except  this  scrap.",Mysha_007,2024-07-08 14:10:00,"All Chemical Stocks Are Rocking Today, Accept This Scrap.",0.0,Neutral
Tata Chemicals,"available  at  dirt  cheap  price.  tata  sons  private  limited,  promoters  acquired  in  2020  march  at  710  levels.  now  it  is  2024  july  .  price  is  still  1085.  this  proves  how  cheap  it  is.",sri_vishnu,2024-07-08 13:32:00,"available at dirt cheap price.  Tata Sons Private Limited, Promoters Accquired in 2020 March at 710 Levels.  Now it is 2024 July.  Price is still 1085. This proves how cheap it is.",-0.5106,Negative
Tata Chemicals,buy  bulk  qty  at  current  price  normal  sl  1080    will  get  multiple  returns  till  expiry,subashsingh,2024-07-08 13:17:00,Buy Bulk Karnt Current Price Normal Sal 1080 Will Get Multiple Returns Till Exhires,0.0,Neutral
Tata Chemicals,tata  ki  sab  share  ko  ekk  din  sab  tata  karenge  worst  shares  all  of  tata  group,rajat1063,2024-07-05 14:03:00,"Tata shares will be sub -shares to all share of Tata, all of Tata Group",-0.1779,Negative
Tata Chemicals,all  tata  share.  moves  very  slowly  dont  knw  why,rajat1063,2024-07-05 09:41:00,All Tata Share.  Moves Vary Salauli Dont Kanav Whiy,0.296,Positive
Tata Chemicals,if  sustaining  above  1100  can  go  to  1150  levels  within  a  week  but  if  sustains  below  1100  then  can  go  to  1050  and  1000  levels  shortly,harshita20,2024-07-03 16:46:00,File dullness,0.0,Neutral
Tata Chemicals,will  be  going  to  1150  by  this  week,harshita20,2024-07-03 12:10:00,Will bay going to 1150 b the week,0.0,Neutral
Tata Chemicals,will  be  touching  1150  if  sustaining  above  1100,harshita20,2024-07-01 12:17:00,Will Bay Touching 1150,0.0,Neutral
Tata Chemicals,received  dividend  by  tata  chemicals,Nitze,2024-06-28 15:50:00,Rasiveed Dividend Bay Tata Chemicals,0.0,Neutral
Tata Chemicals,"step  child  of  tatas,  will  ever  days  of  darbari  seth  return?  just  hoping  for  the  rosy  future.  10  fv,  800bv  but.....",pyarelal,2024-06-28 10:49:00,"Step Child of Tat, Will Ever Day of Darbari Seth Sand?  Just Hoping for the Rosy Future.  10 foves, 800 boys .....",0.4215,Positive
Tata Chemicals,tomorrow  tata  chemicals  stock  up  Move  start  keep  buying  current  price  e  voting  complete  target   coming  week  target  price,0307,2024-06-27 23:17:00,Tumo Tata Chemicals Stock Move Move Start Keep Current Price,0.0,Neutral
Tata Chemicals,buy  on  every  dip  for  good  returns.,AJ3501,2024-06-27 11:45:00,Buyon Evri Dip for Good Returns.,0.4404,Positive
Tata Chemicals,Heavy  buying  at  lower  prices.  Took  good  support.  dont  sell  a  single  stock.  hold  long  term.,AJ3501,2024-06-27 11:43:00,Heavy Bing Vaat Lower Prince.  Blunt good support.  Dont Celllas Single Stock.  Hold Long Term.,0.5267,Positive
Tata Chemicals,"good  company  to  buy,  as  the  monsoon  rally  for  the  fertilizer  and  chemical  stocks.",Earner_kuber,2024-06-27 10:59:00,"Good company to Buy, Sas the monsoon rally for the fertilizer and chemical stocks.",0.4404,Positive
Tata Chemicals,Tata  Sons  listing  is  imminent.  Tata  Chem  will  benefit,Mrch,2024-06-25 12:39:00,Tata Sons Listing This Immune.  Tata Chem Will Benefit,0.4588,Positive
Tata Chemicals,a  very  high  potential  stock  and  the  only  tata  stock  which  has  not  rallied  up  much.  demand  for  soda  ash  is  increasing.  prices  of  soda  ash  is  increasing.  govt  is  supporting  chemicals  and  fertilizers.  it  is  setting  up  its  own  ev  battery  manufacturing  plant.  so  good  business  ahead.  monsoon  ahead  fertlizers  n  chemicals  demand  may  increase.  and  fundamentally  a  good  and  undervalued  stock  currently.  also  there  be  a  value  unlocking  if  tata  sons  ipo  is  launched.  a  huge  up  rally  is  pending.  i  suppose  some1  is  keeping  this  stock  in  pressure  purposely.,AJ3501,2024-06-25 12:08:00,A very high potential stock and the only tata stock which has not rallied up much.  Demand for Soda Ash is Increasing.  Price of Soda Ash is Increasing.  Govt is supporting chemicals and fertilizers.  It is setting up its oven Ev battery manufacturing plant.  So good business ahead.  Monsoon ahead fertilizers n chemicals demand may increase.  And fundamentally a good and undertaken stock currently.  Also there be a value unlocking if tata sons iPo is launched.  A huge up ralyly is pending.  I Suppose Some1 is Keeping This Stock in Pressure purposely.,0.9285,Positive
Tata Chemicals,What  happened  upper  circit  bhai,sachin3468,2024-06-25 11:19:00,What Happanede Upper Kirkit Bhai,0.0,Neutral
Tata Chemicals,Dividend  has  not  been  credited  as  yet.  Any  one  who  got  the  dividend.,khappi26,2024-06-25 10:33:00,Dividend Has not bean credited as Yat.  Annaye Huae Dividend.,-0.2755,Negative
Tata Chemicals,In  place  of  1190  it  has  gone  to  1090…..just  a  mistake  of  1  and  0…,AB_29,2024-06-24 11:37:00,In Place of 1190 Tit Has Gon to 1090… .. Just Mistake of 1 & 0…,-0.34,Negative
Tata Chemicals,might  touch  1180-1200  in  next  week.  retest  today  done,rp0712,2024-06-21 20:25:00,Mighat Touch 1180-1200 in Next Week.  Retest Today Done,0.0,Neutral
Tata Chemicals,is  this  stock  is  a  joke?,Trendi,2024-06-21 16:48:00,This stock this is a person?,0.296,Positive
Tata Chemicals,"Tata  Chemicals  is  ready  for  a  breakout  on  the  daily  chart  with  a  significant  increase  in  trading  volume,  indicating  a  potential  breakout.  If  the  price  manages  to  close  above  Rs  1,160  levels,  it  may  have  the  potential  to  reach  a  short-term  target  of  Rs  1,320.  On  the  other  hand,  the  immediate  support  level  is  located  at  Rs  1,100.  These  levels  can  be  considered  as  opportunities  to  buy  on  dips.  The  Relative  Strength  Index  (RSI)  currently  stands  at  62.3  and  is  trending  upward,  indicating  increasing  buying  momentum.  To  prudently  manage  risk,  it  is  advisable  to  set  a  stop-loss  at  Rs  1,080.  This  precaution  will  help  protect  your  investment  in  case  of  an  unexpected  market  reversal.  In  summary,  considering  the  technical  analysis  and  the  current  market  conditions,  Tata  Chemicals  appears  to  present  an  appealing  buying  opportunity  for  those  aiming  for  a  Rs  1,320  price  target,  provided  that  appropriate  risk  management  measures  are  in  place.  [Tata  Chemicals  is  ready  for  a  breakout  on  the  daily  chart  with  a  significant  increase  in  trading  volume,  indicating  a  potential  breakout.  If  the  price  manages  to  close  above  Rs  1,160  levels,  it  may  have  the  potential  to  reach  a  short-term  target  of  Rs  1,320.  On  the  other  hand,  the  immediate  support  level  is  located  at  Rs  1,100.  These  levels  can  be  considered  as  opportunities  to  buy  on  dips.  The  Relative  Strength  Index  (RSI)  currently  stands  at  62.3  and  is  trending  upward,  indicating  increasing  buying  momentum.  To  prudently  manage  risk,  it  is  advisable  to  set  a  stop-loss  at  Rs  1,080.  This  precaution  will  help  protect  your  investment  in  case  of  an  unexpected  market  reversal.  In  summary,  considering  the  technical  analysis  and  the  current  market  conditions,  Tata  Chemicals  appears  to  present  an  appealing  buying  opportunity  for  those  aiming  for  a  Rs  1,320  price  target,  provided  that  appropriate  risk  management  measures  are  in  place.]",kamal20,2024-06-21 08:46:00,"Tata chemicals is ready for a breakout on the daily chart with a significant increase in trading volume, indicating a potential breakout.  If the price manages to close about Rs 1,160 levels, it may have the potential to reach a short-term target of Rs 1,320.  On the other hand, the immediative support level is located at Rs 1,100.  These Levels can be Considered as Opportunities to Buy on Dips.  The Relative Strength Index (RSI) Currently Stands at 62.3 and is Trending Upward, Indicating Increasing Buying Momentum.  To prudently manage risk, it is advisable to set a stop-live Rs 1,080.  This Precaution will help protect your investment in case of an unexpected market revered.  In summary, considering the technical analysis and the current market conditions, tata chemicals appears to present an appealing buying openity for aiming for aiming for Appropriate Risk Management Measures Are In Place.  [Tata chemicals is ready for a breakout on the daily chart with a significant increase in trading volume, indicating a potential breakout.  If the price manages to close about Rs 1,160 levels, it may have the potential to reach a short-term target of Rs 1,320.  On the other hand, the immediative support level is located at Rs 1,100.  These Levels can be Considered as Opportunities to Buy on Dips.  The Relative Strength Index (RSI) Currently Stands at 62.3 and is Trending Upward, Indicating Increasing Buying Momentum.  To prudently manage risk, it is advisable to set a stop-live Rs 1,080.  This Precaution will help protect your investment in case of an unexpected market revered.  In summary, considering the technical analysis and the current market conditions, tata chemicals appears to present an appealing buying openity for aiming for aiming for Appropriate Risk Management Measures Are In Place.]",0.991,Positive
Tata Chemicals,"Tata  Chemicals  is  ready  for  a  breakout  on  the  daily  chart  with  a  significant  increase  in  trading  volume,  indicating  a  potential  breakout.  If  the  price  manages  to  close  above  Rs  1,160  levels,  it  may  have  the  potential  to  reach  a  short-term  target  of  Rs  1,320.  On  the  other  hand,  the  immediate  support  level  is  located  at  Rs  1,100.  These  levels  can  be  considered  as  opportunities  to  buy  on  dips.  The  Relative  Strength  Index  (RSI)  currently  stands  at  62.3  and  is  trending  upward,  indicating  increasing  buying  momentum.  To  prudently  manage  risk,  it  is  advisable  to  set  a  stop-loss  at  Rs  1,080.  This  precaution  will  help  protect  your  investment  in  case  of  an  unexpected  market  reversal.  In  summary,  considering  the  technical  analysis  and  the  current  market  conditions,  Tata  Chemicals  appears  to  present  an  appealing  buying  opportunity  for  those  aiming  for  a  Rs  1,320  price  target,  provided  that  appropriate  risk  management  measures  are  in  place.",kamal20,2024-06-21 08:45:00,"Tata chemicals is ready for a breakout on the daily chart with a significant increase in trading volume, indicating a potential breakout.  If the price manages to close about Rs 1,160 levels, it may have the potential to reach a short-term target of Rs 1,320.  On the other hand, the immediative support level is located at Rs 1,100.  These Levels can be Considered as Opportunities to Buy on Dips.  The Relative Strength Index (RSI) Currently Stands at 62.3 and is Trending Upward, Indicating Increasing Buying Momentum.  To prudently manage risk, it is advisable to set a stop-live Rs 1,080.  This Precaution will help protect your investment in case of an unexpected market revered.  In summary, considering the technical analysis and the current market conditions, tata chemicals appears to present an appealing buying openity for aiming for aiming for Appropriate Risk Management Measures Are In Place.",0.9652,Positive
Tata Chemicals,"IT  industry  already  taken  a  lot  of  beating,  keep  close  watch  on  INfy,  wipro  and  tcs...  NVIDIA  posted  great  results  in  US  market  .red  ZZ  ddzdddddd",dreamnifty_24,2024-06-20 16:07:00,"It Industry Alady Taken a Lot of Beating, Keep Close Watch on Infy, Wipro and TCS ... Nvidia Posted Great Great Results in Us Market.",0.2732,Positive
Tata Chemicals,dividend  jama  nahi   tak  aaye   Pata  ho  to  bataw.Ex  dividend  date  Kiya  hea?,marketguru9211,2024-06-20 13:37:00,"If you do not know the dividend, then tell me if you have a dividend date?",0.0,Neutral
Tata Chemicals,Tata  Chemicals  BUY  ONLY...  This  is  going  past  1165  today,gauri k,2024-06-20 12:59:00,Tata Chemicals Buy only ... This Going Past 1165 Today,0.0,Neutral
Tata Chemicals,it  has  closed  at  day  high  there  is  some  news  for  fertilizer  stocks  the  GST  on  fertilizer  is  going  to  go.  according  to  news  on  Zee  buisness  in  next  GsT   hope  for  the  best  regards,pnj18,2024-06-18 23:39:00,It has closed at day high there is some news for fertilizer stocks the gst on fertilizer is going to go.  According to news on zee buisness in next gst hop for the best regards,0.7964,Positive
Tata Chemicals,"Tommorow,  it  will  cross  1135  level.",Vishalrock123,2024-06-18 18:01:00,"Tomorov, IT Will Cross 1135 Level.",0.0,Neutral
Tata Chemicals,Hoping  for  Tata  Chemical  is  going  to  be  bullish  today.,Bharath_34,2024-06-18 09:25:00,Hoping for Tata Chemical is Going to Bulish Today.,0.4215,Positive
Tata Chemicals,looks  like  week...  kotak  TP  750...  down  graded  this  share  due  poor  performance  expected  fy2025,vkshetty78,2024-06-16 18:33:00,Looks Like Week ... Kotak Tap 750 ... Down Graded This share payable Poor Performance Expected Fe 2025,0.2263,Positive
Tata Chemicals,TATA  CHEMICALS....  ONLY  BUY  N  HOLD  FOR  THE  TARGET  OF  1190  WITHIN  ONE  WEEK.  ENJOY  GUYS.,gdfc,2024-06-16 15:42:00,Tata Chemicals .... Only Buy Na Hold for the Turgate of 1190 Vithin on Week.  Enjoy Gyce.,0.6037,Positive
Tata Chemicals,Tata  Chemicals  ex  dividend  will  head  towards  1037  in  short  time  with  no  immediate  trigger,Prashant1965,2024-06-15 19:17:00,Tata Chemicals X Dividand Will Head Towards 1037 in Short Time with No Imidyat Trigger,-0.296,Negative
Tata Chemicals,Did  anyone  get  the  dividend  in  their  account?,khappi26,2024-06-14 15:40:00,Did Ananan Get The Dividend in Their Account?,0.0,Neutral
Tata Chemicals,most  manhoos  cmd..  deserves  booting  out,Vinodkkh,2024-06-14 14:50:00,Most Wretched Chand .. Deserves Booting Out,0.0,Neutral
Tata Chemicals,someone  pls  suggest  whether  to  hold  or  sell  this  stock,Liyaan,2024-06-14 10:04:00,Samavan Plus Suggest White to Hold and Selll This Stock,0.0772,Positive
Tata Chemicals,buy...  intraday  target...  1150....  chears  all,completboy18,2024-06-12 10:29:00,Buy ... Intrade Target ... 1150 .... Cherors all,0.0,Neutral
Tata Chemicals,tata  chemicals  is  the  best  share  for  long  term.  now  a  days  everyone  looking  for  indias  fastest  growing  share  tinna  rubber.  observe  and  enter  before  the  rally.  keep  cool.,RAJINIKANTH_RELOADED,2024-06-12 04:31:00,Tata chemicals is the best share for long term.  Now a days always looking for India fastest growing share tinna rubber.  Observe and enter before the rally.  Keep Cool.,0.891,Positive
Tata Chemicals,I  could  see  the  future  price  of  Tata  Chemicals  around  6000-7000  range  in  2028-29,Sripri,2024-06-11 23:16:00,Shri Kud Se Future Price of Tata Chemicals Around 6000-7000 Range in 2028-29,0.0,Neutral
Tata Chemicals,tata  company  with  pb  just  1.28  very  cheap  valueation  plus  hike  in  soda  ash  price  hurrey  grab  buy  buy  tata  chemical,Dark_Horse0007,2024-06-11 13:41:00,Tata Company with Pub Just 1.28 Verry Chip Valayati Plus Hike in Soda ash Price Hurree Grab Buy Buy Tata Chemical,0.0,Neutral
Tata Chemicals,tata  chem  was  struggling  from  long  time  because  of  low  soda  ash  price  now  american  company  raised  25  usd  per  mt  on  soda  ash  price  that  is  very  very  positive  sign  for  tata  chemical,Dark_Horse0007,2024-06-11 13:40:00,Tata Chem Was Struggling from long time of low soda ash price now American company raised 25 usd per mt on soda ash price that is very very positive,0.0699,Positive
Tata Chemicals,huge  buy  order  pending  grab  tata  chem  before  its  to  late  huge  multibagger  soda  ash  price  hike  very  very  positive  for  tata  chem,Dark_Horse0007,2024-06-11 13:38:00,Huje Buy Order Pending Grab Tata Chem Bifor Its To Late Huje Multibagger soda ash price,0.8304,Positive
Tata Chemicals,you  people  must  buy  tata  chem  reason  behind  hike  in  soda  price  very  very  positive  for  tata  chemical,Dark_Horse0007,2024-06-11 13:37:00,You Peepal Must Buy Tata Chem Region Bend Hike in Soda Price Very Poration for Tata Chemical,0.6335,Positive
Tata Chemicals,buy  buy  buy  revised  target  1500  per  share  25  dollar  per  MT  price  hike  in  soda  ash,Dark_Horse0007,2024-06-11 13:35:00,Buy Buy Buy Revised Target 1500 Shares 25 Dollars Foot Foot Price In Soda Ash,0.296,Positive
Tata Chemicals,BUY  TATACHEM  at  1110  SL  1090  TGT  1165-1180,suryamehta066,2024-06-11 09:45:00,Buy Tatthan 1110 Sal 1090,0.0,Neutral
Tata Chemicals,tata  chemical...  only  buy  n  hold  for  the  target  of  1135  within  this  week.  enjoy  guys.,gdfc,2024-06-10 21:22:00,Tata Chemical ... Only Buy Hold for the Turget of 1135 Vithin This Week.  Enjoy Gyce.,0.4939,Positive
Tata Chemicals,atp  is  181  so  it  should  be  close  nearby,Sajals,2024-06-10 11:56:00,This 181 So Shud Bay Close Nearbi,0.0,Neutral
Tata Chemicals,rumour  has  it  say  that  tata  group  is  going  to  launch  sodium  batteries  soon...  which  will  directly  benefit  this  share,Liyaan,2024-06-10 11:20:00,Ramaur Hasit Sai that Tata Group is going to launch sodium batteries,0.6705,Positive
Tata Chemicals,i  brought  it  56  still  hold  it  (cmp:  15.35),nikunj_js,2024-06-08 08:51:00,Shri Braghat 56 Still Hold IT (Company: 15.35),0.0,Neutral
Tata Chemicals,best  levels  for  fresh  buying  for  another  15%  gains  in  hand  in  next  30  days,sanv,2024-06-07 13:34:00,Best Levels for Fresh Bing fornother 15% Gains in Hand in Next 30 Days,0.9022,Positive
Tata Chemicals,"tata  chemicals  shares  fall  after  europe  arm  fined  e1.1  million  by  uk  court  shares  of  tata  chemicals  have  been  under  pressure  in  recent  times  amidst  challenges  in  the  global  soda  ash  industry,  largely  due  to  oversupply  from  chinese  counterparts  and  weak  demand.",kamal20,2024-06-07 13:07:00,"Tata Chemicals Shares Fall after Europe Arm Fined E1.1 Million by UK Court Shares of Tata Chemicals Have Been Under Pressure in Recent Times Amidst Challenges in the Global Soda Adustry, Jurgly Due to oversupply from chinese counterparts and weak demand.",-0.2263,Negative
Tata Chemicals,"fraudsters  active  in  this  scrip  ,  celebration  going  on  for  one  million  euro  fine",kp200,2024-06-07 10:19:00,"Fraudster Active in The Skrip, Celebration Going, Million Euro Fine",0.0258,Positive
Tata Chemicals,"a  uk  court  ordered  a  fine  of  gbp  11,00,000  on  tata  chemicals  europe  limited,  a  subsidiary  of  tata  chemicals.  the  fine  pertained  to  a  safety  incident  in  2016.",kamal20,2024-06-07 09:05:00,"A UK Court Ordered a Fine of GBP 11,00,000 on Tata Chemicals Europe Limited, A Subsidiary of Tata Chemicals.  The Fine Pertained to a Safety Incident in 2016.",0.5423,Positive
Tata Chemicals,This  stock  is  facing  a  huge  resistance  at  1068-1067  levels,Adarsh_P,2024-06-06 11:24:00,This stock is facing a huje resistance 1068-1067 levels,0.3182,Positive
Tata Chemicals,crisil  ratings  reaffirms  crisil  a1  rating  for  commercial  paper  of  rs  100  crore,kamal20,2024-05-31 12:42:00,Crisil Rating,0.0,Neutral
Tata Chemicals,time  to  acquire  more.  it  took  support  at  1052  and  the  monthly  candle  looks  like  a  hammer  as  well.,tradingmom,2024-05-30 13:49:00,Time then Aquire More.  IT Soot Support 1052 and the monthly Candle Looks like Hamaras Vel.,0.7624,Positive
Tata Chemicals,I  came  in  fast  time  I  want  to  test  it.  With  ten,Rohidul,2024-05-29 12:24:00,Shri Chame in Fast Time Vant to Test IT.  With ten,0.0772,Positive
Tata Chemicals,if  tomorrow  it  will  go  on  ban  then  this  share  will  fall.,swetapatel,2024-05-27 18:57:00,Fifty -four IT will go and become a share will fall.,-0.34,Negative
Tata Chemicals,"Market  is  going  down  ,  sell  target  1085  SL  1115",Winrace,2024-05-27 10:27:00,"Market is Going Down, Cell Target 1085 Sal 1115",0.0,Neutral
Tata Chemicals,uc  is  possible  today  all  the  best????,rakesh_cbi,2024-05-24 11:33:00,That Posable Today all were the best ????,0.0,Neutral
Tata Chemicals,buy  for  target  1200  in  next  month,Tishar,2024-05-23 13:33:00,Buy for Target 1200 in Next Month,0.0,Neutral
Tata Chemicals,strong  company  in  chemical  sector,jai1677,2024-05-23 10:26:00,Strong Company in Chemical Sector,0.5106,Positive
Tata Chemicals,W  pattern  on  chart  1  day  time-frame.,AJ3501,2024-05-22 15:11:00,And patterns chart 1 day time-frame.,0.0,Neutral
