Stock,Comment,Commented By,Timestamp,Translated_Text,Sentiment_Score,Sentiment_Label
Tata Chemicals,"The  Fixed  Income:  Changing  the  Way  India  Invests  Built  with  love  in  India,  we  empower  over  1,50,000  investors  to  grow  with  stability.  Whether  it’s  corporate  bonds,  government  bonds,  fixed  deposits,  or  more,  our  platform  helps  you  build  a  solid  financial  foundation  with  predictable,  stable  returns.  Explore  Now:https://shorturl.at/keFwR",The Fixed Income,2025-03-21 12:15:00,"The Fixed Income: Changing The Way India Invests Built with Love in India, We Empower Over 1,50,000 Investors to Grow With Stability.  Whather it's corporate bonds, government bonds, fixed deposits, or more, our platform helps you build a solid financial fourth, stable returns.  Explore now: https: //shorturl.at/kefwr",0.8709,Positive
Tata Chemicals,tomorrow  upper  circuit,saikrishnagoud,2025-03-21 12:04:00,Tumaro Upper Circuit,0.0,Neutral
Tata Chemicals,TCL  is  slated  to  enter  into  Benzene  based  chemicals.  This  project  was  started  in  2023  and  will  start  production  soon.  It  will  the  cheapest  benzene  chemicals  producer  due  to  available  backward  integration.  Wait  for  Q1  Fy26  results.,harriharri,2025-03-21 12:00:00,TCL is stated to enter into benzene based chemicals.  This project was started in 2023 and will start production soon.  It will the cheapest benzene chemicals producer due to available backward integration.  Wait for Q1 FY26 Results.,0.0,Neutral
Tata Chemicals,entire  market  went  up.  but  this  is   investors  in  this  stock  like   dosre  ka  mooh  dekho...pathetic.,lossess,2025-03-21 11:38:00,Antire Market Vent Sub.  But this investors in this stock written and see the other's face ... Pedestic.,0.5023,Positive
Tata Chemicals,"short  covering  move,should  take  it  higher  even  tomorrow.",udeykhajuria1959,2025-03-21 10:34:00,"Short Covering Move, Shud Tech it Higher Eve.",0.0,Neutral
Tata Chemicals,IPO  or  no  IPO  it  is  a  good  buy  at  this  level.,Cool Bull,2025-03-21 07:31:00,IPO and No Poopi This is the good Buyat this level.,0.1779,Positive
Tata Chemicals,"TATAs  Will  float  IPO,  wait  a  few  days",shyamalb,2025-03-21 01:00:00,"Test will float IPO, weight a fu day",0.0,Neutral
Tata Chemicals,again  tomorrow  Tata  chemicals  will  be  in  fno  ban  tomorrow...,bapu007,2025-03-20 22:49:00,Again Tukaro Tata Chemicals Will Bay in Fan Ban Tumaro ...,-0.5574,Negative
Tata Chemicals,March  month  Target  920  -  900,yuvatamil,2025-03-20 19:32:00,March Month Target 920 - 900,0.0,Neutral
Tata Chemicals,Only  scamer  stock  high  level  par  investors  ko  buy  karne  par  majbur  karke  fasa  diya.....  ab  5  saal  lag  jayenge  ise  new  52week  high  par  aate  aate...  Abhi  bhi  vaqt  hai  investaro  yaha  se  nikalo  aur  quality  stock  buy  karo  kam  se  kam  aapki  capital  to  secure  rahegi.....,dinu1234,2025-03-20 18:15:00,Only scamer stock high level par investors ko buy karne par majbur karke fasa diya ..... ab 5 saal lag jayenge ise new 52week high par aate aate ... Abhi bhi vaqt hai vaqt hai vaqt hai vaqalo aur aur Quality Stock Buy Karo Kam Se Kam Aapki Capital to Secure Rahegi .....,0.0,Neutral
Tata Chemicals,i  feel  this  would  be  multibagger,VB9,2025-03-20 17:21:00,Shri Feel This Wauld Bay Multibagger,0.0,Neutral
Tata Chemicals,the  tata  chemicals  stock  fell  7.93  percent  with  strong  volumes  on  march  20.  about  93  lakh  shares  changed  hands  compared  to  the  monthly  average  of  57  lakh.,kamal20,2025-03-20 17:16:00,The Tata Chemicals Stock Fell 7.93 Percent With Strong Volumes on March 20. About 93 Lakh Shares Changed Hands Compared to the Monthly Average of 57 Lakh.,0.6705,Positive
Tata Chemicals,this  stock  will  touch  1050/55  tomorrow  easily  ban  honeke  bavjood  ye  level  touch  karega  sure.,jagdish542,2025-03-20 16:02:00,This level will touch the stock will touch 1050/55 Tumaro will touch Surre.,0.0258,Positive
Tata Chemicals,again  in  f&o  ban  from  tomorrow  !  operators  will  not  allow  traders  without  funds/  stocks  to  easily  rollover  positions.  complete  manipulation  the  whole  month.,shivagrwal,2025-03-20 15:57:00,Again in F & O Ban from Tomorrow!  Operators will not allow traders with funds/ stocks to easily rotover positions.  Complete Manipulation The Whole Month.,-0.6551,Negative
Tata Chemicals,friends  watch  level  1040  if  it  crashes  then  it  will  touch  980-990,sai_love,2025-03-20 14:40:00,Friends Watch Level 1040 If It Crash was IT will touch 980-990,0.4767,Positive
Tata Chemicals,"buy  on  rumor  and  sell  on  news.  soda  ash  price  slashed  now,  the  profit  will  be  less  than  the  last  quatres.",Sri008,2025-03-20 14:15:00,"Buyon Rumor & Sellon News.  Soda ash price slashed now, the profits will bay less than the last quarters.",0.25,Positive
Tata Chemicals,stock  appears  oversold....delivery  on  nse  is  only  28  percent.  stock  may  recover,Mrch,2025-03-20 14:14:00,"Stock appr's oversold .... delivery, Nas only 28 %.  Stock may recover",0.0,Neutral
Tata Chemicals,invester  must  realize  its  market  cap  is  only  26492  crore.  cash  reserve  is  21148  crore.  plant  cwp  put  togyher  is  35907  crore.  price  to  book  value  is  only  1.28  no  chemical  stock  has  value  price  to  book  value  -3  and  stack  in  tata  sons  is  addional  its  no  brain  its  true  value  is  beyond  3k.  its  like  irfc  getting  at  rs  20.,VB9,2025-03-20 14:07:00,Invester must Realize its market cap is only 26492 Crore.  Cash Reserve is 21148 Crore.  Plant Cwp Put T Togyher is 35907 Crore.  Price to book value is only 1.28 No Chemical Stock has Value Price to Book Value -3 and Stack in Tata Sons is Addional Its No Brain Its True Value is beyond 3k.  Its like IRFC Getting at Rs 20.,0.8591,Positive
Tata Chemicals,available  at  very  cheap  rate  today.  it  will  definitely  will  back  in  1100  series  by  tomorrow,Sajals,2025-03-20 12:13:00,Appendable at very chip rate tode.  IT Will Definnatel Will Back in 1100 Series Bay Tumar,0.4019,Positive
Tata Chemicals,Today  LC  pakka  sell  Karo,krishmo,2025-03-20 11:37:00,Do the cell,0.0,Neutral
Tata Chemicals,tata  needs  more  money  for  debt   chemical  is  down  duento  crude  oil  price  hike,Rajiv271,2025-03-20 10:51:00,Tata Needs More Money for Debt Chemical This Down Dino Crude Oil Price Hike,-0.7553,Negative
Tata Chemicals,why  so  much  crash  in  tata  chemicals  today?,rajubh,2025-03-20 10:50:00,Why so much crash in Tata Chemicals Today?,-0.4549,Negative
Tata Chemicals,Can  this  company  be  bought  at  the  current  price?  Or  can  I  sell  it?  Experienced  ones  can  inform.,ore,2025-03-20 10:34:00,"Can this company be bouted, the current price?  And Canwers Cells?  Experienced Oman Cain Informs.",0.0,Neutral
Tata Chemicals,Today  20%  down  hoga  Aisa  lag  raha  hai,Manojk1969,2025-03-20 10:26:00,Today looks like 20% down,-0.34,Negative
Tata Chemicals,Ideal  level  is  400  to  500  range  only,Manojk1969,2025-03-20 10:12:00,Ideal level is 400 to 500 range only,0.5267,Positive
Tata Chemicals,top  lvl  ki  dhulai  ho  rahi  h,KRR10,2025-03-20 10:10:00,Top live was washing,0.2023,Positive
Tata Chemicals,what  is  ideal  level  to  average,nbhas,2025-03-20 10:00:00,What this ideal level is average,0.5267,Positive
Tata Chemicals,Fake  news  floated  to  trap  innocent  traders  &  Investors.  wait  for  lower  levels  to  average.,inaraj30a,2025-03-20 09:30:00,Fake news floated to trap innocent traders & investors.  Weight for Lower Levels then Average.,-0.6369,Negative
Tata Chemicals,IPO  or  no  IPO  Tatachemicals  at  this  price  is  a  value  buy.,Cool Bull,2025-03-20 09:28:00,IPO and No Poo Tattakemicals,0.0516,Positive
Tata Chemicals,"Tata  son  selling  TCS  shares  worth  ten  thousand  crores,probably  to  repay  all  debts  to  escape  from  IPO",Elcee180,2025-03-19 06:10:00,"Tata on Selling Tukes Shares Worth Ten Thouzand Crces, Probbles to Rapay All Debts to Escape from IPO",0.5859,Positive
Tata Chemicals,Tata  chemicals  has  won  in  one  tax  case  and  will  get  refund  of  Rs.59  crores.tomirriw  stock  could  touch  1180.,shenoybr73,2025-03-18 19:00:00,Tata Chemicals are the Tax Case and Will Gate Refund of Ras. 59 Crers.Tomiriv Stock Kud Touch 1180.,0.5719,Positive
Tata Chemicals,it  will  not  go  up  ad  of  now.  all  traders  spread  fake  news  of  tata  sons  listing  and  went  away  by  selling.  all  innocent  small  investors  get  trapped.  its  tata  group  share  and  few  of  tata  share  over  valued  ans  some  of  them  never  make  money  for  investors.  stay  away  from  Tata.,lossess,2025-03-18 10:48:00,It will not go up ad of now.  All traders spread fake news of tata sons listing and went away by seling.  All Innocent Small Investors Get Trapped.  Its tata group share and few of tata share over valued answer of them Never make money for investors.  Stay Away from Tata.,0.296,Positive
Tata Chemicals,"According  to  people  in  the  know,  Tata  Sons  has  explored  a  potential  listing  twice,  first  in  2007  during  Ratan  Tatas  tenure  as  chairman  and  again  in  2016  under  Cyrus  Mistrys  leadership.",kamal20,2025-03-15 09:32:00,"According to people in the knowledge, tata sons have explred a potential listing twice, first in 2007 during ratan tatas tenure as Chairman and Again in 2016 Under Cyrus Mostrys Leadership.",0.0,Neutral
Tata Chemicals,"RBIs  directive,  issued  in  September  2023,  requires  Tata  Sons,  classified  as  an  upper-layer  non-banking  financial  company,  to  list  its  shares  within  three  years.  Tata  Sons  faces  a  deadline  of  September  2025  to  go  public.",kamal20,2025-03-15 09:31:00,"RBIS Directive, Issured in September 2023, Requires Tata Sons, Classified as an upper-layer non-banking financial company, to list its shares with shares with  Tata Sons faces a deadline of September 2025 to go public.",0.296,Positive
Tata Chemicals,Tata  Sons  faces  a  delicate  balancing  act  between  pragmatism  and  upholding  its  legacy,kamal20,2025-03-15 09:31:00,Tata Sons Fessions Delicate Balancing Act Bitveen Pramtism and Upholding Its,0.0516,Positive
Tata Chemicals,tata  chemicals  near  launch  in  battery  chemicals  .  huge  demand  in  this  business.  New  target  in  tata  chemicals  Rs.1500  in  one  month,GrtOpinion2018,2025-03-14 11:58:00,Tata Chemicals Near Launch In Battery Chemicals.  Huje demand in business.  New target in Tata Chemicals Ras. 1500,0.2023,Positive
Tata Chemicals,One  thing  is  clear.  Tata  Chem  holds  3  percent  in  Tata  sons.  Even  if  IPO  does  not  come  up  this  stake  will  be  factored  in  its  new  valuations.  So  at  1200  levels  there  is  normal  risk  reward.  Hence  1150  should  not  be  a  problem.,Cool Bull,2025-03-14 09:47:00,One thing is clear.  Tata Chem Holds 3 Percent in Tata Sons.  Even if iPo does not come up this stake will be factored in its new valuations.  So at 1200 levels there is normal risk reward.  Hence 1150 should be a problem.,0.7549,Positive
Tata Chemicals,will  touch  1150  till  Friday,ka8652,2025-03-14 00:47:00,Will Touch 1150 Till Friday,0.0,Neutral
Tata Chemicals,tata  chemicals  is  step  child  of   buying  by  promotors  even  below  book   like  it  will  sleep  like  kumbhkaran  for  next  6  months,shivagrwal,2025-03-13 13:05:00,Tata Chemicals This Step Child of Bing by Promoters and Billo Book Like Sleep Written Kumbhakaran for Next 6 Monthus,0.6124,Positive
Tata Chemicals,"PM  Modi  to  inaugurate  TATAS  Semiconductor  Fab  Unit  at  Dholera,  Gujarat  at  11  AM",Meeeeeeet,2025-03-13 00:32:00,"Pt Modi to Inograta then Semicander Fab Unit Dholera, Gujarat Vat 11 M",0.4588,Positive
Tata Chemicals,"All  sectors  are  correcting  which  involves  small,  mid  and  large  which  ran  too  ahead  from  it  real  valuations.  Tata  chemicals  in  the  other  consolidated  for  the  last  2.5  years.  Expecting  a  great  uptrend  in  the  next  few  trading  sessions",DMJF,2025-03-12 20:30:00,"All sectors are correcting which involves small, mid and large which ran too ahead from it real valuations.  Tata chemicals in the other consolidated for the last 2.5 years.  Expecting a great uptrend in the next few trading sessions",0.6249,Positive
Tata Chemicals,This  will  come  below  1000..  Retail  investors  please  becareful.,Girish05,2025-03-12 18:08:00,Bilo 1000 of this will .. Retail Investors Please Beckreful.,0.3182,Positive
Tata Chemicals,Because  I  ve  got  a  tip  from  a  fellow  investor  that  is  why.,vansh7740,2025-03-12 16:50:00,Bikazi Way Gota Tip from Fellow Investor,0.0,Neutral
Tata Chemicals,Chaos  was  prevalent  in  almost  all  the  sectors  and  stocks  in  the  last  2  weeks.  It  is  just  not  Tata  chemicals  which  has  taken  beating.  There  has  to  be  a  great  rebound  this  week.  Patience  and  long  term  investors  will  benefit  the  most,DMJF,2025-03-12 15:44:00,Chaos was prevalent in almost all the sectors and stocks in the last 2 weeks.  It is just not tata chemicals which has taken beating.  There has to be a great rebound this week.  Patience and long term investors will benefit the most,0.1027,Positive
Tata Chemicals,"Guys...No  need  to  Sell  even  a  Single  Share  of  Tata  Chemicals,  I  bought  huge  quantity  at  940/-  to  980/-  even  I  bought  more  in  few  quantity  at  1120/-  1260/-  but  I  will  never  Sell  it  either  down  trend,  I  am  increasing  at  every  Dip  in  few   My  Conviction  is  to  See  atleast  2500/-  and  3000/-  too.  Tata  is  Tata  Very  reputed  and  honest  Group.  I  Cant  express  how  much  Wealth  U  will  made  if  hold.  U  hv  to  bear  the  Pain  for  Some   come  down....  Its  my  Opinion,  you  can  do  your  own  research  too.  Choice  is  yours.  GD  luck.",Pdhall892,2025-03-12 14:28:00,"Guys ... no need to sell even a single share of tata chemicals, I boght huge quantity at 940/- to 980/- even I bout I bought more in less more in less quantity at 1120/- 1260/- 1260/- but i will Never Sell Never Sell ite Eiter Down Eiter Down TRED, I am Increasing at Every Dip in Few My Conviction is to see atlest 2500/- and 3000/- too.  Tata is tata very reputed and honest group.  I Cant Express how much wealth u will make if hold.  U hv to bear the pain for some come down .... Its my opinion, you can do your own research too.  Choice is yours.  GD Luck.",0.8989,Positive
Tata Chemicals,Those  holding  in  cash  could  look  at  partial  booking  out  and  wait  for  Q4  results  till  May  1st  week.  Mostly  TACHEM  may  report  a  big  fall  in  PAT  YOY  as  selling  prices  are  weak.  By  then  political  situation  also  could  be  more  clear.  Then  consider  re  entry  if  selling  prices  are  firming  up.,STAY_SAFE,2025-03-12 13:23:00,Thos Holding in Cash Book at Partial Booking Out and Wait for Q4 Results Till May 1st Week.  Mostly tachem may report a big fall in pat yoy as seling prises are weak.  By then Political Situation also could be more clear.  Then Consider Re Entry If Selling Prisis are firming up.,-0.0018,Negative
Tata Chemicals,weak  stock  rise  like  anything  and  fall  like  anything,devfacts,2025-03-12 13:21:00,Week Stock Rise Written Anating and Fall Written Aneithing,0.2732,Positive
Tata Chemicals,Why  this  raised  from  960  to  1350  is  because  of  rumor.  Why  its  coming  down  from  1350  is  also  rumor.,Sri008,2025-03-12 11:19:00,Why this rasade from 960 and 1350 this Bikos of Rumor.  Whi Its Cumming Down from 1350 is also Rumk.,0.0,Neutral
Tata Chemicals,smallcap  &  midcap  correction  has  started  and  will  last  for  1  yr  from  now  !,Moneymaker18,2025-03-12 10:54:00,Smallcap & Midcap Correction Has Started and Will Last for 1 Yer from Now!,0.0,Neutral
Tata Chemicals,Can  this  company  hold  or  sell  or  buy  shares  now?,ore,2025-03-12 10:33:00,Can This Company Hold and Selll and Buy Shares Now?,0.296,Positive
Tata Chemicals,tata  chemicals  has  not  run  much  as  conpare  to  other  stocks  but  after  a  good  news  it  is  going  down.  its  totally  traders  game.  no  control  of  SEBI  and  other  regulators  to  control  manipulation.  they  are  spreading  news  or  can  say  romuurs  and  buying  and  selling.  small  investors  get  trapped  in  these  kind  of  news.  tata  bye  bye  khatam.,lossess,2025-03-12 10:19:00,Tata Chemicals Has Not Run Much as Conpare to other stocks but after a good news it is going down.  Its totally traders game.  No control of sebi and other regulators to control manipulation.  They are spoiled news or can say Romuurs and Buying and Selling.  Small investors get trapped in these kind of news.  Tata bye bye khatam.,-0.7747,Negative
Tata Chemicals,GUYS  WAIT  FOR  850RS  LEVELS  HUGE  DOWNSIDE  CORRECTION  IS  COMING  POST  MAR  15TH  GUYS  WAIT  FOR  850RS  LEVELS  HUGE  DOWNSIDE  CORRECTION  IS  COMING  POST  MAR  15TH  GUYS  WAIT  FOR  850RS  LEVELS  HUGE  DOWNSIDE  CORRECTION  IS  COMING  POST  MAR  15TH  GUYS  WAIT  FOR  850RS  LEVELS  HUGE  DOWNSIDE  CORRECTION  IS  COMING  POST  MAR  15TH  GUYS  WAIT  FOR  850RS  LEVELS  HUGE  DOWNSIDE  CORRECTION  IS  COMING  POST  MAR  15TH  GUYS  WAIT  FOR  850RS  LEVELS  HUGE  DOWNSIDE  CORRECTION  IS  COMING  POST  MAR  15TH  GUYS  WAIT  FOR  850RS  LEVELS  HUGE  DOWNSIDE  CORRECTION  IS  COMING  POST  MAR  15TH  GUYS  WAIT  FOR  850RS  LEVELS  HUGE  DOWNSIDE  CORRECTION  IS  COMING  POST  MAR  15TH  GUYS  WAIT  FOR  850RS  LEVELS  HUGE  DOWNSIDE  CORRECTION  IS  COMING  POST  MAR  15TH  GUYS  WAIT  FOR  850RS  LEVELS  HUGE  DOWNSIDE  CORRECTION  IS  COMING  POST  MAR  15TH  GUYS  WAIT  FOR  850RS  LEVELS  HUGE  DOWNSIDE  CORRECTION  IS  COMING  POST  MAR  15TH  GUYS  WAIT  FOR  850RS  LEVELS  HUGE  DOWNSIDE  CORRECTION  IS  COMING  POST  MAR  15TH  GUYS  WAIT  FOR  850RS  LEVELS  HUGE  DOWNSIDE  CORRECTION  IS  COMING  POST  MAR  15TH  GUYS  WAIT  FOR  850RS  LEVELS  HUGE  DOWNSIDE  CORRECTION  IS  COMING  POST  MAR  15TH  GUYS  WAIT  FOR  850RS  LEVELS  HUGE  DOWNSIDE  CORRECTION  IS  COMING  POST  MAR  15TH  GUYS  WAIT  FOR  850RS  LEVELS  HUGE  DOWNSIDE  CORRECTION  IS  COMING  POST  MAR  15TH  GUYS  WAIT  FOR  850RS  LEVELS  HUGE  DOWNSIDE  CORRECTION  IS  COMING  POST  MAR  15TH  GUYS  WAIT  FOR  850RS  LEVELS  HUGE  DOWNSIDE  CORRECTION  IS  COMING  POST  MAR  15TH  GUYS  WAIT  FOR  850RS  LEVELS  HUGE  DOWNSIDE  CORRECTION  IS  COMING  POST  MAR  15TH  GUYS  WAIT  FOR  850RS  LEVELS  HUGE  DOWNSIDE  CORRECTION  IS  COMING  POST  MAR  15TH  GUYS  WAIT  FOR  850RS  LEVELS  HUGE  DOWNSIDE  CORRECTION  IS  COMING  POST  MAR  15TH  GUYS  WAIT  FOR  850RS  LEVELS  HUGE  DOWNSIDE  CORRECTION  IS  COMING  POST  MAR  15TH  GUYS  WAIT  FOR  850RS  LEVELS  HUGE  DOWNSIDE  CORRECTION  IS  COMING  POST  MAR  15TH  GUYS  WAIT  FOR  850RS  LEVELS  HUGE  DOWNSIDE  CORRECTION  IS  COMING  POST  MAR  15TH  GUYS  WAIT  FOR  850RS  LEVELS  HUGE  DOWNSIDE  CORRECTION  IS  COMING  POST  MAR  15TH  GUYS  WAIT  FOR  850RS  LEVELS  HUGE  DOWNSIDE  CORRECTION  IS  COMING  POST  MAR  15TH  GUYS  WAIT  FOR  850RS  LEVELS  HUGE  DOWNSIDE  CORRECTION  IS  COMING  POST  MAR  15TH  GUYS  WAIT  FOR  850RS  LEVELS  HUGE  DOWNSIDE  CORRECTION  IS  COMING  POST  MAR  15TH  GUYS  WAIT  FOR  850RS  LEVELS  HUGE  DOWNSIDE  CORRECTION  IS  COMING  POST  MAR  15TH  GUYS  WAIT  FOR  850RS  LEVELS  HUGE  DOWNSIDE  CORRECTION  IS  COMING  POST  MAR  15TH  GUYS  WAIT  FOR  850RS  LEVELS  HUGE  DOWNSIDE  CORRECTION  IS  COMING  POST  MAR  15TH  GUYS  WAIT  FOR  850RS  LEVELS  HUGE  DOWNSIDE  CORRECTION  IS  COMING  POST  MAR  15TH  GUYS  WAIT  FOR  850RS  LEVELS  HUGE  DOWNSIDE  CORRECTION  IS  COMING  POST  MAR  15TH  GUYS  WAIT  FOR  850RS  LEVELS  HUGE  DOWNSIDE  CORRECTION  IS  COMING  POST  MAR  15TH  GUYS  WAIT  FOR  850RS  LEVELS  HUGE  DOWNSIDE  CORRECTION  IS  COMING  POST  MAR  15TH  GUYS  WAIT  FOR  850RS  LEVELS  HUGE  DOWNSIDE  CORRECTION  IS  COMING  POST  MAR  15TH  GUYS  WAIT  FOR  850RS  LEVELS  HUGE  DOWNSIDE  CORRECTION  IS  COMING  POST  MAR  15TH  GUYS  WAIT  FOR  850RS  LEVELS  HUGE  DOWNSIDE  CORRECTION  IS  COMING  POST  MAR  15TH  GUYS  WAIT  FOR  850RS  LEVELS  HUGE  DOWNSIDE  CORRECTION  IS  COMING  POST  MAR  15TH  GUYS  WAIT  FOR  850RS  LEVELS  HUGE  DOWNSIDE  CORRECTION  IS  COMING  POST  MAR  15TH  GUYS  WAIT  FOR  850RS  LEVELS  HUGE  DOWNSIDE  CORRECTION  IS  COMING  POST  MAR  15TH  GUYS  WAIT  FOR  850RS  LEVELS  HUGE  DOWNSIDE  CORRECTION  IS  COMING  POST  MAR  15TH  GUYS  WAIT  FOR  850RS  LEVELS  HUGE  DOWNSIDE  CORRECTION  IS  COMING  POST  MAR  15TH  GUYS  WAIT  FOR  850RS  LEVELS  HUGE  DOWNSIDE  CORRECTION  IS  COMING  POST  MAR  15TH  GUYS  WAIT  FOR  850RS  LEVELS  HUGE  DOWNSIDE  CORRECTION  IS  COMING  POST  MAR  15TH  GUYS  WAIT  FOR  850RS  LEVELS  HUGE  DOWNSIDE  CORRECTION  IS  COMING  POST  MAR  15TH  GUYS  WAIT  FOR  850RS  LEVELS  HUGE  DOWNSIDE  CORRECTION  IS  COMING  POST  MAR  15TH  GUYS  WAIT  FOR  850RS  LEVELS  HUGE  DOWNSIDE  CORRECTION  IS  COMING  POST  MAR  15TH  GUYS  WAIT  FOR  850RS  LEVELS  HUGE  DOWNSIDE  CORRECTION  IS  COMING  POST  MAR  15TH  GUYS  WAIT  FOR  850RS  LEVELS  HUGE  DOWNSIDE  CORRECTION  IS  COMING  POST  MAR  15TH,surajJNS,2025-03-12 09:54:00,Guys wait for 850rs levels huge downside correction is coming post Mar 15th Guys Wait for 850rs Levels Huge Downside Correction is Coming Post Mar 15th Guys Wait for 850rs LEVELS HUGE DEOWN DOWNESDED Correction is Coming Post Mar 15th Guys Wait for 850rs Levels Huge Downside Correction is Coming Post Mar 15th Guys Wait for 850rs Levels LEVEGE DOWNSIDE CORRECTION is Coming Post Mar 15th Guys for 850rs Levels huge downside correction is coming post mar 15th guys wait for 850rs levels huge downside correction is coming post mar 15th guys wait for 850rs levels levels 15th Guys Wait for 850rs Levels Hugnside Correction is Coming Post Mar 15th Guys Wait for 850rs Levels Huge Downside CORRECTION is Coming Post Mar 15th Guys Wait for 850rs LEVELS LEVELS LEVELS HUGE DOWNESDE Correction is Coming Post Mar 15th Guys Wait for 850rs Levels Huge Downside Correction is Coming Post Mar 15th Guys Wait for 850rs Levels LEVEGE DOWNSIDE CORRECTION is Coming Post Mar 15th Guys for 850rs Levels huge downside correction is coming post mar 15th guys wait for 850rs levels huge downside correction is coming post mar 15th guys wait for 850rs levels levels 15th Guys Wait for 850rs Levels Hugnside Correction is Coming Post Mar 15th Guys Wait for 850rs Levels Huge Downside CORRECTION is Coming Post Mar 15th Guys Wait for 850rs LEVELS LEVELS LEVELS HUGE DOWNESDE Correction is Coming Post Mar 15th Guys Wait for 850rs Levels Huge Downside Correction is Coming Post Mar 15th Guys Wait for 850rs Levels LEVEGE DOWNSIDE CORRECTION is Coming Post Mar 15th Guys for 850rs Levels huge downside correction is coming post mar 15th guys wait for 850rs levels huge downside correction is coming post mar 15th guys wait for 850rs levels levels 15th Guys Wait for 850rs Levels Hugnside Correction is Coming Post Mar 15th Guys Wait for 850rs Levels Huge Downside CORRECTION is Coming Post Mar 15th Guys Wait for 850rs LEVELS LEVELS LEVELS HUGE DOWNESDE Correction is Coming Post Mar 15th Guys Wait for 850rs Levels Huge Downside Correction is Coming Post Mar 15th Guys Wait for 850rs Levels LEVEGE DOWNSIDE CORRECTION is Coming Post Mar 15th Guys for 850rs Levels huge downside correction is coming post mar 15th guys wait for 850rs levels huge downside correction is coming post mar 15th guys wait for 850rs levels levels 15th Guys Wait for 850rs Levels Hugnside Correction is Coming Post Mar 15th Guys Wait for 850rs Levels Huge Downside CORRECTION is Coming Post Mar 15th Guys Wait for 850rs LEVELS LEVELS LEVELS HUGE DOWNESDE Correction is Coming Post Mar 15th Guys Wait for 850rs Levels Huge Downside Correction is Coming Post Mar 15th Guys Wait for 850rs Levels LEVEGE DOWNSIDE CORRECTION is Coming Post Mar 15th Guys for 850rs Levels huge downside correction is coming post mar 15th guys wait for 850rs levels huge downside correction is coming post mar 15th guys wait for 850rs levels levels 15th Guys Wait for 850rs Levels Hugnside Correction is Coming Post Mar 15th Guys Wait for 850rs Levels Huge Downside CORRECTION is Coming Post Mar 15th Guys Wait for 850rs LEVELS LEVELS LEVELS HUGE DOWNESDE Correction is Coming Post Mar 15th Guys Wait for 850rs Levels Huge Downside Correction is Coming Post Mar 15th Guys Wait for 850rs Levels LEVEGE DOWNSIDE CORRECTION is Coming Post Mar 15th Guys for 850rs Levels huge downside correction is coming post mar 15th guys wait for 850rs levels huge downside correction is coming post mar 15th guys wait for 850rs levels levels 15th guys wait for 850rs levels huge downside correction is coming post Mar 15th Guys Wait for 850rs Levels Huge Downside CORRECTION is Coming Post Mar 15th,0.9682,Positive
Tata Chemicals,"stock  down  6  %  down  as  expected,  but  stock  may  bounce  from  here",DrPravin,2025-03-12 09:43:00,"Stock down 6 % down as expected, Butt Stock May Bounce from Here",0.0,Neutral
Tata Chemicals,"Ratan  Tata  has  made  this  into  a  personal  grudge  and  fight  which  is  unacceptable  and  is  in  poor  light.  It  must  be  noted  that  Tata  Sons  belongs  to  Tata  Trusts  and  is  not  personally  owned  by  Ratan  Tata,  whereas  18  percent  stake  in  Tata  Sons  is  individually  owned  by  Shapoorji  Group.  This  is  the  big  difference.",Mrch,2025-03-12 09:18:00,"Ratan tata has made this into a personal grudge and fight which is unacceptable and is in poor light.  It must noted that tata sons belongs to tata trusts and is not personally owned by raatan tata, whereas 18 percent stake in tata sons is individually ovened by Shapoorji Group.  This is the big difference.",-0.6808,Negative
