Stock,Comment,Commented By,Timestamp,Translated_Text,Sentiment_Score,Sentiment_Label
Tata Chemicals,all  the  bulls  in  the  counter  check  the  price  now  cautioned  all  at  1344  levels  to  short  now  see  the  price  .  7  year  experience  ????,G024,2025-03-11 09:16:00,All the bulls in the counter check the price now Kaushanad Alt 1344 levels was the price.  7 Year Experience ????,0.0,Neutral
Tata Chemicals,"By  Friday,  it  might  be  in  3  digits.",Raj1961,2025-03-11 09:11:00,"B Friday, Tit Mighat Bay In 3 Digits.",0.0,Neutral
Tata Chemicals,"As  expected,  10%  down  opening.  By  end  of  the  day,  atleast  20%  fall  expected.",Raj1961,2025-03-11 09:10:00,"As expected, 10% down opening.  B End of the Day, Atlest 20% Fall Excluded.",0.0,Neutral
Tata Chemicals,"Lo  bhai,  10%  lower  circuit  in  pre  opening  itself..",lxkamath,2025-03-11 09:04:00,"Lo brother, 10% lower circuit in opening Itselph ..",-0.296,Negative
Tata Chemicals,it  will  zoom  today  as  maximum  comments  negative,dhillon556,2025-03-11 09:00:00,IT will Zoom Todayas Maximum Comments Negative,-0.5719,Negative
Tata Chemicals,is  your  fathheerrr  ever  bough  100  lot.  dobbaaa,tanm,2025-03-11 08:48:00,This Your Faithirr Ever Bogh 100 Lot.  Dobbaaa,0.0,Neutral
Tata Chemicals,"The  stock  has  risen  nearly  40  percent  so  far  this  month  on  hopes  that  Tata  Sons  will  come  out  with  an  IPO  in  September  2025.  If  that  happens,  Tata  Chemicals  holds  roughly  3  percent  in  Tata  Sons,  which  at  current  price  is  roughly  equal  to  the  market  cap  of  Tata  Chemicals.  Bull  argument:  The  Tata  Sons  IPO  will  most  likely  happen  in  September  2025.  Also,  Tata  Chemicals  is  set  to  commission  a  new  soda  ash  plant.  Bear  argument:  The  Tata  group  may  find  another  way  to  comply  with  the  RBI  requirement  without  necessarily  listing  Tata  Sons.  There  are  certain  short-term  challenges  in  the  soda  ash  demand-supply  dynamics  due  to  weak  demand  in  Western  Europe.  Suppliers,  majorly  from  Turkey  are  exporting  soda  ash  beyond  Europe  and  this  has  impacted  global  prices  adversely.",kamal20,2025-03-11 08:24:00,"The stock has risen nearly 40 percent so far this month on hopes that tata sons will come out with an ipo in September 2025. IF that Haappens, Tata Chemicals Holds Roghly 3 percent in TATA SONS, Whiche Current price is roughly equal to the market cap of tata chemicals.  Bull argument: The tata sons iPo will most likely happy in September 2025. Also, tata chemicals is set to commission a new soda ash plant.  Bear Argument: The Tata Group May Find Another Way to Comply with the RBI Requirement without Necessarily Listing Tata Sons.  There are certain short-term challenges in the soda ash demand-suppply dynamics due to weak demand in Western Europe.  Suppliers, Majorly from Turkey are experting",-0.4404,Negative
Tata Chemicals,"Active  names  and  traded  stake:  Graviton  Research  Capital  (0.87  percent),  Aakraya  Research  (0.6  percent)  Stock  movement  and  volumes:  Gained  11.61  percent  to  Rs  1315.25.  Trading  volumes  at  5  crore  shares  versus  1-month  average  of  23  lakh  shares  Technicals:  Stock  is  above  50-DMA  and  200-DMAFundamental  trigger,  if  any:  Speculations  around  parent  Tata  Sons  listing  could  potentially  result  in  a  huge  value  unlocking  for  Tata  Chemicals",kamal20,2025-03-11 08:17:00,"Active Names and Traded Stake: Graviton Research Capital (0.87 Percent), Aakraya Research (0.6 Percent) Stock Movement and Volumes: Gained 11.61 Percent to Rs 1315.25.  Trading Volumes at 5 Crore Shares Versus 1-Month Average of 23 Lakh Shares Technicals: Stock is Above 50-DMA and 200-DMAFUNDANDAMENTAL Trigger, If any: Speculation Around PARENT TATANTING LISTING COLLDE Potentially result in a huge value unlock for tata chemicals",0.9081,Positive
Tata Chemicals,Today  35  percent  gapdown...I  am  holding  100  lots  ot  1340  put  option...Let  s  enjoy,Bond_008,2025-03-11 08:16:00,Today 35 % Gaupaon ... Mr. Holding 100 Lots source 1340 Poot Options ...,0.4939,Positive
Tata Chemicals,today  lower  circuit  for  sure,do34,2025-03-11 07:54:00,Today lower circuit for sure,0.0258,Positive
Tata Chemicals,pura  portfolio  bech  ke  put  mai  laga  de   hi  profit  hoga  tera  ????????????????,Roy897,2025-03-11 07:45:00,The entire portfolio sells will be the profit of you ????????????????,0.594,Positive
Tata Chemicals,"Don  t  skirt  IPO,  Tata  Sons  The  Tata  group  s  principal  investment  holding  company  should  use  it  as  an  opportunity  to  simplify  its  structure.  THE  FINANCIAL  EXPRESS",Rony677,2025-03-11 07:22:00,"Don t skirt iPo, tata sons the tata group S Principal Investment Holding Company Should Use it as an Opportunity to Simplife Its Structure.  The Financial Express",0.4215,Positive
Tata Chemicals,this  stock  is  in  fno  ban  today.  how  much  corrections  can  be  expected?,vellai123,2025-03-11 07:06:00,This stock is in a bun tode.  How Mach Kareches can be expected?,-0.5574,Negative
Tata Chemicals,Meeeeet  lets  wait  for  2  more  hours  everything  will  be  clear,gaks221,2025-03-11 06:57:00,Meetit Lams Wet for 2 More Hors Eventing Will Bay Clear,0.3818,Positive
Tata Chemicals,"The  speed  with  which  it  has  gone  up,it  will  come  down  from  tomorrow  due  to  No  Listing  report  Mark  my  words!  Buy  Out  of  the  money  PE  it  will  Blast!",Meeeeeeet,2025-03-11 01:27:00,"The speed with which it has gone up, it will come down from Tomorrow Due to No Listing Report Mark My Words!  Buy out of the money pe its will blast!",-0.4184,Negative
Tata Chemicals,"According  to  VLA  Ambala,  ""we  can  expect  target  ranging  from  Rs  1500  to  2100  in  the  next  one  month  to  max  24  months.  Use  any  dip  up  to  1000  for  averaging.  It  is  a  quality  stock  and  view  should  be  mid-term  to  long  run.  Now,  if  your  view  is  only  for  swing  trading  (short  term  then  use  trailing  at  1110)  and  can  do  averaging  up  to  1160.""  Read  more  at:",Rony677,2025-03-10 23:59:00,"According to Vla Ambala, ""We can expect target ranging from Rs 1500 to 2100 to 2100 in the next one month to max 24 months. Run. Now, if your view is only for Swing Trading  Read more at:",0.0,Neutral
Tata Chemicals,Buy  PE  in  Bulk  1100  and  1200  PE  look  very  attractive  at  this  price!,Meeeeeeet,2025-03-10 23:33:00,Buy Pay in Bulk 1100 and 1200 Pay Look Vary Atrocity This Price!,0.54,Positive
Tata Chemicals,It  is  almost  certain  that  it  will  open  4-6%  down  and  than  will  correct  12-14%  in  two  days  I  have  caught  the  Top  with  10  lots  of  1100/-  PE  Hoping  for  huge  returns,Meeeeeeet,2025-03-10 23:06:00,It is almost certain that it will open 4-6% down and than will correct 12-14% in two caught the top with 10 lots of 1100/-pe hoping for huge returns,0.7722,Positive
Tata Chemicals,India-EFTA  trade  deal  signed  today  gives  access  to  duty  free  exports  of  Chemicals  to  EFTA  countries  by  India.  Tata  Chemicals  stands  to  gain  by  this  trade  deal  hugely.,A_Ranj,2025-03-10 22:33:00,India-Efta Trade Deal Signed Today Gives Access to Duty Free Exports of Chemicals to Efta Countries by India.  Tata Chemicals Stands to Gain By This Trade Deal Hugly.,0.7717,Positive
Tata Chemicals,Kal  morning  9.30  ko  milege  dosto.  Iss  baar  draw  nahi  hogaa.  Ya  toh  bull  winner  hoga  nahin  toh  fir  bear.,Allwaysinswag_1981,2025-03-10 21:45:00,"Morning 9.30 will meet friends tomorrow.  This time will not be drawn.  Or it will not be a bull winner, then Bayer again.",0.5859,Positive
Tata Chemicals,12  hours  from  now  Tata  chemicals  will  lead  the  rally  along  with  the  Tata  group  of  stocks,DMJF,2025-03-10 21:41:00,12 Horse from Now Tata Chemicals Will Lead The rally Along with the Tata Group of Stocks,0.0,Neutral
Tata Chemicals,"SEMICONDUCTOR  chips  industry  is  not  Every  company  Cup  of  Tea...  its  need  Lot  of  Infrastructure,  Huge  Investment  and  Deep  Tech  team....TATA  Group  can  only  Deal  with  it....  TATA  group  is  unmatchable....So  there  is  no  irrespective  of  fall  in  any  TATA  group  stocks....",Sourabhraj,2025-03-10 21:37:00,"Semiconductor chips industry is not every company cup of tea ... its need lot of infrastructure, huge investment and deep tech team .... tata group can only deal with it .... There is no irrespective of fall in any tata group stocks ....",0.0258,Positive
Tata Chemicals,just  wait  and  watch  the  upcoming  never  seen  before  show  by  tatachem.,ani0008,2025-03-10 21:25:00,Just weight and watch the upcoming Never Scene Bifour Show Bay Tatchan.,0.0,Neutral
Tata Chemicals,TataChemicals  minimum  appreciate  15  to  20  percent  on  Monday  trading.,ramnath_64,2025-03-10 21:24:00,Tattakemicals minimum apprisite 15 and 20 percent trading.,0.4019,Positive
Tata Chemicals,Modis  vision  30  trillion  dollar  economy  will  be  fulffiled  only  if  tata  sons  ipo  like  listing  to  be  done.  There  will  not  be  not  be  any  alternative  for  tata  sons.  There  will  be  tata  sons  ipo.  No  relaxation  for  any  comoany  for  violation  of  rules.,Double_gandhi,2025-03-10 20:02:00,Modis Vision 30 Trillion Dollar Economy Will Be Fulfled Only if Tata Sons iPo Like Listing to be done.  There will not be not be any alternative for tata sons.  There will be tata sons iPo.  No Relaxation for Any Comoany for Violation of Rules.,0.3612,Positive
Tata Chemicals,Tata  Chemicals  ki  hidden  value  ka  malum  iske  pehle  kisi  ko  nahi  tha  lekin  jaise  hi  Spark  capital  ki  valuation  report  ayi  Tata  Sons  IPO  ko  le  ke  tabhi  achanak  sab  kudd  pade.  Ab  agar  Tata  Sons  IPO  nahi  laya  toh  firse  Tata  Chemicals  ke  fundamental  khatam  ho  jayega,Allwaysinswag_1981,2025-03-10 19:48:00,Tata Chemicals Ki Hidden Value Ka Malum iske pehle kisi ko nahi tha lekin jaise hi spark capital ki Valuation report ayi tata sons iPo ko le ke tabhi achanak sab kudd pade.  Ab agar tata sons iPo nahi laya toh fires tata chemicals ke fundamental khatam ho jayega,0.5106,Positive
Tata Chemicals,people  posting  whatever  the  feel  like  .  If  this  company  is  not  from  Tata  group  the  share  price  will  not  be  this  much  and  if  no  tata  son  Ipo  then  also  it  may  not  fall  substantially  irrespective  profit  and  loss  .  Small  investors  are  being  cheated  on  this  high  share  price.  Wish  share  price  fall  substantially  to  make  it  incline  with  sales  and  profit,sribha,2025-03-10 19:48:00,People Posting Whatever the feel like.  If this company is not from tata group the share price will not be this time and if no tata son iPo then  Small Investors are Being Cheated on This High Share Price.  Wish Share Price Fall Substantily to Make It Incline With Sales and Profit,0.854,Positive
Tata Chemicals,there  years  is  the  time  fame  and  so  expected  by  Sep  2025,kamal20,2025-03-10 18:46:00,There Years this Time Fame and So So Extempted Bay Sep 2025,0.4404,Positive
Tata Chemicals,"Among  the  potential  courses  of  action  under  consideration  by  Tata  Sons,  there  is  contemplation  regarding  the  possibility  of  hiving  off  Tata  Capital  to  ensure  compliance.",kamal20,2025-03-10 18:46:00,"Among the potential courses of Action under consider by tata sons, there is contemplation Regarding The Possibility of Hiving Off Tata Capital to ENSURE COMPLIANCE.",0.3818,Positive
Tata Chemicals,Tata  Sons  is  considering  various  avenues  to  adhere  to  the  Reserve  Bank  of  Indias  (RBI)  mandates  regarding  upper-tier  Non-Banking  Financial  Companies  (NBFCs).,kamal20,2025-03-10 18:45:00,Tata Sons is Considering Various Avenues to Adhere to the Reserve Bank of India (RBI) Mandates Regarding Upper-Tier Non-Banking Financial Companies (NBFCS).,0.0,Neutral
Tata Chemicals,Tata  group  of  stocks  will  be  on  roll  from  tomorrow  onwards  with  Tata  chemicals  leading  the  rally.  Market  sentiments  are  strong  for  Tatas  at  the  moment.  Semi  conductor  plant  establishment  is  one  of  the  greatest  feat  and  looks  directly  to  challenge  the  dominance  of  china  and  Taiwan  in  the  semiconductor  chip  industry,DMJF,2025-03-10 18:34:00,Tata Group of Stocks will be on Roll from Tomorrow Onwards with Tata Chemicals Leading The Rally.  Market Sentiments are strong for tatas at the moment.  Semi Conductor Plant Establishment is one of the greenst feat and looks directly to challenge the dominance of china and taiwan in the semiconductor chip industry,0.8625,Positive
Tata Chemicals,"Semi  conductor  plant  by  Tatas  to  open  shortly  and  may  possibly  be  inaugurated  by  PM  Modi.  Sources  TOI.
If  this  happens  then  Tata  chemicals  will  be  in  focus  too  because  soda  ash  will  be  required  in  huge  quantities  and  big  orders  expected.  On  top  of  these  IPO  is  now  imminent  as  funds  will  be  required  to  support.  Cheers  to  all  long  term  investors.",DMJF,2025-03-10 18:31:00,"Semi Conductor Plant by Tatas to Open Shortly and May Possibly Be Inaugurated by PM Modi.  Sources toi.
If this Haappens then Tata Chemicals will be in Focus too because soda ash will be required in huge quantities and big orders expected.  On top of these iPo is now Imminent as funds will be required to support.  Cheers to all long term investors.",0.836,Positive
Tata Chemicals,"After  almost  3  long  years,  there  is  a  big  breakout  with  huge  volumes.  The  up  trend  will  continue  as  there  is  a  strong  possibility  of  some  good  news  backing  this  breakout.  Cheers  to  all  long  term  investors",DMJF,2025-03-10 18:18:00,"After almost 3 long years, there is a big breakout with huge volumes.  The up trend will continue as there is a strong passibility of some good news backing this breakout.  Cheers to all long term investors",0.8934,Positive
Tata Chemicals,"Tata  Sons  have  no  option  other  than  listing  5%,  value  of  which  is  Rs.  55,000  Cr.  If  RBI  gives  them  an  exit  rope  to  escape  on  technalities,  there  are  15  listed  NBFC-UL  which  are  bound  to  revolt  asking  RBI  for  concessions  including  Mahindra  Finance,  Bajaj  Finance  etc.  RBI  cant  afford  two  separate  rules.",abusaahil,2025-03-10 17:47:00,"Tata Sons has no option other than listing 5%, value of which is Rs.  55,000 Cr.  If RBI Gives Them An Exit Rope to Escape on Technalities, There are 15 listed nbfc -ul which are bound to revolt asking RBI for concepts including Mahindra Finance, Bajaj Finance ETC.  RBI Cant Afford Two Separate Rules.",0.2263,Positive
Tata Chemicals,Tatas  are  not  going  to  list  Sons  IPO  anytime  soon.  Forget  it.  They  have  already  started  to  search  alternatives  to  get  exemptions  from  RBI.  They  have  all  means  to  payoff  the  Rs  20000  Crores  debts  to  avoid  listing  process.,Raj1961,2025-03-10 17:44:00,Tatas are not going to list sons iPo Anytime Soon.  Forget it.  They have already started to search alternatives to get exemptions from RBI.  They have all means to payoff the rs 20000 years debts to avoid listing process.,-0.4767,Negative
Tata Chemicals,"EFTA  trade  deal  signed  with  swiss,  Norway  and  key  exports  to  EFTA  countries  include  organic  and  inorganic  chemicals,  drugs  and  pharmaceuticals,  gems  and   positive  for  chemical  Industry",masti02,2025-03-10 17:42:00,"Efta Trade Deal Signed With Swiss, Norway and Key Exports to EFTA Countries Include Organic and Inorganic Chemicals, Drugs and Pharmaceuticals, GEMS and Positive for Chemical Industry",0.5574,Positive
Tata Chemicals,Strong  speculation  that  Tata  Sons  will  get  listed...  -  Market  expert  shares  best  way  to  play  the  Tata  IPO  from  latest  article  ET  NOW,Rony677,2025-03-10 16:40:00,Strong Speculations that Tata Sons Will Gate Listed ... - Market Expert Shares Best Way To Play Tata IPO from Latest Article It Now,0.9022,Positive
Tata Chemicals,"Lets  see  gaks  ,  tomorrow  result  will  out  of  our  doubt",Allwaysinswag_1981,2025-03-10 16:38:00,"Latus C Gakus, Tumaro Result will out of our dout",-0.3612,Negative
Tata Chemicals,Also  still  there  are  no  comments  from  either   can  clearly  say  we  will  go  for  debt  rejig  and  be  out  of   they  have  declined  to   be  they  want  people  to  short  and  then  raise  the  price.  we  can  only  assume  game  of  these  big  players.,gaks221,2025-03-10 16:30:00,Also still there are no comments from eater can clearly say we will go for debt rejig and be out of them have declined to be they want people to short and then raise the price.  We can only assume game of these big players.,-0.1779,Negative
Tata Chemicals,today  economic  times  news  after  2years  long  time  tatachemical  technically  breakout.  at  1480/_  small  resistance  than  for  medium  term  target  is  1800  stop-loss  1150/_.  my  view  is  after  raising  of  2days  them  ipo  news  added  then  power  hotels  motors  raised.,PENNIKA,2025-03-10 16:02:00,Today Economic Times News after 2years long time tatachemical technically breakout.  at 1480/_ Small Resistance Than for Medium Tarm Tarm Tarm Tarm Tarm Tarm Tarm Tarm Tarm Tarm 1150/_.  My view is after Raising of 2Days Them Ipo News Added then Power Hotels Motors Raised.,0.0,Neutral
Tata Chemicals,"1500  level  will  come  but  only  after  1100.  Halwa  hai  kya  !!!  Jaise  chaho  uthado  !!!  29  feb  ko  jab  new  52  week  low  banaya  tha  tab  iska  fundamental,  ipo  mein  hisedari  tel  lene  gai  thi  kya  !!!  Ab  jab  IPO  ko  le  ke  confusion  wali  news  ayi  hai  sab  bulls  ko  iske  fundamentals  dikh  rahe  hai.  Iska  fundamental  ye  hai  ki  jab  market  new  high  bana  raha  tha,  Tata  Chemicals  apne  low  par  tha.  Ye  toh  brokerage  houses  ki  daya  hai  ki  40  percent  up  hua.  Ab  20  percent  giregaa.",Allwaysinswag_1981,2025-03-10 16:00:00,"1500 Level will come but only after 1100. Halwa hai kya !!!  Jaise chaho uthado !!!  29 Feb Ko Jab New 52 Week Low Banaya Tha Tab Iska Fundamental, iPo Mein Hisery Tel Lene Gai Thi Kya !!!  Ab jab iPo ko le ke confusion wali news ayi hai sab bulls ko iske fundamentals dikh rahe hai.  Iska Fundamental Ye Hai Ki Jab Market New High Bana Raha Tha, Tata Chemicals APNE Low Par Tha.  Ye Toh Brokerage Houses Ki Daya Hai Ki 40 Percent Up Hua.  AB 20 percent giregaa.",-0.8507,Negative
Tata Chemicals,I  am  happy  if  it  falls...  time  to  accumulate  for  investors,contaview,2025-03-10 15:49:00,Shri Am Happy Fals Fals ... Time to Investors,0.5719,Positive
Tata Chemicals,Also  futures  are  trading  at  a  discount  which  means  shorts  are  created  with  huge  quantities  so  its  all  going  to  be  a  suspense  of  what  will  happen  tomorrow,gaks221,2025-03-10 15:24:00,Also futures are trading at a discount which means shorts,0.5106,Positive
Tata Chemicals,limited  upside  for  tomorrow  n  limited  down  side  due  to  f  n  o  ban  from  tomorrow.,jagdish542,2025-03-10 15:20:00,"Ltd. subcide for tumors limited down side payable, then you are the film.",-0.7506,Negative
Tata Chemicals,Those  who  are  thinking  it  will  come  down  on  Monday  may  have  to   the  news  of  no  IPO  listing  share  would  have  anyways   is  in  F&O  ban  so  high  chances  that  first  it  will  go  till  1500  get  all  shorts  squared  off  and  then  come  down..F&O  ban  can  be  a  trap  for  shorter  and  not  buyers,gaks221,2025-03-10 15:18:00,Thos who are thinking it will come down on monday may have to the news of no iPo Listing Share Would have Anyways is in F & O Ban So High Chances that First It will go till 1500 get all shorts Squaned off and th Down..f & o ban can be a trap for shorter and not boyers,-0.8137,Negative
Tata Chemicals,Shilpa  Medicare  looking  good  above  435  with  SL  at  398.  Keep  the  first  target  at  475  and  the  second  target  at  525,neha_0103,2025-03-10 14:15:00,Shilpa Medicare Looking Good Abowe 435 with Slot 398. Keep the first target,0.4404,Positive
Tata Chemicals,seems  pennika  had  taken  ce  calls  but  whatever  I  think  will  only  consolidate  till  the  final  statement  received  from  Tatas,bapu007,2025-03-10 13:26:00,Calls Buq Buch of the Seams Pennika HD WHATER E Think Will only Consolidate Till the final statement,0.0,Neutral
Tata Chemicals,its  all  shorters  game  f  n  o  players  wants  it  down  they  dont  want  what  company  is   company  finding  way  from  sep2002  but  shorters  highlighted  it  now  to  make  fear,jimcorbet,2025-03-10 12:51:00,Its all shorters game f n o players wants it down,-0.6609,Negative
Tata Chemicals,indi  trade  group  capital  --  tata  chemicals  is  more  preferable  to  play  game  it  is  most  active  .  but  ntpc  is  prefer  than  tata  tata  power.  todays  article.,PENNIKA,2025-03-10 11:46:00,Indi Trade Group Capital - Tata Chemicals is more preferable to play game it is most active.  but ntpc is prefer than tata tata power.  Todays Article.,0.4269,Positive
Tata Chemicals,"Sudip  Bandyopadhyay,  Group  Chairman, Inditrade  Capital,  says  ""there  is  a  strong  speculation  that Tata  Sons will  get  listed  in  the  near  future  and  the  best  way  to  play  that  will  be  probably  through  Tata  Chemicals  that  is  the  conventional  thinking  in  the  market  and  that  led  to  this  kind  of  massive  rise  in  the  share  price  of Tata  Chemicals.",Rony677,2025-03-10 11:42:00,"Sudip Bandyopadhyay, Group Chairman, Inditrade Capital, Says ""There is a strong speculation that tata sons will get listed in the near future and the best way to play that will be probables The conventional thinking in the market and that line to this kind of massive risk in the share price of tata chemicals.",0.9022,Positive
Tata Chemicals,"Hi  Pennika,  couldnt  make  out  what  u  want  to  say,  pls  put  ,  and  .  in  between  words",shyamalb,2025-03-10 11:38:00,"Hee Pennika, Kuldant Make Out What  In Bitveen Words",0.1531,Positive
Tata Chemicals,rbi  strictly  said  ipo  must  by  the  end  of  September  2025  that  is  fact  but  tata  try  to  avoid  is  buzz  no  tata  said.,PENNIKA,2025-03-10 11:28:00,Rabi Strictly Sed IPO Must by and Septmber 2025 That is the fact but Tata Tara Tata Tata Tata Tata Side Tata Side.,-0.6808,Negative
Tata Chemicals,tata  chemical  is  not  only  in  soda  ash  business  it  has  some.speciallity  chemical  basket  also   small  revue  at  present  but  it  can  take  lead  in  ev  battery  manufacturing  and  sodium  iron  space   conductor  business  will  also  lead  some  revenue  add  in  this  gem   keep  holding  its  definitely  not  over  priced  at  1300  even  1500  possible  in  next  week   kachra  stocks  like  gensole  aogachi  appolo  micro  servitech  vmarc  etc  can  run  to  2x  3X  why  cant  tata  chemical  go  50%  up  ?,drsandip74,2025-03-10 11:06:00,Tata chemical is not only in soda Ash business it has some.speciallity chemical basket also small revue at present but it can take in the lead in Ev Battery Manufacturing and Sodium Iron Sodium Ir Business will also lead some revenue add in this gem keep holding its definitely not over priced at 1300 even 1500 posible in next week week kachra stocks like gensole Can Run to 2x 3x Why Cant Tata Chemical Go 50% up?,0.7783,Positive
Tata Chemicals,"Intrinsic  value  without  Tata  sons  IPO  around  2000.  Current  low  share  price  was  due  to  downturn  in  international  soda  ash  price.  Soda  ash  prices  near  bottom  &  will  stabilse  soon.  With  new  added  capacity,  other  than  coming  quarter,  results  will  also  improve.",shivagrwal,2025-03-10 10:40:00,"Intrinsic Value without Tata Sons iPo Around 2000. Current low share price was due to downturn in international soda ash price.  Soda Ash Prices Near Bottom & Will Stabilse Soon.  With new added capacity, other than Coming Quarter, Results will also also improve.",0.6597,Positive
Tata Chemicals,"Chemicals  stock  didnt  participated  in  recent  rallies  due  to  China  dumping.  Tata  chemicals  Increased  only  on  IPO  listing  rumours.  As  this  was  just  a  rumour,  it  will  come  to  its  original  level  of  Rs  900  from  where  it  started.",Raj1961,2025-03-10 09:27:00,"Chemicals Stock Didnt Participated in Recent Rallies due to China Dumping.  Tata Chemicals Increased only on IPO Listing Rumors.  As this was just a rumor, it will come to its original level of Rs 900 from where it starts.",0.2732,Positive
Tata Chemicals,"Very  good  comments,  it  a  buy  for  future  growth,  speculation  and  rumours  set  aside.  Tata  Sons  IPO  would  be  an  add  on.",KK Grover,2025-03-10 09:26:00,"Very good comments, Titra Buy for Future Growth, Speculation and Rampaus  Tata Sons Pool Wauld Ban Aid on.",0.6997,Positive
