Stock,Comment,Commented By,Timestamp,Translated_Text,Sentiment_Score,Sentiment_Label
Tata Chemicals,"tata  sons  exploring  options  including  ipo  amid  pressure  from  sp  group-  report.

the  sp  group  is  under  pressure  to  repay  rs  22,000  crore  in  debt  reportedly  by  march  2025.

tata  sons  is  the  holding  company  of  the  tata  group.",kamal20,2025-01-23 13:19:00,"Tata Sons Exploring Options Including IPO Amid Pressure from Sp Group- Report.

The SP group is under pressure to repay Rs 22,000 Crore in Debt Reportedly by March 2025.

Tata Sons is the Holding Company of the Tata Group.",-0.7096,Negative
Tata Chemicals,"i  believe  this  is  the  stock  that  ruins  investors  wealth  in  recent    mkt  fall,  massive    hit  on  the  stock   avoid  and  such  a  weak  stock  u  never  hold  for  long  term",bhanunadh,2025-01-23 12:13:00,"I believe this is the stock that ruins investors wealth in recent mkt fall, massive hit on the stock avoid and such a weak stock u never hold for long term",-0.5859,Negative
Tata Chemicals,possibility  of  tata  sons  listing  and  soda  ash  price  gains  makes  tata  chemicals  a  great  investment.  soon  should  get  back  to  1100.,Cool Bull,2025-01-23 11:21:00,Posibility of Tata Sons Listing and Soda Ash Price Gaens Max Tata Chemicals a Great Investment.  Soon Shud Gate Back 1100.,0.7579,Positive
Tata Chemicals,soo  gya  hai  tata...  stop  trading  start  investing  ..  fundamental  strong,Varun_Target,2025-01-21 20:01:00,Tata is Suu ... Stop Trading Start Investing .. Fundamental Strong,0.2732,Positive
Tata Chemicals,"https  tradebrains  in  features  fertiliser  stocks  jump  upto  after  govt  implements  mip  and  restricts  import  of  sodaash
read  this  article  buy  tata  chemicals  on  Monday   buy",kkkkais,2025-01-18 15:50:00,"https tradebrains in features fertiliser stocks jump upto after Govt Implements MIP and Restrictions Import of Sodaash
Read this article Buy Tata Chemicals on Monday Buy",-0.3182,Negative
Tata Chemicals,"government  has  announced  msp  for  soda  ash  ,  huge  benefit  to  tata  chemicals  only  player  in  soda  ash....",kkkkais,2025-01-17 14:58:00,"Government Has Announsade MSS for Soda Ash, Huje Benefit to Tata Chemicals only Player in Soda Ash ....",0.6486,Positive
Tata Chemicals,"sharp  move  in  soda  ash  -  china  soda  ash  price  extends  gains,  up  more  than  4prcnt  today,  rises  to  highest  levels  in  nearly  2  months.",kamal20,2025-01-17 13:00:00,"Sharp Move in Soda Ash - China Soda ash Price Extendus Gains, Sub More Tah 4 Perkant Today, Rises to the highest levels in the Aerly 2 Monthus.",0.4404,Positive
Tata Chemicals,ithuku  paruthi  mootai  pesama  godownla  ye  irruthirukalam,Nanjay,2025-01-17 10:55:00,Tehuku Paruthi Mutai Pesama Godovnla Yeh Rritirukalam,0.0,Neutral
Tata Chemicals,"RBI  says  Tata  Sons  appeal  to  avoid  listing  under  consideration.
As  per  the  extant  regulations,  non-banks  classified  as  upper  layer  entities  must  be  listed  within  three  years  from  date  of  classification.

RBI  says  Tata  Sons  appeal  to  avoid  listing  under  consideration.
As  per  the  extant  regulations,  non-banks  classified  as  upper  layer  entities  must  be  listed  within  three  years  from  date  of  classification.",kamal20,2025-01-16 20:13:00,"RBI Says Tata Sons Appeal to Avoid Listing Under Consideration.
As per the extant regulations, non-banks classified as upper layer entities must be listed with three years from date of classification.

RBI Says Tata Sons Appeal to Avoid Listing Under Consideration.
As per the extant regulations, non-banks classified as upper layer entities must be listed with three years from date of classification.",-0.5267,Negative
Tata Chemicals,buy  fast  this  will  blast  shortly          boom,luckykush,2025-01-16 13:44:00,Buy fast this will blast shortley boom,0.0,Neutral
Tata Chemicals,Jab  nifty  badhti  hai  tab  yeh  wahi  mara  rehta  hai  aur  jab  nifty  girti  hai  yeh  aur  marta  jaata  hai,Paras_11,2025-01-15 11:33:00,"When the Nifty increases, it remains mine and when the Nifty falls, it dies further",0.6597,Positive
Tata Chemicals,Yes  It  will  break  every  low  on  records  now      Worst  Chemical  Stock        Ab  iso  982  jaane  mein  maut  aayegi,Paras_11,2025-01-15 10:43:00,S IT will Break and Records Nau West Chemical Stock will now die in 982,-0.5423,Negative
Tata Chemicals,again  it  is  back  to  52  wk  lows..whether  it  will  sustain  or  break  to  lower  or  lowest   see  if  it  breaks  900  on  the  cards..,bhanunadh,2025-01-15 07:39:00,Again IT is back to 52 wak los ..,-0.5859,Negative
Tata Chemicals,"Because  Noel  TATA  dont  know  how  to  run  companies,  downfall  of  TATAs  are  sure....In  the  next  10  years  all  companies  will  be  closed  except  TATA  Motors  and  TCs",Paras_11,2025-01-14 15:15:00,"Because noel tata dont know how to run companies, downfall of tatas are sure .... in the next 10 years all companies will be found except tata motors and tcs",0.0,Neutral
Tata Chemicals,script  taken  u  turn  tommorow  it  will  hit  1020,subashsingh,2025-01-14 13:35:00,Script Star Turn Tomorov IT Will Hit 1020,0.0,Neutral
Tata Chemicals,"Maya  and  Leah  Tata  join  SRTII  board,  marking  next-gen  entry  into  Tata  Trusts.

The  two  sisters  will  replace  outgoing  trustees  Arnaz  Kotwal  and  Freddy  Talati,  who  stepped  down  to  make  way  for  their  appointments.

Noel  Tatas  daughters  appointed  to  Ratan  Tata  Institutes  board.

Maya  and  Leah  Tata  join  SRTII  board,  marking  next-gen  entry  into  Tata  Trusts.

The  two  sisters  will  replace  outgoing  trustees  Arnaz  Kotwal  and  Freddy  Talati,  who  stepped  down  to  make  way  for  their  appointments.

Noel  Tatas  daughters  appointed  to  Ratan  Tata  Institutes  board.",kamal20,2025-01-11 17:30:00,"Maya and Leah Tata Join SRTII Board, Marking Next-Gen Entry Into Tata Trusts.

The two Sisters will replace outgoing trustees arnaz kotwal and freddy talati, who steepped down to make way for their appointments.

Noel Tatas Daughters Appointed to Ratan Tata Institutes Board.

Maya and Leah Tata Join SRTII Board, Marking Next-Gen Entry Into Tata Trusts.

The two Sisters will replace outgoing trustees arnaz kotwal and freddy talati, who steepped down to make way for their appointments.

Noel Tatas Daughters Appointed to Ratan Tata Institutes Board.",0.9274,Positive
Tata Chemicals,"what  is  the  reason  for  the  fall  of  this  script  for  40  rs.  it  is  tremendous  fall  normally  not  happened  in  such  safe  script,  reason  unknown.",Nirajshahzen,2025-01-11 01:46:00,"What is the reason for the fall of this script for 40 Rs.  It is trendous fall normally not happy in such ach safe script, Reason Unknown.",0.4404,Positive
Tata Chemicals,i  think  it  reaches  52  wk  lows..massive   hope  of  going   this  is  a  virus  effect  or  any  other  news.,bhanunadh,2025-01-10 10:32:00,E Think Ret Raches 52 Vak Los..Masive Hope of Going This is the virus effect and other news.,0.4767,Positive
Tata Chemicals,this  stock  can  be  locked  in  the  upper  circuit  at  any  time.,siddy994,2025-01-09 09:58:00,This stock can be locked in the upper circuit at anne time.,0.0,Neutral
Tata Chemicals,buy  tata  chemical  at  1017  tgt  1040  intra  sl  1015,_Mihir,2025-01-07 14:27:00,Buy Tata Chemicality 1017,0.0,Neutral
Tata Chemicals,till  budget  tata  chemicals  will  hit  1150-1180-1200    due  special  package  to  agriculture  loot  lo  badh  meh  hath  nhi  ayega,subashsingh,2025-01-07 13:01:00,Til Budget Tata Chemicals,0.34,Positive
Tata Chemicals,What  happened  your  current  level  to  buy,shyambandhu99,2025-01-06 17:51:00,What Happanede Your Current Level To Buy,0.0,Neutral
Tata Chemicals,i  dont  see  any  upside  in  the  coming   loss..i  think  new  buyers  can  avoid  buying  this   use  to  buy  or  hold,bhanunadh,2025-01-06 10:58:00,E don't c and other subcide in the Coming Loos .. E Think New Buerus Can Avoid Bing This,-0.296,Negative
Tata Chemicals,Buy  at  current  level  for  a  target  of  1060  1107  very  soon,Rit2025,2025-01-05 17:56:00,Buyant Current Level for Target of 1060 1107 Vary Sun,0.0,Neutral
Tata Chemicals,Stock  has  underperformed  for  last  3  years.  Investing  in  present  downcycle  may  prove  beneficial,Mrch,2025-01-01 15:00:00,Stock Hasmandarparpormed for Last 3 Years.  Investing in Present Donceckley My Prove Benefitant,0.4404,Positive
Tata Chemicals,Tata  chemicals  Target  -1260  January  expiry,siddy994,2025-01-01 08:57:00,Tata Chemicals Target -1260 Januari expiry,0.0,Neutral
Tata Chemicals,today  direct  19  to  0  because  foreign  brokarage  given  tgt  price  of  800  so  I  have  one  lot  so  loss...,688726,2025-01-01 08:41:00,Today Direct 19 to 0 Bikoz Foreign Brokege Given Tagat Price of 800 Soi Heve One Lot So Loos ...,0.0,Neutral
Tata Chemicals,spot  1050  and  1070  is  major  hurdel  closing  above  this  big  move  is  waiting,RRR0909,2024-12-31 10:54:00,Spot 1050 & 1070 This Major Hurdle Closing Awove This Big Move This Waiting,0.0,Neutral
Tata Chemicals,"Nalanda  MP  writes  to  FM  on  TataSonsIPO,  says  IPO  is  deliberately  delayed  and  seeks  FMs  intervention",kamal20,2024-12-30 17:24:00,Nalanda Pump Writes to Fums,-0.2263,Negative
Tata Chemicals,upper  circuit  soon   circuit  soon,RajasekharCMA,2024-12-30 10:22:00,Upper Circuit Soon Circuit Soon,0.0,Neutral
Tata Chemicals,"sandeshj007,  people  are  waiting  for  your   show  the  path  to  them",kamal20,2024-12-24 17:25:00,"Sandeshj 007, Peepal is waiting for your show the path to stop",0.0,Neutral
Tata Chemicals,"Tata  Investment,  Tata  Chemicals,  Tata  Motors  shares  jump  up  to  12prcnt  as  Tata  Capital’s  mega  IPO  work  begins.

Tata  stocks  rallied  on  Tuesday  after  the  group  began  work  on  a  Rs  15,000-crore  IPO  of  financial  services  arm  Tata  Capital.  The  move  sparked  interest  in  Tata  Chemicals,  Tata  Motors,  and  Tata  Investment  Corp  due  to  their  equity  share  holding  in  Tata  Sons  or  Tata  Capital.

Tata  Capital  IPO  is  expected  to  raise  over  Rs  15,000  crore  and  will  include  a  mix  of  primary  and  secondary  share  sales.

Tata  Investment,  Tata  Chemicals,  Tata  Motors  shares  jump  up  to  12prcnt  as  Tata  Capital’s  mega  IPO  work  begins.

Tata  stocks  rallied  on  Tuesday  after  the  group  began  work  on  a  Rs  15,000-crore  IPO  of  financial  services  arm  Tata  Capital.  The  move  sparked  interest  in  Tata  Chemicals,  Tata  Motors,  and  Tata  Investment  Corp  due  to  their  equity  share  holding  in  Tata  Sons  or  Tata  Capital.

Tata  Capital  IPO  is  expected  to  raise  over  Rs  15,000  crore  and  will  include  a  mix  of  primary  and  secondary  share  sales.",kamal20,2024-12-24 13:16:00,"Tata Investment, Tata Chemicals, Tata Motors Shares Jump Up to 12PRCNT as Tata Capital’s Mega iPo Work Begins.

Tata Stocks Rallied on Tuesday after the group began work on a Rs 15,000-croor iPo of Financial Services Arm Tata Capital.  The move sparked interest in tata chemicals, tata motors, and tata investment corp due to their rights share holding in tata sons or tata capital.

Tata Capital IPO is Expected to Raise Over Rs 15,000 Crore and will include a Mix of Primary and Secondary Share Sales.

Tata Investment, Tata Chemicals, Tata Motors Shares Jump Up to 12PRCNT as Tata Capital’s Mega iPo Work Begins.

Tata Stocks Rallied on Tuesday after the group began work on a Rs 15,000-croor iPo of Financial Services Arm Tata Capital.  The move sparked interest in tata chemicals, tata motors, and tata investment corp due to their rights share holding in tata sons or tata capital.

Tata Capital IPO is Expected to Raise Over Rs 15,000 Crore and will include a Mix of Primary and Secondary Share Sales.",0.9451,Positive
Tata Chemicals,"Tata  Motors,  Tata  Chemicals  up  1prcnt  as  Tata  Capitals  mega  IPO  work  begins",kamal20,2024-12-24 12:36:00,"Tata Motors, Tata Chemicals Sub 1 Perknuts Tata Capitals Mega IPO Work Begins",0.0,Neutral
Tata Chemicals,today  10  to  15  percent  circuit  possible  just  wait  it  will  show  good  move,_Mihir,2024-12-24 11:15:00,Today 10 then 15 % Circuit Possible Just Wet IT will show good move,0.4404,Positive
Tata Chemicals,buy  tata  chem  at  CMP  1092  tgt  1120  intra  above  this  can  hit  15  to  20  percent,_Mihir,2024-12-24 11:02:00,Buy Tata Chemat Compass 1092,0.0,Neutral
Tata Chemicals,Buy  Tata  chemicals  at  current  price  with  a  target  of  1110.,faga1234,2024-12-24 10:50:00,Buy Tata Chemicals,0.0,Neutral
Tata Chemicals,import  duty  on  caustic  soda  also  decrease  from  7.5  to  2.5  lead  to  biggest  impact  on  tata  chemical  as  biggest  manufacturer,kp8002,2024-12-12 14:54:00,"Import Duty, Caustic Soda Also Decrey from 7.5 and 2.5 leads, Biggast Impacts, Tata Chemicals Biggast Manufacturer",0.0,Neutral
Tata Chemicals,Allied  Silica  and  its  promoter  filed  a  statement  of  claims  against  the  company  in  arbitration  proceedings.  The  company  expected  a  favourable  outcome  and  no  material  financial  impact.,kamal20,2024-12-12 08:46:00,Allied Silica and Its Promoter Filed A Statement of Claims Against the company in Arbitration Proceedings.  The company expected a favorite outcome and no material finance.,-0.296,Negative
Tata Chemicals,"Tata  Trusts  continues  to  oppose  SP  Groups  plan  to  transfer  Tata  Sons  pledged  shares  for  loan  refinancing-  Report.

Tata  Trusts  continued  opposition  to  the  transfer  of  Tata  Sons  pledged  shares  may  pose  a  significant  challenge  to  the  Shapoorji  Pallonji  Groups  efforts  to  refinance  its  loans.

Shapoorji  Pallonji  Group  initially  raised  loans  against  a  pledge  of  its  Tata  Sons  shares.",kamal20,2024-12-11 11:15:00,"Tata Trusts Continues to OPPOSE Sp Groups Plan to Transfer Tata Sons Pledged Shares for Loan Refinancing- Report.

Tata Trusts Continued Opposition to the Transfer of Tata Sons Pledged Shares May Pose a Significant Challenge to the Shapoorji Pallonji Pallonji Pallonji Pallonji Groups Eforts to refinance its loans.

Shapoorji Pallonji Group Initially Raised Loans Against a PLEDGE of Its Tata Sons Shares.",0.9169,Positive
Tata Chemicals,"everyday  expiry  was  the  new  blessing  for  brokers  or  retail  traders,  whats  your  take  on  this,  SEBI  took  it  all  away",rit55,2024-12-10 17:33:00,"Everyday expiry was the new Blacing for Brokers and Retail Traders, Whats Your Techn",0.4939,Positive
Tata Chemicals,"Tata  Chemicals  stock  in  focus  after  RBI  replies  to  an  RTI  on  Tata  Sons  listing

The  Reserve  Bank  of  India  RBI,  in  response  to  an  RTI  query,  stated  that  Tata  Sons  applications  regarding  an  IPO  exemption  and  the  surrender  of  its  Certificate  of  Registration  COR  as  a  Core  Investment  Company  CIC  are  under  examination.",kamal20,2024-12-10 12:33:00,"Tata Chemicals Stock in Focus after RBI Replies to An RTI on Tata Sons Listing

The reserve bank of India rbi, in response to an rti Query, stated that Tata Sons Applications Regarding an iPo Examption and the surrender of its certificate of registration corr in the cor incend Examination.",0.0,Neutral
Tata Chemicals,likely  to  move  to  1140  1160  range  this  week,shivagrwal,2024-12-09 21:12:00,Licaly to move to 1140 1160 range this week,0.0,Neutral
Tata Chemicals,underrated  stock  which  has  great  potential,Mrch,2024-12-04 14:06:00,Granderrateed Stock Which Has Great Potential,0.6249,Positive
Tata Chemicals,"Tata  Chemicals

        Sector-  Commodity  Chemicals
        Market  capitalisation  BSE  –  Full-  Rs  27,243  crore
        No.  of  PMS  strategies  that  bought  the  stock-  3
        Sample  of  PMS  strategies  that  added  the  stock  recently-  Bonanza  -  Edge",kamal20,2024-11-25 22:01:00,"Tata chemicals

        Sector-Commodity Chemicals
        Market Capitalization BSE- Full- Rs 27,243 Crore
        No.  of PMS strategies that bogt the stock- 3
        Sample of PMS strategies that added the stock recently- Bonanza - Edge",-0.296,Negative
Tata Chemicals,"actually  every  year  2to  3  times  it  is  being  played.
operators  are  making  us  fools.
If  anybody  is  interested  they  can  buy  and  hold  stock  delivery  mode.
you  will  lose,if  going  in  options  root.",rcora69,2024-11-19 19:01:00,"Actually every year 2to 3 time it is being played.
Operators are making us fools.
If anybody is interested they can buy and hold stock delivery mode.
You will lose, if going in options root.",0.2263,Positive
Tata Chemicals,This  scrap  may  come  52  low   operators,RajasekharCMA,2024-11-13 13:02:00,52 Low Operators of These Scrap My,-0.2732,Negative
Tata Chemicals,"tata  chemicals  europe  limited  tcel,  a  wholly-owned  subsidiary  of  the  company,  board  considered  and  approved  the  proposal  of  capital  investment  of  e60  million  rs.  655  crore  to  build  a  1,80,000  tons  per  annum  pharmaceutical  grade  sodium  bicarbonate  plant  in  northwich,  united  kingdom.  this  new  plantwill  triple  tcels  production  capacity  of  pharmaceutical  grade  sodium  bicarbonate  in  uk.",kamal20,2024-11-13 10:56:00,"Tata Chemicals Europe Limited Tcel, A Wholly-Owned Subsidiary of the company, board considered and approved the proposal of capital investment of e60 million rs.  655 Crore to build a 1,80,000 tons per annum pharmaceutical grade Sodium bicarbonate plant in Northwich, United Kingdom.  This New Plantwill Triple Tcels Production Capacity of Pharmaceutical Grade Sodium Bicarbonate in UK.",0.5719,Positive
Tata Chemicals,"the  companys  subsidiary,  tata  chemicals  europe  tcel,  will  invest  rs  655  crore  to  build  a  1,80,000  tons  per  annum  pharmaceutical-grade  sodium  bicarbonate  plant  in  northwich,  united  kingdom.  this  new  plant  will  triple  tcels  production  capacity  of  pharmaceutical-grade  sodium  bicarbonate  in  the  uk.  additionally,  as  part  of  the  restructuring  operations  to  facilitate  this  investment,  tcel  will  cease  chemical  production  at  its  loss-making  lostock  plant  by  the  end  of  january  2025.",kamal20,2024-11-13 10:28:00,"The companies subsidiary, tata chemicals europe tcel, will invest Rs 655 Crore to build a 1,80,000 tons per annum pharmaceutical-grade sodium bicarbonate in northwich, united Kingdom.  This new plant will triple tcels production capacity of pharmaceutical-grade sodium bicarbonate in the uk.  Additional, as part of the restructuring operations to facilitate this investment, tcel will cease chemical production at its loss-making lastock plant by the end of January 2025.",0.4215,Positive
Tata Chemicals,positive  move  possible  tomorrow.  stay  tuned.  Minimum  1300  by  December  expiry.,trader_1980,2024-11-11 19:17:00,Positive Move Possible Tumaro.  Stay Tuned.  Minimum 1300 B December expiry.,0.5574,Positive
Tata Chemicals,Indian  stock  market  ka  sabse  bakvas  share...,nilyaaaa,2024-11-08 15:07:00,Indian Stock Market's most rubbish share ...,0.0,Neutral
Tata Chemicals,i  think  this    will  touch  52  high  this  month  .,RajasekharCMA,2024-11-01 18:49:00,E Think This Will Touch 52 High This Month.,0.0,Neutral
Tata Chemicals,1165  it  willhit   good  for  november  series,NDis,2024-10-31 10:52:00,1165 Verified Good for November Series,0.4404,Positive
Tata Chemicals,"any  news  coming  in  tatachem
whats  the  ????  of  tata  chem  in  november  series",kevalanand,2024-10-31 08:57:00,"Other News Coming in Tatthan
Wats were ????  Of Tata Chem in November Series",0.0,Neutral
Tata Chemicals,All  its  peers  in  chemical  sector  soared  high.  This  stock  also  raised  by  good  percentage  but  didnt  withstand.  Expect  it  to  hit  1160  -  1200  this  expiry.,Ravi01CB,2024-10-24 20:08:00,All Its Peers in Chemical Sector Soared High.  This stock also raised by Good Percentage but Didnt Withstand.  Expect it to hit 1160 - 1200 this expiry.,0.2382,Positive
Tata Chemicals,Without  tata  sons  this  is  just  the  worst  chemical  company   lower  side  game  has  started...,025.ani,2024-10-24 13:23:00,Vithaout Tata Sons this is just the West Chemical Company Lower Side Game is starting ...,-0.743,Negative
Tata Chemicals,900  now  looking  for  a  good  lvl  for  this  script...nothing  fundamental  left  for  alone  with  this   tata  sons  stake  is  thr,025.ani,2024-10-24 13:14:00,900 Nau Looking for a Good Law for This Script ... Nathing Fundamental Left for Alone with this Tata Sons,0.2263,Positive
Tata Chemicals,tata  sons  ipo  wont  come  for   rumour  was  made  by  the  operator,025.ani,2024-10-24 13:10:00,Tata Sons Poo was the operator for Rumor Was Made Bay,0.0,Neutral
Tata Chemicals,waste  stock  dont  buy  I  made  mistake,Nanjay,2024-10-24 09:36:00,For stock noted Buy Made Mistake,-0.1935,Negative
Tata Chemicals,Today  candle  easily  shows  gap  filling  towards  1080  leval  first  and  1050  second  Target.,Market_live,2024-10-23 16:22:00,Today Candle Candle Shows Gap Filling Towards 1080 Level First and 1050 second target.,0.34,Positive
Tata Chemicals,tata  sons  biggest  ipo  in  next   chem  wil  celebrate  the  most  ...,025.ani,2024-10-23 12:55:00,Tata Sons Biggast Poo in Next Chem Will Celebrate The Most ...,0.5719,Positive
Tata Chemicals,"This  time  TATA  chem  will  touch  1300  in  very  few  sessions  irrespective  of  market  trend,  there  some  positive  news  coming..",RB_NAGABOINA,2024-10-22 17:26:00,"This time Tata Chem Will Touch 1300 in Vary Fu Sessions Irrespectives of Market Trend, There Sama Positive News King ..",0.5574,Positive
Tata Chemicals,Sell  Tata  chemical  at  current  price...,Sunny310,2024-10-22 11:18:00,Selll Tata Chemicality Current Price ...,0.0,Neutral
Tata Chemicals,Sell  Tata  chemical  at  current  price....,Sunny310,2024-10-22 10:16:00,Selll Tata Chemicality Current Price ....,0.0,Neutral
Tata Chemicals,reason  for  rise  cannot  be....  tata  sons  newz  coz  tata  motors  did  not  rise  ....  its  something  else  thats  cooking...,monk_with_a_ferrari,2024-10-22 00:47:00,Region for Ris Kannot Bay .... Tata Sons Newz Soz Tata Motors Did Not Rise .... It's Samathing Els Thots Cooking ...,0.0,Neutral
Tata Chemicals,this  time  will  touch  2000rs,rajnagaaa,2024-10-21 18:36:00,This time will touch 2000,0.0,Neutral
Tata Chemicals,"It  is  not  coincidence,It  is  Tata  Sons  IPO  next  year.",avgd,2024-10-21 18:35:00,"It is noted Coinsidans, IT is Tata Sons IPO Next Year.",0.0,Neutral
Tata Chemicals,how  to  calculate  1250,rishisinghai,2024-10-21 15:38:00,How to calculate 1250,0.0,Neutral
Tata Chemicals,"1500  to  1750  posible,overall  no  limits  krishji.",arvind151,2024-10-21 13:54:00,"1500 then 1750 possible, overall no limits Krishji.",-0.296,Negative
Tata Chemicals,tata  chemicals  shares  gain  most  in  7  months  on  reports  of  tata  sons  likely  proceed  with  an  ipo,kamal20,2024-10-21 13:08:00,Tata Chemicals Share Gain Most in 7 Monthus Reports of Tata Sons Likalya Proced with N IPO,0.6808,Positive
Tata Chemicals,what  cold  be  1  year  target  arvindji  pls  suggest,krish-05,2024-10-21 10:18:00,What Cold Bay 1 Year Target Arvindji Plus Suggest,0.0772,Positive
Tata Chemicals,tata  sons  listing  news   something  else,025.ani,2024-10-21 10:13:00,Tata Sons Listing News Sampathing Els,0.0,Neutral
Tata Chemicals,"tata  chem  10  percent  up  rockingg  jalwa,  enjoy  the  moneyrain  frnds.",arvind151,2024-10-21 10:11:00,"Tata Chem 10 percent sub -rocks Jalwa, enjoyed Monirs Friends.",0.4939,Positive
Tata Chemicals,Heading  towards  1250  Tommorow  will  be  out  of  ban  period.,Ruchi1409,2024-10-21 09:27:00,Handing Tuwards 1250 Tomomorov Will Bay Out of Ban Period.,-0.5574,Negative
Tata Chemicals,Undervalued  -  My  target  for  Tata  Chemicals  is  Rs  2000  for  the  long  term  with  a  stoploss  of  Rs  0,PrabhjotSingh,2024-10-19 16:03:00,Underwald - My Target for Tata Chemicals is ras 2000 for the long term with a stoploss of juice 0,0.0,Neutral
Tata Chemicals,This  will  lead  to  value  unlocking  of  TATA  Chemical  Holding  in  TATASONS...  Stay  Invested...,PrabhjotSingh,2024-10-19 14:40:00,This will lead to Value Unlocking of Tata Chemical Holding in Tatasans ... Stay Investigated ...,0.34,Positive
Tata Chemicals,"Q2  Result  

NET  PROFIT  1.94B  RUPEES  VS  4.28B  YOY1.35B  QOQ

REVENUE  40B  RUPEES  VS  39.98B  YOY

EBITDA  6.18B  RUPEES  VS  8.19B  YOY",Spirit_Man,2024-10-19 11:43:00,"2 results  

Net Profit 1.94 Buris Vis 4.28 B Yoy 1.35 B Coke

Revenue 40

Ebitda 6.18",0.5622,Positive
Tata Chemicals,"Rallis  India  v  good  result,  55  percent  stake  holders  is  tata  chemical,  and  also  holding    some  small  percent    in  tata  sons,  tata  motors  ,tata  investment,    actual  value  of  this  stock  is  above  2000.00",suresh_999,2024-10-18 14:51:00,"Rallis India v Good Result, 55 Percent Stake Holders is Tata Chemical, And also Holding Some Small Percent in Tata Sons, Tata Motors, Tata Investment, Tata Investment, Actual Value of this Stock Is Above 2000.00.00.00.00.00.00.00.",0.6486,Positive
Tata Chemicals,good  range  to  accumulate.  the  value  of  tata  sons  in  tat  chemical  is  more  than  market  cap.  tata  chemical  business  is  just  bonus.,LexLuthor,2024-10-18 11:38:00,Good range is involved.  The Value of Tata Sons in Tata Chemical This More Teh Market Cap.  Tata Chemical Business This Just Bonus.,0.8316,Positive
Tata Chemicals,down  down  and  down......  lower  circuit,025.ani,2024-10-18 09:23:00,Down down and down ...... lower circuit,-0.296,Negative
Tata Chemicals,"worst  performance  from  house  of  tata,  wow.",Charuh,2024-10-18 09:21:00,"West Performance from House of Tata, Wao.",-0.0772,Negative
