Stock,Comment,Commented By,Timestamp
Deepak Nitrite,downside  is  not  possible  it  can  go  above  2500  or  it  will  keep  on  trading  between  2500  to  2400  .  buyer  are  strong  then  seller  in  bad  market  also  it  is  not  going  below  2400  next  target  is  2700  after  crossing  2500  this  is  just  eating  fno  premium,manojeq,2025-01-09 09:29:00
Deepak Nitrite,majority  stake  now  hold  by  dpk  nitrite  in  oman  deepak  ind.  ltd(  odil).  now  with  51%  stake  its  subsidiary  of  dpk  nitrite.  good  disclosure  by  company.  tred  always  positive  in  future,mkpareek21,2025-01-08 20:19:00
Deepak Nitrite,"This  will  be  going  towards  2300  now,  in  positive  market  this  didnt  shown  the  positiveness  and  then  from  last  3  market  negative  sessions  this  keep  decrementing,  so  I  cant  see  any  growth  in  short  term  even  me  in  loss  but  may  think  downfall  in  coming  weeks.",san2202050,2025-01-08 15:42:00
Deepak Nitrite,this  is  in  range  cant  go  above  2500  or  cant  come  below  2400  its  fight  between  call  and  put  .onces  it  cross  its  make  or  break,manojeq,2025-01-08 10:00:00
Deepak Nitrite,is   you  elaborate,newinvestorengg,2025-01-06 19:19:00
Deepak Nitrite,something  big  is  coming  in  this  counter  fasten  ur  seat  belts.  last  time  at  this  rate,MKC066,2025-01-05 15:12:00
Deepak Nitrite,"I  think  most  of  the  people  dont  understand  why  DN  is  a  stock  to  hold  for  10  ...  I  bought  in  Covid  with  a  time  frame  of  15  years  OR  India  s  chemical  share  Globally  as  10%  whichever  is  earlier  ...DN  has  invested  a  lot  which  they  will  reap  the  benefit  from  2025  start...HFC  will  also  contribute  to  its  profitability,,,,another  strange  reason  I  bought  this  share  coz  Maulik  is  n  will  be  hier  of  DN  n  subsidiaries  without  any  fight  with  anyone(Likewise  Reliance)  which  can  taken  down  the  stock  ,  goodwill,  profits  and  investors  confidence  ..  I  rarely  post  but  my  advise  its  not  a  3  years  or  3  days  stock,  buy  only  if  u  can  hold  for  8  years...  I  do  not  predict  share  price  still  I  believe  it  will  help  me  post  retirement  I  can  buy  house  with  DN  Thanks  all..n  negative  comments  waaalo  pls  dont  behave  like  Congress  (Grapes  are  sours)",BigBillionBull,2025-01-05 08:19:00
Deepak Nitrite,Deepak  Nitrite  is  surely  buy  buy  buy  very  soon  2536,Visionbright,2025-01-04 11:12:00
Deepak Nitrite,Q3  numbers  to  coming  in  february,RajatSEN,2025-01-04 07:26:00
Deepak Nitrite,Chemicals  stocks  holding  up  well  after  2  years  of  consolidation,RajatSEN,2025-01-04 07:23:00
Deepak Nitrite,buy  now....2600  by  this  week  and  may  touch  3000  by  this  monthend...  result  month...  buy  buy,nightshade356,2025-01-03 08:15:00
Deepak Nitrite,going  to  test  2458  then  up  side  movie,divyabanerji,2025-01-02 10:59:00
Deepak Nitrite,going  to  test  52  week  low,amitalk,2025-01-02 10:21:00
Deepak Nitrite,DN  may  be  alarm  yesterday  above  2500  but  if  it  cross  again  2500  then  blind  buy  as  breakout  confirm  and  it  will  move  towards  3000  compay  have  aggressive  expansion  policy  announce  timely,rpower2,2025-01-02 09:37:00
Deepak Nitrite,"deepak  nitrite  stock  has  broken  out  from  a  solid  base  that  was  established  between  rs  2,380-1,800  levels  over  the  past  year.  the  breakout,  accompanied  by  substantial  trading  volumes.  additionally,  the  macd  (moving  average  convergence  divergence)  indicator  has  experienced  a  positive  crossover  above  the  zero-line,  signaling  the  presence  of  positive  momentum  in  the  trend.  going  ahead  we  expect  the  prices  to  move  higher  till  the  mark  of  rs  2m720  where  the  stop-loss  must  be  rs  2,390  on  a  daily  closing  basis.",kamal20,2025-01-01 09:50:00
Deepak Nitrite,oh  bearish  penguin.  deepakntr  will  scale  to  2700-2800  whether  you  like  it  or  not  within  february,smonish1992,2024-12-31 09:35:00
Deepak Nitrite,this  is  a  stock  whose  main  business  is  phenol  and  its  not  reacting  to  phenol  global  price  trend  .......anyways  may  be  market  thinking  that  phenol  prices  have  bottomed  out   pain  in  results  will  continue,ThefabulousPenguin,2024-12-30 11:09:00
Deepak Nitrite,dn  next  target  is  2680  and  then  after  going  to  all  time  high  above  3000.,Ash99999,2024-12-29 19:30:00
Deepak Nitrite,yahan  promoter  khud  stake  bada  kar  fass  gaya  hai   not  falling  just  bcoz  if  it  goes  below  lic  buying  price  they  will  average  it  out.,ThefabulousPenguin,2024-12-28 10:41:00
Deepak Nitrite,"The  stock  of  Deepak  Nitrite  has  successfully  emerged  from  a  substantial  base  ranging  between  Rs  2,380-1,800  levels,  which  formed  over  a  year.  Breaking  out  of  an  Ascending  Triangle  pattern  with  significant  volumes,  the  stock  has  recently  exhibited  a  surge  in  volumes,  indicating  a  prolonged  build-up  in  price.  The  MACD  (moving  average  convergence  divergence)  has  shown  a  positive  crossover  above  the  zero-line,  reflecting  the  presence  of  positive  momentum.  Investors  are  encouraged  to  consider  buying  this  stock  with  a  target  set  at  Rs  2,720,  and  the  suggested  stop-loss  is  at  Rs  2,380  on  a  closing  basis.",kamal20,2024-12-27 11:16:00
Deepak Nitrite,"Deepak  Nitrite  shares  climbed  to  the  highest  closing  level  since  January  21,  2022,  rising  nearly  4  percent  to  Rs  2,472  and  formed  long  bullish  candlestick  pattern  on  the  daily  chart  with  robust  volumes  after  breakout  of  long  horizontal  resistance  trendline  adjoining  multiple  touchpoints.",kamal20,2024-12-27 11:14:00
Deepak Nitrite,"Ronnie  ,  you  will  see  10,000  plus  in  this  scrip  .  Stay  invested",RK0079,2024-12-27 09:51:00
Deepak Nitrite,deepak  nitrate  and  all  chemical  stocks  in  multi  year  bull  run..  deepak  nitrate  will  cross  8500  to  9000  in  next  3   be  in  rush  to  book  profits..,ronniesethna,2024-12-26 22:16:00
Deepak Nitrite,wo  din  gaye  bhai  abhi  stock  ne  breakout  de  diya  hai  2200  jana  mushkil  hai,stock252525,2024-12-26 19:58:00
Deepak Nitrite,"raju2008,  if  4%  down,  we  will  lose.  you  will  celebrate  that?  never  send  to  know  for  whom  the  bell  tolls,  it  tolls  for  thee.",TheGuy,2024-12-26 19:56:00
Deepak Nitrite,tomorrow  2700  plus  up  side  movie,divyabanerji,2024-12-26 17:57:00
Deepak Nitrite,tmrw  4  %  down  deepak  ntr,raju20089116,2024-12-26 16:46:00
Deepak Nitrite,arey  waah  ye  to  2200  nhi  gaya  abhi  Tak   koi  nhi  waapas  neechay  jaayega  kuch  time  mein,ThefabulousPenguin,2024-12-26 11:43:00
Deepak Nitrite,"Here  you  go  guys  only  on  Friday  highlight  that  Deepak  Nitrate  going  to  touch  new  52  week  high,  how  would  you  rate  my  BTST  call.",neha_0103,2024-12-26 09:35:00
Deepak Nitrite,Buy  immediate  target  2600-2725  within  december.,smonish1992,2024-12-26 09:29:00
Deepak Nitrite,tomorrow  big  gap  up.......,divyabanerji,2024-12-23 17:06:00
Deepak Nitrite,it  going  to  1900  wait  and  watch,Raat2015,2024-12-22 21:51:00
Deepak Nitrite,As  today  DN  closed  above  2364   will  move  upward  in  the  upcoming  session  to  2700-2800  levels...,Ash99999,2024-12-22 16:38:00
Deepak Nitrite,"Next  stock  to  move  towards  new  52  week  high  is  going  to  be  Deepak  Nitrite,  just  40  rupee  away  and  if  new  52  week  high  is  maintained  n  sustained  another  5%  in  the  near  term.",neha_0103,2024-12-22 15:13:00
Deepak Nitrite,Buy  cmp  target  2500  tomorrow  gapup……,Rush75,2024-12-22 12:14:00
Deepak Nitrite,Buy  for  3K  plus  Short  Term,JUMP JILANI,2024-12-22 10:44:00
Deepak Nitrite,once  it  cross  2400  only  then  2600  otherwise  no  way,vigneshnagarajan,2024-12-20 22:06:00
Deepak Nitrite,its  very  difficult  to  trade  in  dn  for  retail  investors  due  to  its  wild  movement  it  can  move  easily  8  10  percentage  in  intraday  which    make  it  highly  risky,rpower2,2024-12-20 17:02:00
Deepak Nitrite,it  will  trade  below  2400  in  current  expiry  its  almost  confirm  today  as  operator  ensure  it  today  that  through  any  positive  news  it  cannot  cross  2400,rpower2,2024-12-20 16:55:00
Deepak Nitrite,today  operator  play  master  stroke  fst  pull  it  up  as  per  positive  news  but  not  cross  2400  and  after  that  trap  all  retail  investors  and  surpisely  down  more  then  three  percentage  means  stock  down  almost  10  percentage  from  day  high  now  almost  zero  percentage  chance  to  get  these  levels  atleast  in  current  expiry,rpower2,2024-12-20 16:53:00
Deepak Nitrite,company  have  big  expansion  plans  in  current  year  as  well  as  next  year  sure  shot  3000  plus  levels  positional  target,rpower2,2024-12-20 13:45:00
Deepak Nitrite,blind  buying    in    DN,rpower2,2024-12-20 13:37:00
Deepak Nitrite,see  all  my  message  and  enjoy  deepak  nitrate  comes  in  negative  now  as  its  tendency  to  trap  investors  on  higher  levels  and  surrender  almost  100  to  120    points,rpower2,2024-12-20 13:36:00
Deepak Nitrite,after  ignore  for  intraday  no  view  on  this  stock  yes  positional  super  bullish  but  buying  advise  above  2400  levels  onlyif  u  get  chance  on  those  levels  ha  ha  ha,rpower2,2024-12-20 13:06:00
Deepak Nitrite,The  stock  closing  above  2380  will  have  a  better  upside  momentum  as  it  can  breakout  of  1  yr  levels  of  chart  I  m  seeing  upside  in  this  stock  ..  it  can  make  2450  by  the  end  of  December  expiry  ..This  is  my  view  ...,The_Loosing_Trader,2024-12-20 12:38:00
Deepak Nitrite,i  already  comment  to  completely  exit  from  long  position  for  intradday  traders  after  its  correction  from  day  high  as  it  happen  two  times  before  when  operator  trap  retail  investors  on  higher  and  surrender  its  gain  today  also  its  down  from  2393  to  2347  now  better  to  protect  ur  profit  it  may  not  attempt    2400  in  intraday,rpower2,2024-12-20 12:10:00
Deepak Nitrite,intraday  traders  can  exit  from  position  as  its  nature  to  surrender  from  higher  levels  better  to  book  profit  for  intraday  traders    stock  cool  from  2393  to  now  2354  better  to  exit  now,rpower2,2024-12-20 11:36:00
Deepak Nitrite,"Foray  into  Hydrogen  supply  ,  now  we  are  talking.  A  big  big  positive  a  d  earning  area  for  DN.  Well  done  MehtaJi  for  this  deal",BigBillionBull,2024-12-20 10:47:00
Deepak Nitrite,today  may  be  deepak  nitrate  second  attempt  to  cross  2400  levels  again,rpower2,2024-12-20 10:39:00
Deepak Nitrite,"A  wholly-owned  subsidiary  of  Deepak  Nitrite  Limited  announced  that  it  will  supply  propylene  and  hydrogen  to  Petronet  LNG  Limited  (PLL).  The  wholly-owned  subsidiary,  Deepak  Phenolics  Limited,  will  supply  250  kilotons  per  annum  (KTPA)  of  propylene  and  11  KTPA  of  hydrogen  from  its  Petronet  Petrochemical  Project  in  Dahej,  Gujarat,  as  stated  by  Deepak  Nitrate  in  an  exchange  filing.  For  this,  the  boards  of  both  companies  approved  a  binding  term  sheet.  The  arrangement  spans  15  years  from  the  initial  delivery  of  propylene  and  hydrogen.  A  Definitive  Agreement  will  be  formalized  in  due  course,  solidifying  this  strategic  partnership  between  DPL  and  PLL  in  the  realm  of  chemical  off-take.",kamal20,2024-12-20 10:31:00
Deepak Nitrite,In  two  three  days  we  will  see  upgrade  target  by  all  brokerage  houses  bullish  on  it  with  target  3000  now  buy  and  hold,rpower2,2024-12-20 10:22:00
Deepak Nitrite,Ye  2400  touch  krega  aaj,kushwaha_1993,2024-12-20 10:14:00
Deepak Nitrite,The  arrangement  spans  15  years  from  the  initial  delivery  of  propylene  and  hydrogen.,kamal20,2024-12-20 09:49:00
Deepak Nitrite,Deepak  Nitrate  subsidiary  to  supply  propylene  and  hydrogen  to  Petronet  LNG,kamal20,2024-12-20 09:48:00
Deepak Nitrite,till  what  price  should  we  hold  this,girishmak,2024-12-20 09:29:00
Deepak Nitrite,Bhai  logo  bola  tha  na  4-5%  up  jaega...,ritz777,2024-12-20 09:23:00
Deepak Nitrite,"Buy  as  much  as  possible  in  9:15,  definitely  it  will  cross  2450",Gopi_kanodia,2024-12-20 00:06:00
Deepak Nitrite,deepak  nitrite:  co  unit  approves  execution  of  binding  term  sheet  with  petronet  lng  for  offtake  of  250  ktpa  of  propytene  and  11  ktpa  of  hydrogen  from  petronet  petrochemical  project  co  says  contract  period  of  15  years  from  date  of  first  supply,Gujarat9999,2024-12-19 20:44:00
Deepak Nitrite,buy  and  hold  for  5-10  years  along  with  srf  for  wealth  creation,Satvikgupta260389,2024-12-19 13:04:00
Deepak Nitrite,any  suggestions.....I  am  trapped  in  call  option  at  higher  level   I  wait  or  book  loss,Dashgadu,2024-12-18 21:11:00
Deepak Nitrite,stay  focus  on  agriculture  and  chemical  stocks  big  announcement  for  sector  in  vire  of  election  agriculture  stock  will  focus  for  1  week  tata  chemical  deepak  nitrate  and  gnfc,Rathod636,2024-12-17 20:55:00
Deepak Nitrite,same  here  buyed  2400  around  80  and  then  avg  on  low  prices  Monday  gap  down  scenario  is  possible  loss  is  coming,vibhav009,2024-12-16 13:57:00
Deepak Nitrite,break  out  failed  to   much  lower  than  day  high.........  increase  in  open  interest  is  the  only  positive  thing.  may  be  Friday  factor  played.  baught  a  call  at  day  high  and  trapped  at  higher  level.waiting  for  upmove  to  exit.,Dashgadu,2024-12-15 22:54:00
Deepak Nitrite,we  will  see  real  movement  not  today  today  its  over  as  it  bounce  up  to  2400  and  fail  to  cross  it  may  be  on  monday  it  will  cross  2500  also,vagarwal987,2024-12-15 16:05:00
Deepak Nitrite,real  movement  to  come  after  2450.  once  closing  above  that  huge  short  covering  and  bull  run  to  come,marketisright,2024-12-15 13:54:00
Deepak Nitrite,"Initiate  a  short-term  buy  for  DEEPAKNTR  within  the  range  of  2325-2365.  Implement  a  Stop  Loss  at  2310  to  manage  risk,  and  set  a  target  of  2424  for  potential  gains.",mind_games_008,2024-12-15 13:35:00
Deepak Nitrite,i  already  mention  high  operators  active  here  so  volatile  only  positional  trader  trade  here  otherwise  burn  ur  hands  hold  for  monday,rpower2,2024-12-15 11:50:00
Deepak Nitrite,we  will  see  real  movement  not  today  today  its  over  as  it  bounce  up  to  2400  and  fail  to  cross  it  may  be  on  monday  it  will  cross  2500  also,rpower2,2024-12-15 11:18:00
Deepak Nitrite,we  may  see  4  to  5  percentage  minimum  rally  in  this  stock  positional  view  2700  to  3000  target,rpower2,2024-12-15 11:16:00
Deepak Nitrite,This  is  just  the  beginning.  keep  holding  and  accumulating,Satvikgupta260389,2024-12-15 10:59:00
Deepak Nitrite,Dont  be  in  rush  to  book  out  2024  onwards  chemical  sector  would  again  be  in  lime  light.  Deepak  nitrate  is  just  getting  started  i  wouldnt  rule  out  3500  in  next  12  to  15  months..,ronniesethna,2024-12-15 10:07:00
Deepak Nitrite,now  its  time  to  book  profit  ..  my  buying  price  was  1980  ..  exit  and  wait  for  some  time  .  every  one  get  chance  ..  now  I  start  accumulating  Paytm,MarketGuru1011,2024-12-15 10:04:00
Deepak Nitrite,Highly  undervalued...  havent  participated  in  smallcap  midcap  rally..  keep  accumulating,Satvikgupta260389,2024-12-14 12:35:00
Deepak Nitrite,Moving  some  money  from  Deepak  ntr  to  IRCTC,RK0079,2024-12-14 09:22:00
Deepak Nitrite,Deepak  Nitrite  is  reversed  from  lower  levels  that  shows  strength  of  company  buy  from  here  for  tgt  2250...  2270...  2300,suhish,2024-12-12 15:30:00
Deepak Nitrite,head  &  Shoulder  formed  in  1  year   movement  ayega,nikhil888,2024-12-11 07:33:00
Deepak Nitrite,getting  ready  for  hero  or  zero,amitalk,2024-12-10 15:20:00
Deepak Nitrite,"Deepak  Nitrite  is  good  buy  on  every  dip  ,buying  will  happen  in  last  half  hour  buy  for  tgt  2250...  2300",suhish,2024-12-08 14:53:00
Deepak Nitrite,now  lenabank  how  is  your  opinion  about  my  opinion  about  deepakntr,ThefabulousPenguin,2024-12-08 13:39:00
Deepak Nitrite,see  CMP  for  my  opinion  not  bid  and  offer  price  ????????????????current  market  price  will  justify  my  opinion,ThefabulousPenguin,2024-12-08 12:08:00
Deepak Nitrite,BID  &  OFFER  fingures  fight  now  are  not  in  line  of  your  openion.,LENABANK,2024-12-08 10:39:00
Deepak Nitrite,Plz  have  a  look  at  BID  &  OFFER  fingures  fight  now.,LENABANK,2024-12-08 10:38:00
Deepak Nitrite,"Agro  chemicals  is  again  in  focus,  Deepak  nitrite  is  at  lower  point  buy  from  here  for  tgt  2300  for  today",suhish,2024-12-06 14:06:00
Deepak Nitrite,wapas  2200  jayega  dont  worry  stay  positive  always,ThefabulousPenguin,2024-12-06 11:25:00
Deepak Nitrite,Midcaps  and  large  caps  will  soon  begin  to  move,RK0079,2024-12-06 06:59:00
Deepak Nitrite,why  ???????????????????????????,mittaab,2024-12-05 22:30:00
Deepak Nitrite,very  nice  stop  loss  triggered.,ahuja.12,2024-12-05 18:21:00
Deepak Nitrite,Tomorrow  open  with  5%  above  2300,S_Rao,2024-12-05 15:40:00
Deepak Nitrite,"Deepak  ntr  below  2420  can  trigger  more  selling  pressure,  keep  selling  with  stop  loss  in  cash  market,",Latha.Broker,2024-12-05 11:30:00
Deepak Nitrite,"giving  up  gains  and  turning  weak,  may  close  at  low  point  -  My  target  for  Deepak  Nitrite  is  Rs  2100  for  the  intraday  with  a  stoploss  of  Rs  2240",mxlq,2024-12-05 10:50:00
Deepak Nitrite,"Cash  market  sell  are  less  risky,  so  would  suggest  to  trade  in  cash  market  all  the  time.  keep  a  close  watch  for  downside.",Latha.Broker,2024-12-05 10:09:00
Deepak Nitrite,"Deepak  nitrate  is  a  sell  in  cash  market  with  strict  stop  loss,  dont  be  confused,  all  our  calls  are  in  strict  cash  market.",Latha.Broker,2024-12-05 09:50:00
Deepak Nitrite,selling  pressure  and  more  downside  to  be  seen  -  My  target  for  Deepak  Nitrite  is  Rs  2100  for  the  intraday  with  a  stoploss  of  Rs  2230,Latha.Broker,2024-12-05 09:39:00
Deepak Nitrite,rupee  is  down  so  much  in  last  two  years  still  profits  are  falling  for  deepak  nitrite  doesnt  make  any  sense   should  have  increased  in  rupee  terms  but  not,ThefabulousPenguin,2024-12-04 13:34:00
Deepak Nitrite,????I  am  not  judging  how  big  failure  u  r  ....  parle  g  bhi  mehenga  hogaya  2  saal  mein  ye  share  parle  g  ko  bhi  beat  nhi  kar  pa  rha  hai,ThefabulousPenguin,2024-12-04 12:54:00
Deepak Nitrite,immediately  book  full  profit  and  exit  for  lower  tgt  is  below  2630rs,sach1969,2024-12-04 12:06:00
Deepak Nitrite,"Bulk  deals  by  Motilal  Oswal  -  typically  these  are  priced  at  5  to  6  percent  below  market  price.  

Cipla  too  did  bulk  deals  at  discount  in  May  and  now  Dec  -  share  has  shot  up  from  bulk  deal  price",MBagger1,2024-12-04 08:38:00
Deepak Nitrite,Who  purchase  this  institution  or  promotor,pp_traderr,2024-12-03 22:17:00
Deepak Nitrite,Today  Delivery  percentage  is  50.8,jayantijain78,2024-12-03 20:30:00
Deepak Nitrite,"Deepak  Nitrite  shares  under  pressure,  down  over  5prcnt",kamal20,2024-12-03 17:39:00
Deepak Nitrite,deepak  changed  dealer   needs  300  cr  fund  .,bahubali2020,2024-12-03 17:21:00
Deepak Nitrite,I  think  profit  Booking,jayantijain78,2024-12-03 14:26:00
Deepak Nitrite,Fabulous..  You  are  confused  because  you  are  suffering  from  serious  delusion..  Dont  worry  your  problem  can  be  solved  just  with  an  appointment  with  a  psychiatrist...,meghma,2024-12-03 13:17:00
Deepak Nitrite,GST  Related  some  news  I  think  ????,amitalk,2024-12-03 13:05:00
Deepak Nitrite,why  the  sudden  fall  today,rock5620,2024-12-03 13:02:00
Deepak Nitrite,and  I  am  confused  why  its  above  2000????????????????,ThefabulousPenguin,2024-12-01 15:06:00
Deepak Nitrite,dont  know  why  this  stock  value  is  moving  down.,akash028,2024-11-30 19:12:00
Deepak Nitrite,"Deepak  Chemtex  SME  IPO  is  coming,  which  also  boosts  Deepak  nitrite  .29  Nov  -  1  Dec  date  of  IPO.",shockwave96,2024-11-29 14:17:00
Deepak Nitrite,"Chemical  industries  ready  to  boom,  Deepak  Nitrite  will  move  upward  direction  shortly.",akash028,2024-11-29 10:10:00
Deepak Nitrite,Deepak  Nitrite  will  move  to  3000  plus  in  next  one   you  have  patience  then  you  can  reap  the  benefits  in  long  term,sanki1978,2024-11-27 09:43:00
Deepak Nitrite,"As  per  analyst,if  deepak  nitrite  2220  ke  uppar  sustain  kar  liya  to  2400  to  2600  tak  target  aa  sakte  hai  within  day  or  two.",sp8318,2024-11-24 11:00:00
Deepak Nitrite,"kaha  Gaye  be  upper  ckt   kuchh  bhi  likhte  hai...  upper  ckt,  upper  ckt....?",sp8318,2024-11-24 10:13:00
Deepak Nitrite,upper  ckt  in  Deepak  nitrite  today..,sp8318,2024-11-24 09:42:00
Deepak Nitrite,deepak  nitrite  very  short-term  2400  cross  karega,Chopra_Amit,2024-11-23 14:51:00
Deepak Nitrite,buying  seen  -  my  target  for  deepak  nitrite  is  rs  2300  for  the  intraday  with  a  stoploss  of  rs  2180,Latha.Broker,2024-11-23 09:53:00
Deepak Nitrite,Deepak  nitrate  is  breaking  out  of  flag  and  pole  on  monthly  timeframe.  expect  nov  onwards  big  move  up  in  Deepak  nitrate  and  other  chemical  stocks.  expect  to  take  out  all  time  high  of  3000  by  mar  end.,ronniesethna,2024-11-23 09:51:00
Deepak Nitrite,reduce  deepak  nitrite  target  of  rs  1935:  prabhudas,raju20089116,2024-11-22 21:16:00
Deepak Nitrite,I  like  to  draw  investors  attention  to  a  very  good  stock  here.  Hazoor  MPL.  Huge  turnaround  story  under  a  new  promoter.  Available  at  just  3.2  PE.  Check  it  and  grab  it.  All  the  best,rotator,2024-11-22 11:18:00
Deepak Nitrite,Short  term  buy  for  a  target  of  2940  in  coming  week,MBagger1,2024-11-20 13:00:00
Deepak Nitrite,UKRAINE  HAS  CONDUCTED  ITS  FIRST  STRIKE  USING  ATACMS  MISSILES  INSIDE  RUSSIA,sinham,2024-11-19 15:17:00
Deepak Nitrite,save  your  money...  and  entered  at  2100-2200  level....  will  crash  from  here  till  2100  level....  operator  game,sinham,2024-11-19 15:14:00
Deepak Nitrite,one  day  up  one  day  down  book  profit  around  3  today,amitalk,2024-11-19 12:41:00
Deepak Nitrite,now  crashing  towards  2500  level  today...  ultimate  operator  game,sinham,2024-11-19 12:37:00
Deepak Nitrite,book  profit  immediately...  anytime  it  will  float  near  2200  level  by  friday  series,sinham,2024-11-19 11:01:00
Deepak Nitrite,fully  operator  game...  it  will  anytime  crash  to  2100-2200  level,sinham,2024-11-18 11:55:00
Deepak Nitrite,monday  surely  it  will  slowly  it  will  touch  2550  all  are  promoters  game  hold  and  invest  below  2500,sharushet,2024-11-16 22:38:00
Deepak Nitrite,deepak  is  ready  to  blast  wait  and  hold  it  will  touch  2350  in  this  month,equity455,2024-11-16 20:22:00
Deepak Nitrite,sell  and  buy  something  else,RK0079,2024-11-16 12:10:00
Deepak Nitrite,what  can  i  do  with  this  stock  ?  pls  suggest  shall  i  hold  or  sell,Mujafar,2024-11-16 11:55:00
Deepak Nitrite,on  monday  nifty  opens  100-150  points  down  but  it  recovers  sharply  and  ended  above  200  points  in  green.,lalit2724,2024-11-16 07:07:00
Deepak Nitrite,Worst  is  over  -  buy  now  for  a  target  of  3150  by  Jan,MBagger1,2024-11-15 09:32:00
Deepak Nitrite,when  promoter  is  the  operator  u  need  solid  reason  to  short,ChachaChaudhary,2024-11-14 16:53:00
Deepak Nitrite,results  were  bad  so  retailers  went  short  and  operator  brought  news    .....  dont  short  bcoz  what  I  feel  is  promoter  is  the  operator  here,ChachaChaudhary,2024-11-14 16:53:00
Deepak Nitrite,it  is  an  operator  game  ...  surely  it  is  going  to  retract  back.  you  watch  after  sometime  .  just  a  bubble  .  i  sold  my  positions  with  profit  dear  all,shillongites,2024-11-14 14:18:00
Deepak Nitrite,"game  over...  now  from  today,  it  will  go  down  continuously  to  2320  level  as  eps  missed  by  7  percent",sinham,2024-11-14 13:48:00
Deepak Nitrite,its  only  bubble...  it  can  gp  down  anytime  to  2320  level,sinham,2024-11-14 13:34:00
Deepak Nitrite,that’s  good  to  know  bought  some  today  also  buy  jio  financials  it  is  in  nse  nee  fno  listing  and  after  50  percent  jio  blackrock  acquisition  last  month  it  should  double  your  money  in  the  next  3  to  6  month  enjoy  and  good  luck,MJRback,2024-11-14 12:45:00
Deepak Nitrite,it  will  go  down  but  at  2400,sharushet,2024-11-14 11:19:00
Deepak Nitrite,"the  companys  arm  deepak  chem  tech  has  signed  an  agreement  with  affiliates  of  trinseo  plc  to  manufacture  polycarbonate  resins  with  an  investment  of  rs  5,000  crore",kamal20,2024-11-14 10:48:00
Deepak Nitrite,book  profit  it  may  fall  again  book  book  book  now,syef,2024-11-14 09:53:00
Deepak Nitrite,"Deepak  Nitrite  Q2  Consolidated  YoY

Profit  falls  5.3prcnt  to  Rs  194.2  crore  Vs  Rs  205.1  crore

Revenue  grows  14.3prcnt  to  Rs  2,032  crore  Vs  Rs  1,778  crore",kamal20,2024-11-14 09:12:00
Deepak Nitrite,Management  has  approved  to  acquire  a  project  for  manufacturing  polycarbonate  resins  with  an  investment  of  around  5000  crores..  big  positive  for  the  company..,May257,2024-11-14 01:19:00
