Stock,Comment,Commented By,Timestamp
Deepak Nitrite,Revenue  of  2032cr  has  just  missed  estimates  of  2068cr  slightly  and  PAT  of  194cr  has  also  missed  estimates  of  201cr  slightly.  Good  set  of  numbers  inline  with  estimates,rishi30790,2024-11-13 22:05:00
Deepak Nitrite,yes  results  out  .....4  percent  drop  in  profits  .......hammering  tomorrow,rkv0007,2024-11-13 19:14:00
Deepak Nitrite,sorry  this  was  for  SUN  TV,rkv0007,2024-11-13 19:08:00
Deepak Nitrite,just  saw  some  very  bad  results  on  u  tube  ....PAT  down  40  percent   this  true   yes   help  this  stock  tomorrow,rkv0007,2024-11-13 19:05:00
Deepak Nitrite,Consolidated  revenue  expectations  2068cr  and  PAT  expectations  201cr.  Anything  less  than  this  will  see  more  correction  towards  2200  levels,rishi30790,2024-11-13 09:52:00
Deepak Nitrite,its  giving  btst  buy  tomorrow  will  be  positive  for  ril,ThefabulousPenguin,2024-11-12 15:06:00
Deepak Nitrite,lets  all  buy  dn  so  that  it  gives  a  brkout  abv  2300,akash9788,2024-11-11 18:17:00
Deepak Nitrite,Why  this  huge  4  percent  plus  fall  at  opening  today  knowledgeable  boarders  please  enlighten  also  give  your  view  whether  to  hold  or  sell,bandyok,2024-11-11 09:42:00
Deepak Nitrite,3rd  wave  brkout  next  week  tgt  2360  and  2450....,akash9788,2024-11-10 18:30:00
Deepak Nitrite,Diwali  se  pehle  deepak  chalega,Anky25,2024-11-10 09:55:00
Deepak Nitrite,buy  fr  10pc  gain  today  grt  mgmt  commentary  by  dn  buy  in  d  morning,akash9788,2024-11-09 19:41:00
Deepak Nitrite,tomorrow  10pc  ckt  as  great  concall  by  mgmt  buy  fr  10pc  gain  tomorrow,akash9788,2024-11-09 19:39:00
Deepak Nitrite,tomorrow  upper  ckt  as  great  concall  on  earnings  buy  tomorrow  fr  upper  ckt,akash9788,2024-11-09 19:37:00
Deepak Nitrite,Why  so  much  falling.  Is  the  stream  over  in  the  chemical  stocks?....,darisa,2024-11-09 13:17:00
Deepak Nitrite,"Supports  seen  at  the  level  of  2070-2075,  if  sustained  above  this  level,  then  upside  movement  is  possible,  otherwise  downside  movement  at  the  level  of  2040-2050  can  be  seen.",The_Traders,2024-11-09 11:10:00
Deepak Nitrite,Deepak  Nitrite  will  easily  go  to  2027-2028  before  you  see  some  upward  movement.  The  upward  movement  that  you  will  see  after  touching  2027-2028  rs  will  be  very  powerful  which  will  take  it  to  2600  rs  and  above,sanki1978,2024-11-09 10:43:00
Deepak Nitrite,Any  reason  for  this  fall,111atul,2024-11-09 09:53:00
Deepak Nitrite,shares  of  deepak  nitrite  soared  over  5  percent  intraday  buoyed  by  17.5  percent  yoy  jump  in  net  profit  to  rs  crore  for  the  july-september  quarter.  the  stock  reversed  some  of  the  gains  and  closed  1.83  percent  higher.,kamal20,2024-11-08 19:44:00
Deepak Nitrite,"todays  delivery  qty  is  more  than  double  from  last  weeks  average  &  4  times  of  last  months  average,  more  then  shares  delivered  today  as  per  nse  report,  but  %  delivery  qty  to  traded  qty  is  very  low  only  13%  as  per  nse  data,  heavy  delivery.  qty  is  showing  positive  sentiments,  its  result  has  also  been  better  than  market  expectations.",The_Traders,2024-11-08 18:46:00
Deepak Nitrite,buy  2200  ce  it  will  be  more  profitable  tomorrow,akash9788,2024-11-08 18:41:00
Deepak Nitrite,"The  chemical  manufacturing  company  has  registered  a  17.5  percent  on-year  increase  in  consolidated  profit  at  Rs  205  crore  for  the  July%u2013September  period  of  FY24  despite  weakness  in  topline,  led  by  healthy  operating  margin  performance  on  lower  input  costs.  Revenue  from  operations  fell  by  9.4  percent  year-on-year  to  Rs  1,778  crore  in  Q2  FY24.",kamal20,2024-11-08 11:21:00
Deepak Nitrite,"Despite  the  profit  jump,  revenue  in  the  quarter  fell  over  9  percent  on  year.",kamal20,2024-11-08 10:37:00
Deepak Nitrite,The  rise  in  net  profit  was  aided  by  an  improved  operational  performance  thanks  to  easing  raw  material  costs.,kamal20,2024-11-08 10:36:00
Deepak Nitrite,will  close  above  2950,keyy,2024-11-08 10:22:00
Deepak Nitrite,latha  broker  i  know  jab  Deepak  2160  or  2170  ke  upar  aa  jayega  to  buy  buy  bol  kar  chillaoge  sab  bhav  ke  Khiladi  hai  business  dekh  kar  invest  kro  Deepak  ke  business  me  dam  hai  hold  this  gem  for  long  term,equity455,2024-11-08 10:17:00
Deepak Nitrite,sell  -  My  target  for  Deepak  Nitrite  is  Rs  2080  for  the  intraday  with  a  stoploss  of  Rs  2160,Latha.Broker,2024-11-08 09:37:00
Deepak Nitrite,Good  results  from  Deepak  nitrate.,Retailinvestor7125,2024-11-08 09:22:00
Deepak Nitrite,Deepak  will  boom  tommorow  sit  and  hold,equity455,2024-11-07 23:46:00
Deepak Nitrite,It  will  be  open  on  4L  Profit  on  tomo  morning  dont  worry..  enjoy  te  diwali,thrillraj,2024-11-07 21:05:00
Deepak Nitrite,"Q2WithBQPrime,  Deepak  Nitrite  Q2  Results  Profit  Rises  17  percent  to  205cr,  Beats  Estimates",RakeshKumbhare,2024-11-07 20:21:00
Deepak Nitrite,bought  2800  call  2200  ce  today  stock  down  1lac  in  loss  dont  know  what  will  happen  next,akash9788,2024-11-07 20:19:00
Deepak Nitrite,bought  28000  call  of  2200  today  due  to  mkt  fall  1  lac  loss  what  will  happen  tomorrow,akash9788,2024-11-07 20:18:00
Deepak Nitrite,"Net  profit  is  Rs.  205  crore  compared  to  149crore  in  last  quarter  and  175  crore  in  Sept,  2022",caca2015,2024-11-07 19:56:00
Deepak Nitrite,So  No  down  side?  on  tomo  result  is  not  gud  rite>,thrillraj,2024-11-07 19:53:00
Deepak Nitrite,tomorrow  may  be  uc  in  dipak  nitrite,crezzy,2024-11-07 19:50:00
Deepak Nitrite,Bumper  results  posted  by  DN.  It  will  cross  2500  in  the  coming  quarter.,PunitPushpkar,2024-11-07 19:27:00
Deepak Nitrite,Awesome  results  cheers  to  shareholders,malik621,2024-11-07 19:23:00
Deepak Nitrite,"PAT  up  17.5%  YoY  with  margin  expansion,  awesome  no.  posted  by  DN",RakaTheArchitect,2024-11-07 19:18:00
Deepak Nitrite,Posted  net  profit  more  than  200  crores.  may  be  tomorrow  UC  chances.,darisa,2024-11-07 19:16:00
Deepak Nitrite,"not  sure  man,  they  r  poor  management..  yet  not  release",thrillraj,2024-11-07 19:10:00
Deepak Nitrite,"great  results,  EBIDTA  Margins  at  17%  looks  extremely  awsum....  will  eventually  fly  to  2300  from  here....  management  commentary  important...  future  timelines  of  commissioning  of  new  projects  needs  to  be  looked  at....",rizulagg5,2024-11-07 19:10:00
Deepak Nitrite,Is  the  result  out?  I  see  net  profit  after  taxes  to  be  of  Rs.174.47  Cr  on  Livemint.  Is  it  correct?,Har30,2024-11-07 18:54:00
Deepak Nitrite,it  is  not   misguide  here...................,kyshah3,2024-11-07 14:48:00
Deepak Nitrite,if  margine  goes   will  be  hammered  5-8  %...............,kyshah3,2024-11-07 14:48:00
Deepak Nitrite,so  what  is  the  impact?  going  up?,thrillraj,2024-11-07 14:17:00
Deepak Nitrite,"DNL  July,August,Saptember  This  months  DNL  manufacturing  products  price  go  to  upto  45%  Avrage",vijay1967,2024-11-07 11:16:00
Deepak Nitrite,DNL  went  up  yesterday  as  aarti  industries  showed  an  improvement  on  quarterly  basis  so  markets  must  have  anticipated  DNL  results  to  be  the  same  .  We  shall  know  this  by  today  evening  .,RajatSEN,2024-11-07 10:17:00
Deepak Nitrite,By  chance  if  profits  fall  under  150  crores  then  again  bad  days  would  continue  .,RajatSEN,2024-11-07 10:15:00
Deepak Nitrite,"do  not  speculate  in  investing  stock  like    DN  ,  IT  IS  GOING  TO  BE  3000  in  coming  time  hold  and  add  ,  and  be  rich  with  mind  not  buy  just  luck",CBI stocks,2024-11-07 10:10:00
Deepak Nitrite,"thrillraj  ,  results  after  market  hours  .  175  i  said  as  I  am  expecting  that  much  .",RK0079,2024-11-07 03:31:00
Deepak Nitrite,can  you  plz  tell  me  the  time  of  result..  PAT  175  cr  means  it  postive  or  neg,thrillraj,2024-11-06 23:21:00
Deepak Nitrite,May  announce  bonus  shares....,Ash99999,2024-11-06 16:33:00
Deepak Nitrite,DN  qtrly  result  on  13.11.2024.,DNC20,2024-11-06 15:43:00
Deepak Nitrite,Somebody  has  the  inside  news  about  the  results.  Stock  going  up  like  crazy  before  results,DRKR,2024-11-06 12:17:00
Deepak Nitrite,pat  175  crores  or  more  ？,RK0079,2024-11-06 10:04:00
Deepak Nitrite,"Deepak  Nitrite  is  on  the  verge  of  collapse,  its  going  to  fall  very  sharply  in  coming  days..  View  more",sanki1978,2024-11-04 17:19:00
Deepak Nitrite,"Deepak  Nitrite  is  on  the  verge  of  collapse,  its  going  to  fall  very  sharply  in  coming  days..",sanki1978,2024-11-01 17:39:00
Deepak Nitrite,Will  DN  go  up  tomorrow  rs.  kindly  confirm  on  the  same.,Kasarkar,2024-11-01 16:42:00
Deepak Nitrite,Sell  Sell  Target  1750  intact  ????,Smit016Gandhi,2024-11-01 14:28:00
Deepak Nitrite,if  you  are  an  investor  with  longer  aspiration  for  safe  multibagger  stock  then  dn  is  one  of  the  best    pl  dont  listen  to  cheap  brokers  and  operators  buy  look  your  own  sel  dn  management    profits    products  monopolies  and  growth  and  you  will  get  good  idea  to  invest    those  who  are  dn  grading  ask  them  why  are  the  on  this  board  at  all  and  wasting  their  time,CBI stocks,2024-10-31 11:00:00
Deepak Nitrite,be  an  investor  in  dn  .  not  a  trader  .  hold  for  long  term    its  a  multibagger  stock  of  india    best  luck,CBI stocks,2024-10-31 10:55:00
Deepak Nitrite,july  to  saptamber  qr  deepak  nitrites  manufacturing  products  cost  40%  high,vijay1967,2024-10-27 11:46:00
Deepak Nitrite,ashima  limted    is  our  next  multibagger  stock.  by  next  year  ashima  will  completely  tranform  itself  into  a  real  estate  and  investment  capital  company.  buy  and  hold  ashima  for  2  years.,rotator,2024-10-25 13:36:00
Deepak Nitrite,BUYING    TARGET      2900      Hold  Tight,ssss20172017,2024-10-23 19:13:00
Deepak Nitrite,u  turn  for  shorters  no  idea  what  changed,ThefabulousPenguin,2024-10-23 11:26:00
Deepak Nitrite,What’s  wrong  with  this  stock  can  I  expect  3000,daravavav,2024-10-22 21:40:00
Deepak Nitrite,before  Diwali  it  makes  Dhamaka,radadiyasarkar,2024-10-21 15:39:00
Deepak Nitrite,buy  with  target  of  3020  soon,Ayu19,2024-10-21 15:12:00
Deepak Nitrite,profit  booking  led  the  fall  in  the  stock  today.  For  information  only  not  buy  or  sell  call,Spirit_Man,2024-10-19 00:40:00
Deepak Nitrite,near  term  possible  targets  t1  2140  t2  2160  t3  2200,om8632,2024-10-18 22:20:00
Deepak Nitrite,"accumulate  deepak  nitrite  2100,  upside  possible  2250,  2400,????",shriji_trader,2024-10-18 11:52:00
Deepak Nitrite,Results  to  be  declared  on  7th  November,VF1981,2024-10-18 08:49:00
Deepak Nitrite,prabhudas  liladhar  downgrade  Deepak  nitrate  target  of  Rs  2534.  Thats  why  today  DN  fell  rapidly.,Ash99999,2024-10-17 23:40:00
Deepak Nitrite,Seems  like  today  closing  will  be  above  2140-50.,harish1049,2024-10-17 13:21:00
Deepak Nitrite,see  news  channels  now  lol  its  hilarious,ChachaChaudhary,2024-10-17 13:11:00
Deepak Nitrite,deepak  nitrite  aaj  2170  cross  karega,Chopra_Amit,2024-10-17 12:48:00
Deepak Nitrite,profit  booking  after  rally  and  also  weekly  expiry,Spirit_Man,2024-10-17 12:03:00
Deepak Nitrite,no  point  selling  when  one  has  spent  more  than  2  years  of  holding,RK0079,2024-10-17 09:14:00
Deepak Nitrite,buy  for  the  target  of  3200  if  you  have  at  low  level  just  hold  it  dont  sell,Ayu19,2024-10-16 10:25:00
Deepak Nitrite,good  recovery  from  todays  low.  But  watchful,Spirit_Man,2024-10-15 18:12:00
Deepak Nitrite,"buy  deepak  nitrate  2900  ce  above  79  for  88  96

buy  bajaj  auto  11600  pe  at  253  for  276  287  299",SKY_CAP,2024-10-15 12:21:00
Deepak Nitrite,yes  today  target  3080  3100  for   jumping  anything  will  happen  by  today  or  later  tomorrow,iamcoimbatore,2024-10-15 11:12:00
Deepak Nitrite,"ignore  all  comments  ????  buy  deepak  nitrite  with  the  target  of  3020    in  2  to  3  days  

      breakout  is  near",Ayu19,2024-10-15 11:01:00
Deepak Nitrite,trading  low  -  My  target  for  Deepak  Nitrite  is  Rs  2600  for  the  intraday  with  a  stoploss  of  Rs  2850,Latha.Broker,2024-10-14 10:40:00
Deepak Nitrite,issi  saptah  2250  cross  karega  ye  stock,danver007,2024-10-14 09:59:00
Deepak Nitrite,koi  batayega  ki  ye  2250  jayega  ki  nahi,pasu12,2024-10-13 10:27:00
Deepak Nitrite,may  close  at  low  point  of  day  -  my  target  for  deepak  nitrite  is  rs  2020  for  the  intraday  with  a  stoploss  of  rs  2120,Latha.Broker,2024-10-11 12:10:00
Deepak Nitrite,buy  and  hold  jg  chemical  as  it  will  definitely  go  above  5000  till  2027.,Sunny310,2024-10-11 10:10:00
Deepak Nitrite,"Times  change  for  every  business  or  sector  ,  negatives  of  today  may  becomes  positives  of  tomorrow  .",RajatSEN,2024-10-11 05:50:00
Deepak Nitrite,Most  brokerages  also  having  negative  news  for  chemicals  as  demand  has  reduced,RajatSEN,2024-10-11 05:48:00
Deepak Nitrite,Hard  times  for  DNL  and  other  chemical  companies  .  Q2  result  dates  still  not  announced  .  Expecting  it  by  second  week  of  November  .,RajatSEN,2024-10-11 05:47:00
Deepak Nitrite,"Deepak  Nitrite  showed  very  poor  performance  today,  any  crap  stock  in  Nifty  50  has  moved  up  today  except  Deepak  Nitrite.",sanki1978,2024-10-10 16:42:00
Deepak Nitrite,Deepak  Nitrite  qr  to  qr  yearly  net  sales  is  35%  UP  &  Net  profit  20%  Up  qr  to  qr  yearly,vijay1967,2024-10-10 13:41:00
Deepak Nitrite,how  many  years  should  I  wait  for  profits,shermarke,2024-10-10 13:25:00
Deepak Nitrite,deepak  nitirite  is  giving  huge  returns  to  all  its  investors  it  was  once  300  rupee  stock  before  pandemic  now  its  trading  2077  rupees  a  huge  appreciation  of  wealth  in  few  years   it  goes  back  to  1000-1500  it  still  be  5bagger,ChachaChaudhary,2024-10-09 11:35:00
Deepak Nitrite,"no  side  effect  of  isrial  and  palistine  war  ,  no  export/emport  by  deepak  nitrite",vijay1967,2024-10-09 09:30:00
Deepak Nitrite,Deepak  Nitrite  rises  on  new  venture  Deepak  Nitrite  rises  on  new  venture,kamal20,2024-10-05 12:42:00
Deepak Nitrite,"Nitrite  is  coming  out,    Its  going  to  ICU",sanki1978,2024-10-04 18:35:00
Deepak Nitrite,"The  board  of  directors  of  Deepak  Nitrite  at  their  meeting  held  October  4,  2023  have  approved  incorporation  of  new  wholly  owned  subsidiary  of  the  company  and  investment  up  to  Rs  5  Crores  in  the  Equity  Capital  of  proposed  WOS,  from  time  to  time,  in  one  or  more  tranches.  The  proposed  WOS  shall  engage  in  the  business  of  providing  Project  Engineering,  Procurement,  Construction,  Commissioning,  Management  and  Consultancy  services.",kamal20,2024-10-04 16:59:00
Deepak Nitrite,Deepak  Nitrite  incorporates  wholly-owned  subsidiary  Deepak  Nitrite  incorporates  wholly-owned  subsidiary,kamal20,2024-10-04 16:59:00
Deepak Nitrite,back  to  the  same  price  again  ..  kitna  aur  add  kare..  this  looks  difficult  crossing  2500  in  the  near  future..,girishmak,2024-10-04 16:44:00
Deepak Nitrite,"handle  is  coming  down,  cup  has  broken  .and  fallen  on  floor",sanki1978,2024-10-03 09:12:00
Deepak Nitrite,"mnm,  tvs  motor,  bajaj  auto  and  maruti  are  my  top  favourite  in  auto  sector  if  that  helps  to  invest  in  auto  sector.  i  am  available  if  you  have  any  questions.",neha_0103,2024-10-01 13:43:00
Deepak Nitrite,sell  for  the  target  of  2875,Ayu19,2024-10-01 11:32:00
Deepak Nitrite,"watch  out  deepak  nitrite,  price  n  volume  action  is  there  in  subdued  market  today.",neha_0103,2024-10-01 10:24:00
Deepak Nitrite,"rising  crude  could  impact  chemical  stocks  negatively  ,but  current  price  gives  good  investment  opportunities  in  staggered  mode  ,however  traders  could  be  cautious",nssp,2024-09-29 11:37:00
Deepak Nitrite,BUY  FOR  THE  TARGET  OF  3200,Ayu19,2024-09-27 13:24:00
Deepak Nitrite,"correction  seems  to  be  almost  over  in  deepak  nitrite  expecting  strong  recovery  in  price  ,outlook  in  earnings  looks  good  as  prices  of  its  chemical  products  is  seeing  a  rise  and  certain  products  a  price  rise  of  allmost  40%  which  will  be  seen  in  2nd  quarter  earnings  can  initiate  a  buy  with  short  and  long  term  view  .this  a  personal  opinion  and  no  holding  in  the  stock",nssp,2024-09-27 07:41:00
Deepak Nitrite,"should  move  up  now,  right  time  to  buy!!!",sssjv19,2024-09-26 12:00:00
Deepak Nitrite,wait  for  next  monsoon  ..,DrA1985,2024-09-26 11:41:00
Deepak Nitrite,dn  will  head  towards  2220  before   buy  and  enjoy  profit.,faga1234,2024-09-26 09:44:00
Deepak Nitrite,buy  for  the  target  of  3230,Ayu19,2024-09-25 11:24:00
Deepak Nitrite,"Every  Dip  in  DN  would  be  a  buying  opportunity!  I  repeat,  kursi  ki  peti  baandh  Lijiye!",Balanced_Libran,2024-09-25 04:10:00
Deepak Nitrite,"Fall  is  not  over  in  Deepak  Nitrite,  100-150  rs  further  downward  fall  will  begin  from  tomorrow",sanki1978,2024-09-24 19:40:00
Deepak Nitrite,"Fall  is  not  over  in  Deepak,  more  fall  coming  in  Deepak  Nitrite,  atleast  100-  150  rs  fall  is  expected.",sanki1978,2024-09-24 19:39:00
Deepak Nitrite,those  who  want  it  to  rise  short  go  short  in  fno,ThefabulousPenguin,2024-09-22 15:41:00
Deepak Nitrite,"From  Tomorrow  onwards,  Deepak  Nitrite  upward  journey  will  start..  Just  hang  on  for  sometime",sanki1978,2024-09-21 18:57:00
Deepak Nitrite,operator  stock  hai  bhai  agar  long  karogay  to  obviously  neechay  jaayega   short  heavily  in  fno  it  will  rise  5%  in  a  single  day,ThefabulousPenguin,2024-09-21 17:10:00
Deepak Nitrite,Is  there  any  news  for  DN  as  it  is  going  downward  since  long,skp9988,2024-09-21 14:00:00
Deepak Nitrite,humlog  pichlay  2  saal  se  yahi  bata  rhay  hain  ki  short  karogay  to  ye  upar  jaayega  aur  long  karogay  to  ye  neechay   logo  ko  mazaaak  lag  rha  hai,ChachaChaudhary,2024-09-19 17:11:00
Deepak Nitrite,jaisay  hi  tum  exit  karogay  ce  ye  upar  jaayega   hold  rakhogay  to  ye  neechay  jaayega  .....1500  rupay  ka  maal  2800  mein  mil  rha  hai  samajh  nhi  aaya  kya  abhi  tak  yahan  sirf  operator  hi  hai  genuine  trader  nhi  hai,ChachaChaudhary,2024-09-19 17:09:00
Deepak Nitrite,DEEPAK  NITRITE  CHEMICAL  EXPORT  DATA  BIG  BEAT  YOY  AND  MOM  MOM  YOY  69.1%â¬†ï¸  34.43%â¬†ï¸,rock5620,2024-09-18 20:29:00
Deepak Nitrite,what  is  the  Sept  exp  prediction.  have  2200ce.,Sun_1965,2024-09-18 19:41:00
Deepak Nitrite,margins  will  tell  the  direction  of  stock  price  from  here.....,rizulagg5,2024-09-18 14:39:00
Deepak Nitrite,big  beat  export  both  MoM  and,akb89,2024-09-18 12:26:00
Deepak Nitrite,Almost  zero  debt.  Breakout  done.  Now  it  will  not  be  available  below  3000  in  next  few  trading  sessions.,Simple_tipa,2024-09-16 18:41:00
Deepak Nitrite,DN  is  on  its  way  to  achieve  its  all  time  high  and  will  give  a  breakout...2650/-  is  the  first  target..accumulate  for  a  very  good  return...,darsu48,2024-09-15 08:26:00
Deepak Nitrite,"chemical  industry  stable,  and  prices  of  chemicals  rising  many  chemical  products  have  seen  good  price  hike  deepak  nitrite  is  one  of  the  company  that  benefits  from  price  rise  as  its  products  are  seeing  price  hikes  ,as  far  the  stock  is  concerned  could  rise  to  rs  2500  however  investment  will  give  better  returns  ,other  companies  that  comes  to  notice  is  aart  ind,tata  chemicals",nssp,2024-09-15 07:35:00
Deepak Nitrite,so  chaina  s  phenol  new  capacity  absorb  chaina  new  polycarbonate  plant  absorb  so  last  75  days  phenol  prices  47%  rise.,vijay1967,2024-09-14 09:55:00
Deepak Nitrite,in  chaina  polycarbonate  plant  start  and  polycarbonate  plant  absorb  new  phenol  capacity,vijay1967,2024-09-14 09:28:00
Deepak Nitrite,its  a  time  to  buy  DN  for  a  very  good  return  in  short  term  now.  buy  on  dip  strategy.  target  2650/-,darsu48,2024-09-13 08:06:00
Deepak Nitrite,Tomorrow  Deepak  Nitrite  3000  plus,jayantijain78,2024-09-12 22:20:00
Deepak Nitrite,See  nifty  snesex  all  at  all  time  high  and  this  share  is  stuck  at  same  price  from  morning,hars1312,2024-09-12 15:05:00
Deepak Nitrite,ka  ho  gaya  bhaai  sab  ne  short  position  close  kardo  kya  ðŸ˜ðŸ˜ðŸ˜,ThefabulousPenguin,2024-09-12 15:00:00
Deepak Nitrite,"Can  Deepak  Nitrite  touch  400  plus  by  end  of  this  week,  its  in  minor  correction  need  to  see  when  the  correction  will  be  over.",sanki1978,2024-09-12 09:46:00
Deepak Nitrite,My  target  for  DN  is  2650/-  and  a  good  share  to  stock  for  long  term.,darsu48,2024-09-12 08:14:00
Deepak Nitrite,agar  short  nhi  karogay  to  ye  2800  ke  neechay  chala  jayega  so  if  u  r  bullish  keep  making  short  position,ThefabulousPenguin,2024-09-10 12:33:00
Deepak Nitrite,It  has  to  close  above  2400  to  reach  ATH,RK0079,2024-09-10 11:41:00
Deepak Nitrite,"Seems  like  all  time  high  coming  soon  .  Charts  are  strong  ,  hopefully  Q2  to  be  better  than  Q1  numbers  .  Also  PLI  announcement  from  govt  is  awaited  .",RK0079,2024-09-10 11:41:00
Deepak Nitrite,"Deepak  Nitrate  may  correct  further,  lan  accordingly  and  save  your  capital  and  maximize  profit.",stockshocks,2024-09-09 16:56:00
Deepak Nitrite,moving  up  again  no  point  of  trade  here   it  breakout  above  3000,ThefabulousPenguin,2024-09-09 12:14:00
Deepak Nitrite,"Ye  Bonus  Split  ki  baat  hawa  hawai  thee  kya,  yaa  koi  source  bhi","pkt,",2024-09-08 15:18:00
Deepak Nitrite,"proft  booking  starte  ,  maximize  your  profits  and  save  capital.",stockshocks,2024-09-08 15:03:00
Deepak Nitrite,operator  ne  puri  takat  laga  di  hai  shorter  ko  rulanay  ki  ðŸ˜¯ðŸ˜¯....ho  sakta  hai  4000  tak  pahucha  de   short  karnay  ko  koi  jaroorat  nhi  hai  ðŸ˜,ChachaChaudhary,2024-09-08 13:01:00
Deepak Nitrite,"suggested  deepak  nitrite  at  2050  levels,  giving  more  than  15  percent  return  for  short-term  traders,  keep  trailing  sl  upward.  happy  investing.",neha_0103,2024-09-08 10:06:00
Deepak Nitrite,"see  the  close  today  around  2300,  high  price",7233,2024-09-08 09:59:00
Deepak Nitrite,"start  buying  very  good  news  is  coming  in  DN  stock,may  be  bonus  and  split",shermarke,2024-09-07 13:40:00
Deepak Nitrite,"deepak  nit  stock  may  be  touch  low  level  2100  RSI,  MACD  ,  Stochastic,EMA  indicators  shows  down  trend..",silambu55,2024-09-06 23:38:00
Deepak Nitrite,but  about  crude  oil  which  has  touched  90,rohanbro,2024-09-06 23:26:00
Deepak Nitrite,srf  abhi  4  percent  down  hai  to  deepak  uncle  ko  bhi  3-4  percent  neechay  jana  chahiye  jo  abhi  khareed  rhay  hain  paisa  Bach  kar  rakhay  dip  mein  buy  karnay  ke  liye,ChachaChaudhary,2024-09-06 13:19:00
Deepak Nitrite,deepak  baba  bhi  kitna  hi  operate  karengay  Aaj  pura  market  hil  gya  hai,ChachaChaudhary,2024-09-06 13:03:00
Deepak Nitrite,Aaj  operator  bhi  delivery  buying  nhi  karega  itni  jyaada  kyunki  market  is  seeing  crash  like  selling,ChachaChaudhary,2024-09-06 12:54:00
Deepak Nitrite,technically  its  a   2900  market  is  falling  without  any  reason  which  very  dangerous  thing,ChachaChaudhary,2024-09-06 11:58:00
Deepak Nitrite,Haan  lag  rha  hai  yahan  koi  fund  buying  active  hai,ChachaChaudhary,2024-09-06 11:22:00
Deepak Nitrite,2  sellers  for  every  buyers  again  for  today  keep  buying  calls  option  today  also,ThefabulousPenguin,2024-09-06 11:03:00
Deepak Nitrite,chacha  short  srf  very  weak  as  I  told  earlier  3  percent  down  hai  srf,ThefabulousPenguin,2024-09-06 10:40:00
Deepak Nitrite,supply  has  started  it  will  soon  be  below  2900   Sako  to  bacha  lo  capital,ChachaChaudhary,2024-09-06 10:19:00
Deepak Nitrite,buy  3000  strike  call  option  its  very  cheap,ThefabulousPenguin,2024-09-05 14:31:00
Deepak Nitrite,now  20  rupees  down  from  days  high  buy  the  dip  add  more  call  options  long  futures,ThefabulousPenguin,2024-09-05 14:30:00
Deepak Nitrite,its  down  10  rupees  now  buy  the  dip  add  more  longs  buy  more  calls,ThefabulousPenguin,2024-09-05 14:27:00
Deepak Nitrite,there  is  2  sellers  for  every  buyer  in  market  depth  it  should  fall  10  percent  soon,ThefabulousPenguin,2024-09-05 12:45:00
Deepak Nitrite,"morgan  stanley  ,clsa  ,sebi  ,lic  sab  compromised  hain  rotten  market",ThefabulousPenguin,2024-09-05 12:39:00
Deepak Nitrite,ismein  400-500  crore  ki  supply  aayegi    itna  operator  aur  morgan  stanley  dono  nhi  buy  kar  payeingat,ChachaChaudhary,2024-09-05 10:32:00
Deepak Nitrite,who  will  buy  for  3300  Morgan  Stanley  or  retailers    ...  1000  crore  ki  buying  to  deepak  ntr  ko  hi  chahiye  hogi,ThefabulousPenguin,2024-09-04 22:58:00
Deepak Nitrite,"Morgan  Stanley  prefers  Deepak  Nitrite  with  overweight  call,  target  raises  to  Rs  3,295  from  Rs  2,975",kamal20,2024-09-04 17:30:00
Deepak Nitrite,Morgan  Stanley  gave  target  of  3300.....,May257,2024-09-04 17:04:00
Deepak Nitrite,hard  core  bulls  should  sell  only  below  2800   for  few  days  this  fake  spike  will  be  sold  into,ChachaChaudhary,2024-09-04 15:05:00
Deepak Nitrite,what  a  nice  rally.  please  check  and  update  new  targets.,Spirit_Man,2024-09-04 14:38:00
