Stock,Comment,Commented By,Timestamp
Deepak Nitrite,short  deepak  baba  for  2960  levels  now  very  weak  ....technical  its  a  sell  for  today,ChachaChaudhary,2024-09-04 13:40:00
Deepak Nitrite,deepak  ntr  is  70  rupees  above  yesterday  close  for  now  reason   rejected  increase  in  anti  dumping  duties  for  chemicals  but  still  operator  is  creating  fomo  it  should  be  down  100  rupees  today  instead  of  rising,ThefabulousPenguin,2024-09-04 13:01:00
Deepak Nitrite,no  retailers  left  on  this  forum  means  its  been  abandoned  by  retailers,ThefabulousPenguin,2024-09-04 12:26:00
Deepak Nitrite,its  just  fake  upmove  global  market  are  also  seeing  slowdown  .....  usa  is  falling  and  phenol  is  not  rising  sell  for  2000  level  s,ChachaChaudhary,2024-09-04 11:55:00
Deepak Nitrite,"Deepak  Nitrite  all  salling  products  average  25%  UP,  65  DAYS",vijay1967,2024-09-04 11:19:00
Deepak Nitrite,buy  deepaknntr  moved  above  20  dma  and  is  looking  very  strong,ChachaChaudhary,2024-09-04 09:39:00
Deepak Nitrite,"The  Centre  will  soon  come  up  with  a  Production-Linked  Incentive  (PLI)  scheme  for  basic  chemicals  for  the  promotion  of  the  overall  chemical  sector,  Union  minister  Mansukh  Mandaviya  said  here  on  Saturday.  Mandaviya  also  said  that  his  ministry  has  been  working  on  an  international-standard  drugs  and  cosmetic  bill  which  will  be  introduced  in  the  Cabinet  in  a  months  time  before  being  passed  in  Parliament.  He  was  addressing  members  of  the  Southern  Gujarat  Chamber  of  Commerce  and  Industry.",shermarke,2024-09-03 22:30:00
Deepak Nitrite,"ACHIEVED  3000  target  hold  it  investors  stock  for  long  term  ,  enjoy  investing  not  for  traders  and  operator.  others  pl  exit  the  forum  as  they  will  be  sad  once  it  is  3000  missing  feelings  NEXT  YEAR  4000  LONG  TERTHIS  YEAR  3500  M  10000  FOR  STBLE  MINDED  INVESTOTRS  ONLY",CBI stocks,2024-09-03 16:36:00
Deepak Nitrite,I  think  you  are  associated  with  Deepak  Nitrite  hence  speaking  the  words  on  its  behalf.  Search  your  own  how  many  companies  were  shut  down  due  to  lack  of  investors  confidence  in  India  and  also  in  abroad.  Healthy  financial  ratios  would  not  help  investors/shareholders  to  improve  their  wealth.  Kindly  note  and  stop  favoring  the  company.,maddrik007,2024-09-02 12:21:00
Deepak Nitrite,I  am  holding  Deepak  Nitrite  since  2021.  I  am  in  huge  loss.  Still  hoping  Deepak  Nitrite  rising  above  10K  before  2025.  Company  management  should  think  about  loyal  investors  and  declare  bonus  at  this  time  to  value  their  loyalty.  Else  investors  has  a  power  to  shut  down  any  company  if  company  behaves  arbitrarily.,maddrik007,2024-09-02 10:56:00
Deepak Nitrite,"Meghma  you  must  have  made  250  percent  profits  as  price  was  under  600  back  then  .  That  is  so  interesting  .  My  case  ,  have  been  holding  this  since  April  2021  ,  the  stock  keep  hovering  in  the  same  range  since  2  years  .",RK0079,2024-09-01 05:17:00
Deepak Nitrite,exclusion  from  fno.  lets  see  how  it  react,Palish,2024-08-31 16:29:00
Deepak Nitrite,Lena  bank..  Delivery  rate  tend  to  reduce  when  a  stock  is  at  higher  levels  and  it  springs  no  surprise  to  me  when  I  see  declining  momentum  in  delivery  orders..  Next  spurt  it  would  happen  only  when  positive  things  emerge  in  this  counter  and  then  we  would  see  increase  in  delivery  order,meghma,2024-08-31 16:17:00
Deepak Nitrite,My  humble  guess  is  that  someone  wanted  to  accumulate  that  is  the  result  of  present  rally.  Look  at  the  Delivery  which  is  reducing  now.  Kindly  correct  me  if  I  am  wrong.,LENABANK,2024-08-31 15:10:00
Deepak Nitrite,"What  Prabhudas  Liladhar  mentioned  has  not  come  true,  look  at  the  price  thesedays.",LENABANK,2024-08-31 15:01:00
Deepak Nitrite,dont  talk  about  profits  its  india  ðŸ˜¯  yahan  kisiko  profit  se  matlab  nhi  hai,ThefabulousPenguin,2024-08-31 14:07:00
Deepak Nitrite,"deepak  nitrite  consolidated  june  2023  net  sales  at  rs  1,768.34  crore,  down  14.07%  y-o-y",skp9988,2024-08-31 10:55:00
Deepak Nitrite,"Prabhudas  Lilladher  recommended  reduce  rating  on  Deepak  Nitrite  with  a  target  price  of  Rs  1803  in  its  research  report  dated  August  09,  2023.",skp9988,2024-08-31 10:52:00
Deepak Nitrite,how  do  you  know  its  operator  moves  and  only  how  long  is  profitable?,skp9988,2024-08-31 10:42:00
Deepak Nitrite,it  looks  like  dn  is  today  trending  in  confusing  side,skp9988,2024-08-31 10:24:00
Deepak Nitrite,dont  short  its  operator  move  u  cant  get  any  profitable  exit  in  shorts   go  long  if  want  to  trade,ThefabulousPenguin,2024-08-31 08:17:00
Deepak Nitrite,If  DN  breaks  2350  then  journey  towards  ATH  begins  .,RK0079,2024-08-31 02:46:00
Deepak Nitrite,stay  invested  sl  :  2137  target  :  2308,urwrong,2024-08-30 14:16:00
Deepak Nitrite,I  am  repeating  again  to  book  profit  as  it  may  fall  any  time,BSuba,2024-08-30 12:49:00
Deepak Nitrite,i  have  not  sorted  any  shares  .  i  am  just  sharing  my  views  as  per  technical  charts  and  brokerage  opinions.,BSuba,2024-08-30 11:59:00
Deepak Nitrite,Good  sign  that  its  sustain  above  2200.  High  chance  to  touch  2280-2300  in  few  days.,BTST_NSE,2024-08-30 11:44:00
Deepak Nitrite,deepakntr  to  2200  se  2100  ko  jagah  2232  aa  gaya.,GN80,2024-08-30 09:58:00
Deepak Nitrite,is  it  sustainable  ?,ashuOC,2024-08-30 09:53:00
Deepak Nitrite,its  a  trape  now  just  sell  to  avoid  your  loss  it  will  be  2100  or  below  that,BSuba,2024-08-30 09:50:00
Deepak Nitrite,heavy  fall  is  expected  just  book  full  profit  at  2200  and  sell  fast  at  2200  for  target  of  2100,BSuba,2024-08-30 09:26:00
Deepak Nitrite,"book  profits  &  sell  for  the  target  of  2100,  can  re-enter  at  2100  levels...  very  risky  to  buy  at  cmp.",SubhashTurimella,2024-08-30 08:53:00
Deepak Nitrite,nclrese  buy  now  good  time  to  enter  dreamflokes,SATYASATYA,2024-08-30 08:45:00
Deepak Nitrite,what  is  the  reason  for  sudden  spike  in  share  price,skapadia1,2024-08-29 21:40:00
Deepak Nitrite,buy  given  at  1960  for  Deepak  nitrite  for  target  of  2100  and  heavy  gain  today  2170  book  it  and  enjoy  one  may  not  buy  at  this  level  wait  for  2100  now.,BSuba,2024-08-29 20:49:00
Deepak Nitrite,guruz  of  market  recommending  to  reduce  the  stock  price,skp9988,2024-08-29 15:55:00
Deepak Nitrite,"Thank  you  SRF  and  deepak  nitrate  for  making  our  afternoon,  hope  you  guys  have  booked  and  trailed  the  sl  at  cost  guys.",neha_0103,2024-08-29 15:20:00
Deepak Nitrite,sell  deepak  nitrate  at  CMP  target  2100  by  today,raambharath,2024-08-29 14:41:00
Deepak Nitrite,"B&K  Sales  on  Deepak  Nitrite  1)  Phenol  acetone  prices  we  believe  have  bottomed  out  and  are  up  6%  MoM  -  key  trigger  for  the  Co.  2)  Just  like  PLI  in  IT  products,  PLI  in  base  chemicals  is  expected  soon  though  timelines  are  unknown.  3)  China  is  trying  desperately  hard  to  stimulate  its  economy  -  whether  they  will  be  successful  or  not  is  up  for  debate  but  for  now  one  is  starting  to  see  traction  in  base  chemical  prices  as  well  like  Phenol  acetone,  caustic  soda  and  soda  ash.  Commodity  Chemicals  as  a  segment  has  consolidated  for  long  -  although  the  specialty  chemicals  space  will  take  longer  to  recover,  commodity  chemicals  can  exhibit  a  quicker  turnaround.  Deepak  Nitrite  is  a  good  proxy  to  this  theme",Gujarat9999,2024-08-29 13:08:00
Deepak Nitrite,hold  kro  chaina  going  to  stop  production  world  demand  depends  upon  India,chatgpt,2024-08-29 12:48:00
Deepak Nitrite,whats  the  reason  for  such  a  spike..  should  we  book  some  profits  or  wait  .  pls  suggest  ..  retail  buyer,girishmak,2024-08-29 12:29:00
Deepak Nitrite,dont  short  u  will  get  trapped  in  operator  trap  .....  dont  get  greedy  more  u  short  higher  it  will  go,ThefabulousPenguin,2024-08-29 12:19:00
Deepak Nitrite,"there  are  other  good  stocks,  these  are  growing  girms,  market  leader  and  can  be  hold  for  very  long  term  pgel  xpro  india  rajratan  global  wire  trident  sfl  holding  time  can  be  5  years,  10  years  or  more  there  are  other  good  stocks,  these  are  growing  girms,  market  leader  and  can  be  hold  for  very  long  term  pgel  xpro  india  rajratan  global  wire  trident  sfl  holding  time  can  be  5  years,  10  years  or  more",jet25,2024-08-29 11:11:00
Deepak Nitrite,first  tgt  2121  if  holds  then  2168  and  then2272,sanjogn,2024-08-29 10:26:00
Deepak Nitrite,promoter  is  greedy  to  abhi  kya  karega  ðÿ˜œðÿ¤£ðÿ¤£ðÿ¤£,ThefabulousPenguin,2024-08-29 10:17:00
Deepak Nitrite,r  u  dreaming  chacha  Chaudhary,Aryan172003,2024-08-27 22:01:00
Deepak Nitrite,"Look  at  last  2  years  quartely  shareholding.  DII  holding  has  increased  considerably.  stock    moving  from  weak  hand  to  strong  hands.  Huge  accumulation  happening  for  3  years  now.
Dont  sell.  Hold  on  and  accumulate.",sumandasonly4u,2024-08-27 16:57:00
Deepak Nitrite,time  to  go  short  in  aug  futures  look  for  red  today  or  tomorrow  very  weak  no  buying,ChachaChaudhary,2024-08-27 15:02:00
Deepak Nitrite,bhai  anti  dunpingnduty  ki  positive  news  par  10  percent    gira  tha   value  buying  ki  news  par  bhi  10  percent  na  goray  look  for  2500  in  next  series,ThefabulousPenguin,2024-08-27 12:35:00
Deepak Nitrite,please  buy  as  much  as  u  can  so  that  shorts  get  stoplossed   i  will  go  short  .....,ThefabulousPenguin,2024-08-27 12:17:00
Deepak Nitrite,china  ke  rate  cut  se  to  chemicals  ka  price  upar  gaya  nhi  which  is  the  biggest  consumer  of  chemicals  usa  ke  rate  cut  se  ghanta  farak  padega  lol,ThefabulousPenguin,2024-08-27 12:06:00
Deepak Nitrite,keep  eye  on  himatsigka  textile  stock  double,mksmlr,2024-08-27 11:36:00
Deepak Nitrite,buy  Deepak  nitrite  tgt  3300  very  soon,anibillon,2024-08-27 09:51:00
Deepak Nitrite,"buy  for  2900  btst
fno  margin  shor  cover  pending",metashare,2024-08-26 13:13:00
Deepak Nitrite,buy  deepak  nitrite  around  2840  for  a  target  of  3150  in  september,ValueBuys17,2024-08-25 10:21:00
Deepak Nitrite,anti  dumping  duty  hai  tabhi  to  profit  upar  gaye  but  they  want  anti  dumping  duty  to  increase  .....  which  is  very  greedy  of  them  ......  and  this  tells  the  story  of  chemicals  sector   phenol  has  not  recovered  from  multiyear  lows  its  very  expensive,ThefabulousPenguin,2024-08-24 19:26:00
Deepak Nitrite,max  200  to  250  fall  expected  in  dn.    it  will  bounce  back  from.  this  level.  be  patience  as  my  my  view,rajveer2217,2024-08-23 19:36:00
Deepak Nitrite,bc  kya  hora  hai    ..dubadiya  sala,AmoghDigsangikar,2024-08-23 15:42:00
Deepak Nitrite,blasting  in  wrong  direction  ????,Highguy1,2024-08-23 15:26:00
Deepak Nitrite,it  can  blast  at  any  time…  buying  and  selling  are  equal…  keep  watching  for  the  blast…,ginonalex,2024-08-23 14:11:00
Deepak Nitrite,yesterday  fall  in  DN  was  trap  in  future.  it  may  fall  further  to  make  panic  but  later  it  should  test  new  high.  so  keep  patience,rajveer2217,2024-08-23 08:37:00
Deepak Nitrite,all  those  who  are  saying  chemical  stoc    k  fall  should  check  their  words.  in  chemical  sector  mutual  fund  and  fii  are  increasing  their  stake.  and  Deepak  nitrate  is  capex  is  coming  next  year.  so  it  should  test  new  high.,rajveer2217,2024-08-23 08:35:00
Deepak Nitrite,DN  moving  towards  3600  in  short  term  ..  Stay  invested,RK0079,2024-08-23 03:47:00
Deepak Nitrite,down  by  140   closed  in   stock  in  particular  cant  sustain   chemical  stocks  are  in  green,newinvestorengg,2024-08-22 20:23:00
Deepak Nitrite,with  positive  news  stocks  was  down  by  Rs  140    from  todays  high  what  the  hell  ????,AmoghDigsangikar,2024-08-22 16:27:00
Deepak Nitrite,operator  ne  to  sell  kar  kar  kay  kapde  utaar  diye  deepak  ntr  ke  look  for  2700,ThefabulousPenguin,2024-08-22 12:52:00
Deepak Nitrite,it  should  get  de  rate  if  situation  of  chemicals  in  global  markets  is  so  bad  that  it  needs  govt  to  increase  anti  dumping  duty  2000-2500  will  be  the  correct  level  s,ChachaChaudhary,2024-08-22 11:21:00
Deepak Nitrite,chemicals  companies  profits  doubling  and  more  market  cap  increasing  now  they  want  anti  dumping  duty  to  increase   greedy,ThefabulousPenguin,2024-08-22 10:02:00
Deepak Nitrite,phenol  se  bhi  govt  ne  anti  dunpingnduty  hata  di  thi  ismein  kyun  lagayegi  .....  chemicals  are  very  cheap  globally  india  need  to  o  reduce  chemicals  prices,ThefabulousPenguin,2024-08-22 09:29:00
Deepak Nitrite,buy  Himatsingka  textile  stock  shortly  double,mksmlr,2024-08-22 09:21:00
Deepak Nitrite,anti  dumping  duty  can  save  margins  of  indian  business   operator  positioned  yesterday  only,ChachaChaudhary,2024-08-22 08:54:00
Deepak Nitrite,Tujhe  kitna  knowledge  hai  SEBI  chief  kes  resign  chahiye,Mrtnjaya,2024-08-20 23:23:00
Deepak Nitrite,as  i  have  said  there  is  no  recovery  in  chemicals  prices  globally  since  last  2  years  .....  all  seems  like  a  fluke  to  me,ThefabulousPenguin,2024-08-13 12:23:00
Deepak Nitrite,"if  iran  israel  conflict  starts  again,  crude  oil  prices  can  increase  impacting  deepak  bottomline...  short  term  guys  can  put  sl  of  2840",Anupam777,2024-08-13 11:47:00
Deepak Nitrite,"i  guess  due  to  expected  war  between  israel  and  iran  and  consequent  surge  in  crude  oil  price,  may  impact  deepak  nitrate  bottomline.  short  term  guys  can  keep  sl  of  2840.",Anupam777,2024-08-13 11:46:00
Deepak Nitrite,why  sudden  fall.  Any  specific  reason.,darisa,2024-08-13 10:52:00
Deepak Nitrite,sebi  chief  should  resign  it  cant  even  stop  insider  trading  and  front  running  by  promoters,ChachaChaudhary,2024-08-12 22:21:00
Deepak Nitrite,Strong  and  positive  commentary  at  earnings  call.  HOLD  tightly  for  steady  growth  with  TP  of  3850  by  end  of  Q3.,chitgo,2024-08-08 16:15:00
Deepak Nitrite,Go  to  Mirea  s  m.stocks.,Abulkahar,2024-08-07 10:36:00
Deepak Nitrite,no  signs  of  recovery  in  phenol  and  other  chemicals  so  just  liquidity  rush  it  might  be,ThefabulousPenguin,2024-08-05 23:08:00
Deepak Nitrite,Tomorrow  the  concall  is  there  at  3  pm  will  be  interesting  to  hear  what  commentary  the  mgt  gives.  Dont  forget  chemical  stocks  are  rebounding  and  next  quarter  should  be  even  stronger  so  declines  can  be  used  to  add.  Even  the  promoter  has  bought  in  June  end  above  2500  so  that  gives  a  good  amount  of  confidence.  Lot  of  shorts  were  built  up  today  as  futures  have  gone  into  a  discount  for  sept  and  Oct.  Any  short  squeeze  and  we  could  see  a  upward  rally.,ahuja.12,2024-08-05 21:45:00
Deepak Nitrite,Results  are  not  bad  but  global  factors  coupled  with  geo  political  tensions  will  bring  the  price  down  by  at  least  10  percent  from  current  level,chitgo,2024-08-05 20:35:00
Deepak Nitrite,"yoy  increase  in  np  and  topline.  qoq  topline  up  but  np  not  comparable  since  there  was  a  exceptional  item  of  a  insurance  claim  recd  last  qtr.  Company  on  track  to  do  well  as  phenol  prices  have  hit  record  high,  mkt  is  turbulent  can  show  strength  once  dust  settles  around  us  markets.",ahuja.12,2024-08-05 20:22:00
Deepak Nitrite,Deepak  Nitrite  Q1  Results  Profit  Rises  35,jayantijain78,2024-08-05 20:14:00
Deepak Nitrite,"please  share  the  latest  updates  about  the  q1  results,  revenue  np  and  EPS  etc",katariya4me,2024-08-05 18:37:00
Deepak Nitrite,"ACHIEVED    3000  target  hold  it  investors  stock  for  long  term  ,  enjoy  investing  not  for  traders  and  operator.  others  pl  exit  the  forum  as  they  will  be  sad  once  it  is  3000  missing  feelings
NEXT  YEAR  4000
LONG  TERTHIS  YEAR  3500
M  10000  FOR  STBLE  MINDED  INVESTOTRS  ONLY",CBI stocks,2024-08-04 22:38:00
Deepak Nitrite,"achieved    -3000  target  hold  it  investors  stock  for  long  term  ,  enjoy  investing  not  for  traders  and  operator.  others  pl  exit  the  forum  as  they  will  be  sad  once  it  is  3000  missing  feelings

next  target  is  3500  this  year  
4000  next  year  
10000  long  term
only  for  investors  with  stable  mind  set",CBI stocks,2024-08-04 22:34:00
Deepak Nitrite,Deepak  Nitrate  cloud  has  reached  to    a  level  to  burst  anytime….  Not  the  GOd  but  can  tell  you  it  will  burst  soon.,MoMultiplier,2024-08-02 07:16:00
Deepak Nitrite,then  when  it  falls  please  tell,aksiitg,2024-07-31 22:23:00
Deepak Nitrite,"Deepak  nitrate  is  2533  percent  over  valued  and  its  fair  price  is  Rs  117  .  Visit  Simply  wallst
What  is  the  Fair  Price  of  DEEPAKNTR  when  looking  at  its  future  cash  flows.

2533  percent  Overvalued  Current  Price  Rs  3092
Fair  price    Rs  117.",MoMultiplier,2024-07-31 21:25:00
Deepak Nitrite,kitna  insider  trading  ho  rha  hai  idhar  result  nhi  aa  rha  hai  par  upmove  daily  aa  rha  hai  promoter  bhi  khareed  rha  hai,ThefabulousPenguin,2024-07-31 15:35:00
Deepak Nitrite,It  will  definitely  fall  and  retest  2900  level  before  result,aksiitg,2024-07-31 11:35:00
Deepak Nitrite,moreover  chemicals  are  back  in  action.  hopefully  it  will  also  give  good  returns.,Mandeep3,2024-07-31 11:14:00
Deepak Nitrite,moreover  chemicals  are  back  in  action.  hopefully  it  will  also  give  good  returns.,Mandeep3,2024-07-31 11:08:00
Deepak Nitrite,moreover  chemicals  are  back  in  action.  hopefully  it  will  also  give  good  returns.,Mandeep3,2024-07-31 11:05:00
Deepak Nitrite,"5  August  ko  hai  results,  hooe  for  the  best  results",katariya4me,2024-07-31 02:06:00
Deepak Nitrite,3600  coming  soon  then  4200,RK0079,2024-07-30 16:59:00
Deepak Nitrite,"price  of  phenol  is  at  an  all  time  high,  benzene  price  at  an  all  time  low.  results  are  going  to  be  fantastic.  Rerating  in  this  counter  after  results.  stay  tuned.",rock5620,2024-07-30 15:42:00
Deepak Nitrite,why  is  Deepak  flying.......  are  very  good  results  expected.....,rizulagg5,2024-07-30 15:15:00
Deepak Nitrite,deepak  nitrate  target  4520,ajapatel,2024-07-25 15:01:00
Deepak Nitrite,INVESTORS  AND  STOCK  MARKET  INVESTORS  WTSUP  GROUP  BY  CLIK  ON   to  this  new  research  India  is  going  to  witness  its  biggest  potential  growth  run  in  midcap  stocks  this  decade  clik  on,bsbhx,2024-07-25 11:10:00
Deepak Nitrite,why  any  specific  reason,jayantijain78,2024-07-23 22:31:00
Deepak Nitrite,"Don’t  sell  this  stock  …  it  is  portfolio  stock  long  term  investors  will  b  rewarded,  but  when  company  will  give  bonus  issue  so  huge  reserves  …  In  AGM  investors  should  raise  this  question.",ssm58,2024-07-18 17:12:00
Deepak Nitrite,"abhi  quarterly  result  aayega..  150-200  neeche  jane  m  time  nhi  lagega...
history  can  be  check..",mayamk,2024-07-16 13:54:00
Deepak Nitrite,"DN    sustaining  above  the  first  resistance  of  2700  .  Moving  towards  the  second  resistance  of  3020  .  Once  it  is  taken  out,  this  stock  will  be  ready  to  achieve  4700",RK0079,2024-07-15 19:31:00
Deepak Nitrite,3000  within  week  deepakntr,invincible8298,2024-07-14 19:02:00
Deepak Nitrite,"Stake  increased  by  Promoters,  FIIs,  DIIs  and  public  holding  reduced  for  this  April-June  2024  quarter...",Adg1975,2024-07-14 16:35:00
Deepak Nitrite,4000  coming  soon  in  this  counter,RK0079,2024-07-12 03:50:00
Deepak Nitrite,whatever  it  cross  profits  will  go  southwards  only  should  test  1500  ......  wait  for  china  to  shut  down  for  any  growth  in  deepak  ntr,ThefabulousPenguin,2024-07-09 13:03:00
Deepak Nitrite,Buy  DEEPAKNTR  above  2733  with  SL  2695  Target  2790,RaviKumar11,2024-07-09 10:11:00
Deepak Nitrite,definitely  deepak  nitrate  may  cross  2800  level,aksiitg,2024-07-06 16:25:00
Deepak Nitrite,very  soon  2990  touch  deepak  nitrate  tightly  hold  this....,hp31,2024-07-06 01:31:00
Deepak Nitrite,arey  bhaai  saab  waah  aaj  kr  din  upar  chala  gaya  2200  ke  neeche  jana  tha,ThefabulousPenguin,2024-07-05 09:44:00
Deepak Nitrite,itnay  Mehnegay  mein  kaun  buy  kar  rha  hai  bhai  itna  paisa  kahan  se  latay  hain  log,ThefabulousPenguin,2024-07-04 11:33:00
Deepak Nitrite,look  for  2200  again  dont  worry  it  will  rally  upto  2200,ThefabulousPenguin,2024-07-02 19:25:00
Deepak Nitrite,china  fir  se  band  ho  gaya  kya  jo  deepak  nitrite  upar  ja  rha  hai.....  achi  comedy  ho  rhi  hai  india  mein,ThefabulousPenguin,2024-07-02 19:24:00
Deepak Nitrite,something  big  is  cooking  Promoter  incredibly  increasing  stake  &  Lic  increasing  stake  big  gonna  happen  ????????,sanjubly,2024-06-30 18:06:00
Deepak Nitrite,Promoter  bought  1.46  lakhs  shares  from  open  market,RK0079,2024-06-28 23:26:00
Deepak Nitrite,buy  more  or  just  hold  on  will  go  up  to  2700  within  2  months,Visionbright,2024-06-28 12:45:00
Deepak Nitrite,buy  for  short  term  target  of  ₹2600.  wait  and  watch,NamitC,2024-06-24 15:58:00
Deepak Nitrite,how  about  jayshree  chemicals  any  call  on  that,pnbalways,2024-06-21 09:19:00
Deepak Nitrite,"214  pe  liya  tha  2019  me,abhi  kitna  bhage  ga  adhe  bech  diye  1800  pe  uske  badd  3000  hoke  aaya",anilpharma11,2024-06-20 18:21:00
Deepak Nitrite,only  retailer  selling  happening  as  the  top.  have  the  potential  to  move  another  10  %  in  2  days  Target  2800,Deepak4116,2024-06-20 14:52:00
Deepak Nitrite,Will  see  more  sellers  from  here  you  can  try  on  every  high  STAY  TUNE  WITH  THIS  OR  MORE  INFORMATIONPINGG  ON  WHTSZAP  EiGHT  44549  TW0  056..,mahi_cash79,2024-06-19 22:57:00
Deepak Nitrite,good  stock  for  investment.  itmay  go  soon  its  all  time  high,harshadmehtaa1992,2024-06-11 14:15:00
Deepak Nitrite,2700  is  next  target  buy  and  hold,wdf1234,2024-06-11 10:19:00
Deepak Nitrite,buy  at  current  rate  with  a  target  of  2449.,faga1234,2024-06-03 09:35:00
Deepak Nitrite,"deepak  nitrite  to  acquire  narmada  thermal  power  in  rs  61.65  cr  cash  deal  deepak  nitrite  said  the  acquisition  is  expected  to  be  completed  by  june  30.  ntppl  is  not  carrying  any  business  at  present.  it  has  industrial  land  of  around  125  acres  in  bharuch,  gujarat.",kamal20,2024-06-01 10:21:00
Deepak Nitrite,Buyers  are  increasing  will  move  to  2450,faga1234,2024-05-31 15:31:00
Deepak Nitrite,bus  ye  ab  support  p  hi  h  i  think  ye  ab  ekdum  se  hi  spike  krega  upr  ki  terf,sairav,2024-05-30 13:51:00
Deepak Nitrite,"pahle  2210  herdel  tha,  ab  22  bhi  ambuja  ki  deewar  ban  gayi  h..",kk05,2024-05-30 11:29:00
Deepak Nitrite,ye  share  aaj  2210  cross  nahi  kar  sakta...  chahe  nifty  positive  hi  close  kyu  na  ho  jaye,kk05,2024-05-30 11:09:00
Deepak Nitrite,what  is  happening.  is  it  applied  for  ibc?  why  continuously  falling.,darisa,2024-05-30 09:29:00
Deepak Nitrite,big  short  build  up  in  this  one.  this  month  has  been  terrible  tomorrow  is  monthly  closing  and  we  can  see  a  juicy  short  squeeze.,ahuja.12,2024-05-29 09:34:00
Deepak Nitrite,I  fill  this  will  close  in   see  what  happens,nicknamemitul,2024-05-28 12:22:00
Deepak Nitrite,60-70  rs  fall  expected  from  here..  this  will  the  last  fall  before  deepak  nitrite  takes  on  a  big  move  upward,sanki1978,2024-05-27 12:15:00
Deepak Nitrite,ha   after  10  years  it  will  reach  3000,newinvestorengg,2024-05-27 12:13:00
Deepak Nitrite,Such  falls  are  to  remove  weak  players  .  this  eventually  has  to  reach  3000,RK0079,2024-05-25 01:23:00
Deepak Nitrite,as  mentioned  yesterday  dead  cat  bounce  expected.  bullish  only  if  crosses  2400  today,naveendembla1968,2024-05-24 11:48:00
Deepak Nitrite,by  end  of  next  week  expect  deepak  nitrite  to  touch  minimum  2500  rs  for  sure,sanki1978,2024-05-24 10:09:00
Deepak Nitrite,"deepak  nitrite  will  recover  next  week,  expect  minimum  2500  rs  by  end  of  next  week.  fall  was  just  temporary",sanki1978,2024-05-24 10:04:00
Deepak Nitrite,"Shares  slipped  over  5  percent,  extending  losses  from  the  previous  session  as  brokerages  retain  their  bearish  perspective  on  the  company.  The  firm  reported  an  8.5  percent  on-year  rise  in  net  profit  at  Rs  crore  for  the  March  quarter,  accounting  for  a  Rs  51.6  crore  gain  from  extraordinary  item.s  However,  discounting  the  exceptional  item  which  was  towards  claims  from  an  insurance  company,  the  net  profit  fell  14  percent  on-year  for  the  quarter.",kamal20,2024-05-23 17:52:00
Deepak Nitrite,"Deepak  Nitrite  shares  slipped  5  percent,  extended  losses  from  previous  session  as  brokerages  retain  their  bearish  perspective  on  the  company.",kamal20,2024-05-23 17:37:00
Deepak Nitrite,"Deepak  Nitrite  faced  challenging  business  environment  mainly  due  to  dumping  from  China,  Red  Sea  crisis  and  general  weakness  in  the  chemical  market.",kamal20,2024-05-23 17:37:00
Deepak Nitrite,"Deepak  Nitrite  shares  sink  7%  in  2  sessions  on  weak  Q4  report,  brokerages  bearish",kamal20,2024-05-23 17:34:00
Deepak Nitrite,Dead  cat  bounce  expected  tomorrow  as  RSI  IS  LOW,naveendembla1968,2024-05-23 16:24:00
